,text,label
2036,Makes sense that abortion is used to cover up rape and yall support a rape apologist. #NARAL,-1
2072,"RT 6 questions for politics in 2022: From control of Congress and the strength of the Biden presidency to potential Jan. 6 committee revelations and the future of abortion rights, there's a lot at stake in 2022 (Details: ",0
1902,Sure it is because abortion is just another worded for killing an innocent human life.,-2
231,"RT ""Safe abortion is health care. It saves lives."" WHO's blasted the Supreme Courts decision to end the constitutional right to abortion as a setback for the decades-long trend toward safer access ",2
868,RT Hey just a real quick reminder to folks following me: - Black Lives Matter - Trans Rights are Human Rights - Pro-Choice - Punch a Nazi I will defend my space for my friends and myself. Thank you for coming to my TED talk.,2
747,"1. Abortion is irresponsible, as it is the neglect of one's responsiblity in creating a child through killing it. If you are unable to care for the child there is always adoption, which is always a better alternative to death. The mother is responsible for giving birth.",-2
1277,Yeah but only if you're tested and on birth control I'll flood that pussy.,-9
212,"RT Pro-Womens Reproductive Rights marches nationwide show how unpopular the Alito draft is, broadly speaking. Its not like hes broadening rights & freedoms but taking them away.",2
1995,"RT Patients should never be a target for the criminal system or fear going to jail for ending a pregnancy, seeking gender affirming, or contraceptive care. Thank you and for introducing an important resolution that supports #CareNotCriminalization. ",2
1214,"RT I strongly disagree with Keller here. The Bible absolutely tells us the ""best political policy to decrease or end abortion in this country."" Here it is: Make it illegal. And punish those who still pursue it. Just laws, duly enforced. That's all over the Bible. ",-2
1063,"RT When people are forced to travel to have an abortion, often they are the most marginalized. Black and Brown folks, low income folks, sometimes minors or undocumented.",2
2000,"RT Saw ""Oh God, A Show About Abortion"" & it was GREAT. Loved this message at the end: ""We only talk about abortion when it's in crisis, when it's being legislated away... the more we talk openly and honestly about abortion, the less of a catastrophe it'll be."" Bravo @AlisonLeiby!",2
51,RT Access to medication abortion is an integral part of reproductive freedom! #AbortionIsEssential,2
3044,"as someone who is on birth control, it's not easy to obtain and it's not always effective. you can have sex on birth control and still get pregnant, every single doctor in existence would tell you that.",1
1802,How much abortion is permitted through the democrats? Is that not murder as well? Whup your childs rear end and maybe they wont come out as entitled little psychopaths. #Gunsdontkillpeople,-2
158,An important thread to read. Thank you for your bravery in sharing your very personal story. The entire argument against reproductive rights is based in theology and is a violation of every American's First Amendment rights. ,2
767,RT Joel Osteen's Lakewood Church service interrupted by abortion activists stripping down to demonstrate via @chron,0
961,"RT Our next Governor must campaign on reversing New Jersey's abortion law. It is not a matter of women's rights. The Democrats did not even put the word ""woman"" in the law. It is about killing babies.",-2
466,"If the mother would lose her life, removing the baby early, with no intention of killing it *directly*, and with every intention of giving it all the care that you can, is not an abortion.",1
2560,"Im a 48, almost 49yr old lesbian woman who had a hysterectomy at 36. I dont know if I wouldve been able to have an abortion, if ever faced with that decision, but Ill be damned if Ill stand in the way of any womans right to choose what happens to her own body!!",2
2353,"Infanticide is murder of infants. Abortion is this, but in the womb/uterus.",-2
2137,"RT Lets be honest, you never listened to Dr. Fauci or other scientists which is why were getting another wave of #COVID19. How many Texans have to die because of piss poor leadership? These lying hucksters have proven theyre not pro-life. Theyre corrupt opportunists. ",1
494,Trust me one of these can change your life 1.Manhood enlargement 2.Remove abortion bad luck spells 4.Lost lover problems 6.Job promotion spell 8.Remove bad luck Please call or Whatsapp +27677171433,-9
602,. I am not anti early abortion. Both I and the other nurse present were extremely upset. No sign of the Consultant who started it off of course. I actually think of that baby every July 1st. Wont say year in case it identifies the woman,-1
2189,RT Vote out the Texas legislature! They've members who've been in office almost 50 years now! Backwards! From TXLege: Voter Suppression Abortion Ban Book Banning Anti-LGBTQ Laws Vigilante Anti-Trans Laws Anti Sex Work Laws Delta-8 Laws Texas Legislature is AUTHORITARIAN. #TXLEGE,2
2407,"RT When one side has to incorporate bounties on women and doctors, they lose their moral superiority on the subject ",1
2112,"Honestly the abortion thing, maybe theres a power angle but its one of the few issues thats almost entirely religious.",0
49,RT Great piece about the history of medication abortion and all the regulations surrounding it. ,0
772,"RT The Virginia Senate, which has a 1 seat Democratic majority, has just shut down a Republican attempt to enact a restrictive 20-week abortion ban.",1
2587,Women have a right to abortion in MS and will basically in all states,2
184,Kruger has literally done nothing here other than describe the nature of abortion politics in the UK over the last 50 years,0
985,RT Supreme Court seems inclined to uphold Mississippi abortion law that would undermine Roe v. Wade ,0
198,Why should anyone have kids if they don't have the means to provide for them? The bible thumping anti-abortion people don't give a crap about kids born to ignorant parents.,1
2305,"Before we went to work, before we went to a football game we all needed the rich&the poor to have good bathrooms&good neighborhoods. Dad&mom birthday suit homelands. Hitler's abortion,sex, glamore show was a mistake .",-9
1134,"The Bible is very clear that God is, without question, the Creator of life, and that life begins at conception. Abortion is a grievous sin and is never God's will. Please do everything you can to create policy consistent with God's will. Thank you very much, and God bless you.",-2
644,"RT I watched a documentary about tipping points of crime, one big factor for the decrease in crime in the 90s is Roe v Wade. Less unwanted children were forced into the world to be neglected and shaped into criminals. It's a 16-18 year arch from legalized abortion to drop in crime",2
2406,"RT Sign the petition to Congress: Demand abortion within reach, regardless of zip code. Sign here: ",2
2615,RT The new Texas abortion ban cant be ethical or legal!! I am outraged at this!! #TexasHatesWomen Watch. Retweet. Follow. ,2
1065,"RT Your right to essential health care like abortion cannot depend on the state you happen to be in. The federal government must act now to protect Americans rights to essential reproductive health care, no matter where they live. ",2
412,RT Finding a new city to move to is difficult. Who knew Id have to choose between an apartment and reproductive rights.,1
265,RT Hope your kid doesnt ever find your Twitter: Katie Hill saying her own pregnancy has made her even MORE pro-choice does NOT go over well via @twitchyteam,-1
2539,RT Hilarious that people who just voted to legalize abortion through all 9 months of pregnancy are now criticizing @RepBoebert,-1
1321,Guess what is legal and accessible in Jamaica? Orphanages and adoption agencies! Y'all make it seem as if dumping a child is the only alternative to abortion. ,-1
755,So vaccine mandates are an infringement of Americans but denying a womens rights to decide on an abortion is not?,2
1125,The legal restrictions upon the accessing of abortion services continues a pattern of violation of the rule of law and the EU legal order in Poland - and also of states (such as UK) failing to uphold their obligations under intl law eg UN CEDAW. ,2
2306,Fuck that. Condoms work just fine. Her ass should be on some type of birth control or get her tubes tied ,-1
591,"RT Texas places a $10,000 BOUNTY on anyone participating or assisting in unlawful abortion following the new law on post-six week terminations. You read this right. A bounty. There is an actual pro-life whistle-blower website. Why do you hate women so much, Texas? Are you ok?",2
2103,HE WRITES LEGISLATION THAT LEGALIZES SODOMY OF 14 YEAR OLDS AND ABORTION TO 12 YEAR OLDS SAYING DONT TELL YOUR PARENTS! LIKE A PEDOPGILE GROOMING HIS VICTIMS!,-1
1326,"Ok, fact, not an opinion Only a man and a woman can conceive. A human and a human can only conceive, a human If something is growing, it is alive. If you stop that grow, you have killed it. Killing an innocent human is murder So, abortion is murder",-2
1132,RT BREAKING: Roe v. Wade has been overturned! Babies will be saved from abortion!,-2
2298,RT .by is a transformative story about reproductive health that combined its serious matters with hilarity and inclusivity. Dont miss their upcoming bake sale which will support abortion access through @BrigidAlliance. ,2
2267,Some combination of horrible people and single issue voters who only vote for the Pro-Life candidate.,1
867,"No, the alternative is that I vote for, speak up for, and campaign for, candidates that share my views on abortion. That's how America works, pal. Maybe you should read the constitution.",0
1025,RT Dear GOP Of Texas: I WILL Stand in line for Beto if I have to. I WILL scream loudly in defiance of your draconian abortion law in red Midland TX. I WILL use my law degree to make sure other disenfranchised members of society can vote. I WILL not be afraid you! ,2
1031,"RT Just putting this out there. Abortion is never an easy choice. People don't get them just for fun, they're never fun. #AbortionIsHealthcare",2
754,"RT Legal abortion is one of the greatest public health advances weve ever had. While we now have safe abortion pills as an option no matter what, making abortion illegal is a total disaster!",2
780,"Fascinating 2c ""pro-choicers"" here jumping up & down for hours - so much nastiness. But it's hopeful that none want to come out & openly say ""abortion kills unborn babies"". An implicit admission that abortion would be horrific if that were true. A start. Next comes love of truth.",-2
2326,"2.) To clarify: I'm pro-vax; anti-mandate; and legal safe and rare for arb. You can't correlate not getting the jab directly resulting in you always dying from Covid, or spreading disease and killing another. Abortion guarantees death of a life, assuming viablity to full term.",-2
1483,Take the time to actually research how an abortion is done and what a baby looks like at 15 weeks. Arms legs head heart. The tool they use has jagged teeth that rip off its limbs and scull. Actually do the proper research. Killing babies is not cool.,-2
798,"RT #NationalStrike to demand abortion rights, healthcare for all, a living wage, and so much more. Congress is no longer a viable route.",2
633,"RT SHHHHH! Don't tell Evangelical supporters of Israel that abortion is legal there & often times is free! With taxpayer $$ funding Israel, we are proxy supporters of abortions. #GOPWarOnWomen",2
1409,"RT Katha Pollitt, a writer and longtime champion for abortion care, lays out some strategies that we can all take to increase abortion access and support folks who need help. Thanks, for shouting out The Brigid Alliance & amplifying our work: ",2
2413,"RT Ukrainian women who were raped by Russians and left to Poland cannot have abortions there. Under Polish law, abortion is allowed in case of rape, but there is no criminal case yet Psychologists in Poland are convincing her that a new life is wonderful. They destroys lives of both",2
462,I have sympathy for them but it accounts for less than 3% of abortions. Birth control prevents back door abortions. It taking responsibility before having sex. I wasn't ready to be a dad at 20 but I took responsibility for unprotected sex & have a wonderful 32 year old son.,-1
987,"RT When Roe is overturned, a multitude of arms will be needed to receive those seeking hope and guidance. Will you and your family be among them? Get equipped! #IAmProLife #LoveEveryHeartbeat #abortion ",-2
682,I see it from a pro-life perspective. Taking one's like would not justify taking another life.,-2
1007,RT If YOU think an 18 yr old is too young to own a Rifle... But a 16 yr old is mature enough to Vote... A 14 yr old is ol,-9
674,RT LIVE Chat with Fr. Frank Pavone and Janet Morana about Abortion Recovery Awareness Month! ,0
853,"RT Abortion is in fact healthcare and everyone has the right to quality healthcare. Unfortunately the right has taken over the narrative, the author of this Op-Ed is correct, it can be talked about without shame. #LiveBlue2022 #DemVoice1 ",2
1466,RT We refuse to let the U.S. Supreme Court deny women's humanity and decimate their rights! Join me in signing this statement to #RiseUp4AbortionRights Follow Join us nationwide fighting to WIN! ,2
1916,"Precisely, kill your innocent unborn child, get punished (although no law actually does that; i.e., you dont go to jail for having an abortion). Kill innocent people (including pregnant ones) with a gun, get punished. [Hint: try thinking before tweeting.]",-2
1015,RT Rove Tries To Downplay Impact Of Abortion Ruling On Midterms ,0
1907,RT Does the pope knows she wants to approve legal abortion until last day of the pregnancy???,-1
2571,RT I wish the women worried about abortion access right now had thought about this while supporting State power to control women's bodies for the past 50 years. Legal precedent has power. Empowering the government to harm women you hate also empowers it to harm YOU.,2
2514,The Life and Death of Baby Walter is Changing The Abortion Debate ,0
1129,RT Reminder: Reducing abortion through restrictions and bans should never be the goal. Instead we must center the needs of people and protect their right to bodily autonomy by expanding access to affordable and timely abortion care. ,2
319,THIS ORGANIZATION IS SICK - IT PROMOTES KILLING INNOCENT BABIES - THE GOVERNMENT SHOULD NOT BE PAYING FOR A WOMAN TO HAVE AN ABORTION - IT IS MURDER,-2
2035,We have left the negotiating table with forced birth people. We no longer have to listen to patently illogical arguments about the personhood of a fetus and waste our breath talking to a brick wall. Women will have access to abortion. Full stop.,2
2104,"RT I would never has said 2 words about Mr. Graham, if NC47 likes his very right leaning Democ",-9
2073,"RT Every day this is allowed to continue is a day too long & another day millions of Texans are denied their constitutional right to abortion. #SB8 has been in effect since 9/1/21. Since then, Texans have been forced out-of-stateas far as Californiaseeking abortion care. ",2
890,"RT Its fine. Theyll all be killed in school shootings in 5-7 years. Pro-Life, right?",1
493,"Alternatively, one can also point out the Repugnant Ugly of YOUR hypocrisy in spreading unverified info [text messages from an anonymous source that even RollingStone rejects] & the cruelty of trying to destroy a woman because she's a political opponent ",-9
3013,"Why would anyone support killing a baby?..because if you want to be honest about it, go see how an abortion is actually done.",-2
562,RT Right now outside St. Patricks Cathedral - is bringing the WOMENS RIGHTS ARE IN A STATE OF EMERGENCY!! Dont Let the Supreme Court Decimate Abortion Rights! #RiseUp4AbortionRights Find a protest & sign-up: Follow: ,2
580,"As a matter of fact, I was that child that had an irresponsible mother on drugs & other matters. I personally know of instances where abortion cause greater harm to mental health. So it's not as simple as mind own business. It has great societal impacts & needs to be addressed",-1
89,"So what you're saying is you think a person is going to voluntarily remain pregnant for 9 months. Put themselves and their health at risk, for an unwanted pregnancy when abortion is legal and 14 times safer than continuing a pregnancy and giving birth? /1",2
594,"Even if we could prove when exactly fetuses are ensouled, it wouldn't necessarily follow that you could licitly procure an abortion prior to that moment. It would still be seriously disordered act.",-1
134,RT It's voting rights or the filibuster. It's climate action or the filibuster. It's racial justice or t,-9
1269,"Not a woman. Science matters and CHROMOSOMES are unchanging, not to mention, decided at CONCEPTION! for you cruel baby killers out there. #BarbarismOfThe21stCentury #HellsGonnaBeHot #ScienceMATTERS",-2
23,Yeah just procreate more kids into poverty so they have miserable lives so you can squeeze cheap labor out of them when they're adults. Shut about abortion or adopt a kid,1
1939,"Ya know what, just like men dont get a say in abortion bc no uterus no opinion, Yous dont get a say in how us women fight back against this nonsense. Men do nothing but TAKE from us women for centuries including trying to say they are better women than us. Piss off, dude. ",2
216,"RT Biden admin is hoping US is distracted by raging inflation, rising crime, a crisis on our border, a baby formula shortage..decision by SCOTUS on abortion..so we wont notice their attempt to cede U.S. sovereignty in Geneva. Its time to raise a ruckus ",0
990,"""You said you were on birth control and said it was preferred that I came inside, so how are you supposed to get mad at me??""",-9
2428,RT I highly recommend the indie film Ask for Jane about pre-Roe days. A friend of mine nearl died from an illegal abortion. Too many people think those days are gone.,2
1258,#victims and their #children they decided to keep and raise deserve more #respect than that and don't need to feel bad about themselves because of what happened to them and don't need to ever feel like their #children doesn't matter. #abortion 3/3,1
1998,Are you a bot? Is something wrong with your reading comprehension?? COMBINABLE Birth Control. COMBINABLE = 100+% effective. 1000's of cycle apps available on your phone literally ALERT you by alarm. You are using severely outdated tropes from 1950. Join us in the modern era!,-9
489,"Im not having a kid because i dont want that kid to grow up in a world where gun rights are more important than childrens lives. Further,why is a life in the womb more valuable than the life carrying it? If you want a pro-life society, it needs to be more than just pro-birth.",2
1364,"It is going to be an abortion debate, they are still on good terms. Ramz is arguing pro life and Styx pro choice",0
2485,"RT If I were a pharmacist,I would have loved to work in a company that produce contraceptive pills like postinor and tamper with their ingredient During production of the drug.",-9
1059,"So and so, who is pro-choice, is not pro-abortion, because so and so wont get one. So and so is perceived by others that her pro-choice idea is justification for abortion, making her reap pro-abortion privilege. So and so is pro-abortion-adjacent.",0
2088,"RT If the abortion industry was opened up and laid bare for all to see, you would witness pure evil up-close and personal. Shame on the 218 democrats that voted for death today.",-2
1091,"But I do think if there's one issue that deserves it, it's abortion, because each one prevented is a life saved.",-2
288,"While I admire her strength of character in this, I would not vote for her due to her stance on abortion rights, LGBTQ issues, gun safety, and Im sure there are other issues. She is absolutely ver conservative.",1
536,"The WHPA would protect the right to access abortion care throughout the US. It would also create a national safeguard against abortion bansincluding the current ban in Texasand medically unnecessary restrictions (such as mandatory waiting periods, biased counseling, and more.",2
448,Just because a doctor is performing an abortion doesn't mean it's not also a murder as egregious as a parent doing so in their house,-2
1036,"The reason I didn't get pregnant as a teen was because of confidential birth control. Kids can make wrong decisions but they aren't *incapable* of making the right ones when you give them the info. Ultimately, they have the right to make those decisions.",1
546,RT The five pro-abortion protesters are calling it a night. They marched around Judge Barretts home for about 10 minutes. I asked if they wanted to give a comment to the press about why they came. They quickly said no. ,0
2424,supporting a women's right to decide isn't supporting abortion. it's taking the government out of women's rights.,2
472,Well I guess the next thing he did about Roe v Wade would be the first thing right? The last guy wanted his fucking wall he took it from pentagon funding. He didnt whine about two members of his own party and its happening on his watch and hes doing dick,-9
2040,RT Just Asking: Are we really going to sit back and watch the Supreme Court end access to abortion care? Dems are not powerless here. Abolish the filibuster. Codify Roe v. Wade as the law of the land. Inaction is absolutely unacceptable.,2
938,"The show was built on that stuff after a few years, so if they were going to ban all that the show wouldve been screwed. I guess abortion is still too much on the touchy side even for Family Guy. I think Family Guy has kinda calmed down with a lot of it though",0
697,"RT How many people in your parish are pro-choice, do you think?",0
155,"Okay, here goes. When the woman who is my wife and I were young, we got pregnant (we've always been in this life together). Not ready for a baby, had a lot of growing up to do. At the time we thought an abortion would be best. Later we regretted it, and we both carried pain and",-1
2591,"Exactly. Anti-abortion zealots are so driven to save the life of an unborn child...but for WHAT KIND OF LIFE? From Womb to Welfare, they dont care! ",1
4,It seems you missed a key sentence. This isnt about abortion but about control. @SteveSchmidtSES,0
2547,Common Risk factors: Sitting for long periods of time Age Prolonged bed rest/ long hospital stay Injury or surgery Pregnancy Birth control pills (oral contraceptives) or hormone replacement therapy Being overweight or obese Smoking ,-9
382,"Oh, and all requirements for immunizations for kids to attend public school can just be ignored, right, because, ya know, abortion is legal, and you can't have it both ways, right?",-1
514,"An increase in the number of failures. But even if I 3x the number of possible contraceptive failure, it still doesn't make it anywhere near the majority. I acknowledge, freak accidents can occur, but can you acknowledge, that most unplanned pregnancies are do not fall into those",-1
1233,"RT Just finished a 2-page op-ed collab w/ for WaPo soon. Its all on the chopping block: Protect trans people, marriage equality, abortion access, asylum seekers, public schools, uncomfortable history, Black & LGBTQ voices in curricula. Its happening very quickly. ",2
2093,RT One of the most disturbing things about anti-abortion bills being passed is that they're being introduced and co_-signed by women. How's that for role modeling for girls? #FreshWords,2
1188,Kay that is not what you really mean (I think like a lawyer but ethical) Abortion on Demand can never be justified Our problem is we have never proved it in US Courts/@USSupremeCourt That Unborn are living human beings: It could have been done all these years/asking Dr. this Q&A ,-1
1180,RT This week a generous donor is matching #FThon22 donations to up to $5k. Double your impact and help Texans access abortion. Help one of our fundraising TEAms reach their goal by donating at ,2
164,By supporting abortion you've outed yourself as a literal racist white woman who wants to see people of color (and poor Whites) be killed. YOU ARE A RACIST PURE AND SIMPLE,-2
2300,RT Its an awesome day to be knocking doors for & in Staffor,-9
2342,RT The right to choose is enshrined in our Constitution and protected by decades of Supreme Court precedent but Oklahoma is disregarding that and copying one of the most brutally anti-choice bills in decades. ,2
368,Yes temporary harm. Doesnt mean a mothers life is always in foreseeable danger. Foreseeable danger (high risk of dying) is a reason for abortion.,1
1956,RT Republicans are still saying were overreacting about Roe v. Wade.,1
1906,"By ""leftists,"" are you referring to the 2/3rds of Americans who support keeping abortion legal and a matter for the woman to decide for herself?",2
875,"pro choice ofc, no one else should dictate what we should and should not do with our own bodies and lives and its ridiculous that there's still a discussion around it since it certainly does not involve any change in other peoples lives on whether someone gets an abortion or not ",2
2182,You can't even stay on topic. Show me the law for ectopic pregnancies in SC. Im down for making rape laws harsher. Are you? We are talking about abortion not the .01 percent of woman that get raped and then gets pregnant. Then explain how that justifies killing an innocent baby,-2
1049,"If you look hard enough at any hot button issue you can see that the elite benefit no matter how public opinion flips. Like abortion; Ban abortion and instead of fetal tissue they get live abused/unwanted kids instead. Meanwhile, we fight over it for their amusement.",1
1086,"RT And to this I say, thank you to all who fought for womens reproductive rights, making abortion legal and SAFE! The US ca",2
