,text,label
2383,"RT Anyone see the plan laid out to raise taxes, ban abortion, sunset medicare and Social Security, and make it so trans people are no longer seen as people? #VOTE #GOP #GOPTaxPlan ",1
2535,"Simply put, Glenn Youngkin is a damned traitorous Trumpite & Dominionist in one. https://t.co/PkhlKhX7zL https://t.co/NY2GVCiDn0 https://t.co/mCHexQspsM https://t.co/4G0PKpp72I https://t.co/MrVk6CvxrK https://t.co/3i3KrRnGDS https://t.co/OMqq1ThuPP ",-9
720,The anti-abortion constitutional amendment #SB956 passed out of Committee 7-4 Thank you for working to protect Pennsylvanians,-2
103,Agreed. Most of the arguments I hear for common use abortion all revolve around the fact that the mother doesnt want to be inconvenienced and only thinks about how her decision will affect her,-1
676,"Southern border: same Gay marriage: same Budget: different priorities, buy same spending level Foreign policy: different Abortion: different, but maybe closer than modern Dems It's not a perfect match, but it largely seems closer than the current Democrat party.",0
2025,Stop with the media crap. You have you own mind. Dont you? You cant tell what side is better. Republicans say freedom of speech. Until u disagree. Then its shut up! Then freedom of choice until a women wants to get a abortion. Back the blue. Then bet them on Jan 6. Not hard. BLUE,1
1945,"RT .believes in the potential of digital health to improve HIV and sexual, reproductive health & rights in Kenya. Digital Health Week provides a platform for orgs like & many others to come together to work towards a shared goal. ",0
877,Liza Laxamana Mangubat I'm Support the Covid19 Social distancing fismash Wash your hands to continue developing Electricity Healthcare Abortion Medicare Education System Engineering Innovations science Technology I want Climate Change Global Blueprints Travel All Over the World,-9
2404,"RT The right to abortion, to privacy, to equality, to bodily autonomy should be a priority for EVERYONE - if not for women, then because our entire society and economy will be degraded if we lose #RoeVWade. There is no freedom without abortion rights. Care. #RoeAnniversary #Roe49 ",2
310,"RT Bans on abortion dont mean people wont abort, it just means more women will die due to unsafe procedures. ",2
2377,"RT Dr. Percy Julian was an American researchchemistand a pioneer in thechemical synthesisof medicinaldrugsfrom plants; from steroids to progesterone to birth control, his work laid the foundation to make ALL this happen. #BlackHistoryMonth ",-9
133,"RT The complete insanity of #GQP. Ladies and gentlemen, I give you resurgence of polio, smallpox,diphtheria, Rubella, an",-9
2012,RT Hewitt is not only anti-abortion but anti-IVF. What on earth is the Chief Executive Officer of a Women's Hospital doing cosying up with such a person to encourage breaking the law by continuing to invade female-only spaces where women and children will be vulnerable?,2
1115,"Out of the woodwork? Prolife groups that speak against aborting helpless human babies are always present evil one. And most are against democrat gun control overreach, because criminals don't follow gun control laws. The ones who scatters like roaches are pro abortion democrats. ",-2
1327,"Bloody NRA matters, GUNS, and the Almighty dollar, children are way down on the list. Pro-life my arse. ",1
275,"RT Disgusting is an understatement, @GovAbbott. Sign the petition today to show up against this unconstitutional ban on abortion.",2
2301,RT Women are (rightly) pissed off! Not only in Texas but anywhere the #AmericanTaliban think they can dictate what women can or can't do with their bodies! Take it to the streets!! #WomensMarch #WomensMarch2021 #BansOffOurBodies #AbortionIsHealthcare ,2
2017,Dear citizen attended your grievance caught 4 unsterilized dogs for birth control operation and Antirabies vaccination further they will be releasing in same area as per AWBI norms please ,-9
2455,RT Every woman should be able to make health choices for herself w/her doctor. GOP extremists are actively working to stop that. Help #RegisterDemocrats! More Dems = more 'pro-choice officials'! #BansOffOurBodies #Voterizer #OneV1 ,2
3003,"RT DO NOT FORGET! The majority of people support the right to abortion! The outcome of the #WHPA vote does NOT reflect the will of the people. We will keep fighting in Congress, state legislatures and the Courts to ensure all people can access abortion. #ActforAbortionAccess",2
2462,You do not care about protecting women if you think legal and safe abortion is disgusting,2
2183,"RT Basic health care includes access to safe, legal abortion. We must put in the work now to elect pro-health care, pro-choice leaders in 2022. Sign up to register voters: Donate to the orgs fighting to protect the right to choose: ",2
122,"Feminism has managed to smuggle abortion, one of the most aberrant, cruel and inhuman acts against a defenseless and without rights: the human embryo. Opening the debate: genocide of the gestated ",-2
402,"RT Dear #SCOTUS: #SB8 is NOT backed by science. Here's what is, according to our research: Abortion is extremely safe. Bans force people to travel across state lines. People who are denied abortions suffer significant negative consequences. #TurnawayStudy ",2
199,"RT This woman shall burn in hell for eternity for his sins against the unborn. When she breathes her last breath, Hell awaits.. Texas Abortion Provider Resumes Services After Judge Blocks Tough New Law via @Newsmax",-2
318,RT There is more evil that happens in any abortion clinic on any given day of the year than what happened at the U.S. Capitol,-2
1238,RT No-Go Zone: The Abortion Ruse Going live now: https://t.co/ymqsHTwNWi https://t.co/dOJfK9yPzf https://t.co/aFCjsLfPy6 https://t.co/akHPqVePOZ https://t.co/T2QvhpPHxd https://t.co/MnQt3Nkuxr ,0
1944,THIS! Leftist tool bags want abortion at anytime for any reason and get it by the thousands a day but they want to repeal the 2nd amendment over a mere 19 deaths how they can consolidate these beliefs defies logic!,-2
933,RT Now the same people who crucified Nyantakyi are all on social media saying they miss him. Heerrhhh hypocrisy go take we go Hell pass abortion. #savingourpassion,-9
2030,RT spend the week with us as we launch our newest mutual aid project designed to meet the moment of intersecting assaults on trans communities and abortion access centering the most marginal muslims on friday June 10th! #AllahAllowsAbortion #TransphobiaisHaram ,2
823,"Plenty of time for the UCP to get rid of Kenney (who they'll say wasn't a real Albertan anyway), elect a new leader (who'll say that HE is a real Albertan) and get a landslide victory because... Alberta, the Texas of Canada. ",-9
2367,"RT between this episode and 4th baby mama, thats all the birth control I need. #InsecureHBO",-9
154,"RT The tweet makes it seem like Neil Gorsuch is giving a speech entitled ""The End of Roe v. Wade"" that the press is banned from. A simple reading of the website shows that is not the casebut you didn't link to the agenda. ",0
381,"RT Critics say the times are too partisan and the country is too divided to reopen state constitutions for rewriting or amendments. A convention could open a Pandoras box on issues such as abortion, with proposed changes subject to ratification by voters. ",0
425,RT The Supreme Courts leaked draft decision on Roe v. Wade proves that these justices dont care much for precedent which means key climate change decisions could be next. Thats one reason why we mean it when we say: reproductive justice is climate justice. Period.,1
2095,"RT Just 5% call abortion top concern -- Sorry ABC News, who said every home is locked in on the issue. Even less whipped up about J6 hearings. It's all money, $5,000 more a year for inflation, skyrocketing interest rates, stuff people deal with every day. ",0
114,Disparage much? People rightly accept abortion because we love woman and agree they know what's best for their lives.,2
1800,RT One of the reasons I decided to finally speak was to say what I had long yearned to read: I had an #abortion because I did not want to be pregnant. Thats it. ,2
249,"RT #SistersInLaw predicted this in our last episode. I predict when a suit agst abortion ban is filed on religious grounds bec it denies abortions that are allowed under Jewish tenets, SCOTUS will not accept it as it has Christian tenets. ",0
2060,"Ectopic pregnancy is the one that can kill the mother. While the tweet in question misspoke, there are pregnancies that can cause health complications up to and including death. Prohibiting abortion is limiting healthcare.",2
2016,"Endometrial cancer, ovarian cancer, and colorectal cancer all have lowered rates in people who take oral BC. The cancers that it does have an increased risk for, decline in risk after stopping the pill. Its all here in this article. ",-9
2459,RT Theres an abortion clinic in New Hampshire that has the book for kids to read in the waiting room. Its a very disturbing book,-1
2062,"They want laws that you or I have to bury an abortion or misarrange, but they're cool with keeping them in jars in a closet or whatever.",1
1179,"RT Legal challenge to TX abortion law effectively over, say clinics after state Supreme Court ruling #JustTheNews htt",0
1000,"RT Pennsylvania VOTE for Josh Shapiro (D) for your Governor. He will lead your state with integrity and dignity. He will PROTECT the rights of Women to choose their reproductive rights, protect your privacy. He will also, appoint the next Sec.of State. ",2
1248,RT We are grateful that our petitions are being heard and we trust that the President of El Salvador is going to work to,-9
296,1st of all Native are everywhere in South America. Second of all the black population has been stuck at 16% for decades due to abortion while area just jumped in the US. ,0
534,"RT - Arkansas GOP trigger law would make it a felony to obtain an abortion - North Dakota GOP Gov. pledges a special legislative session to pass new abortion restrictions - Oklahoma GOP passes Texas-style abortion ""Bounty Hunter"" law",0
1090,"RT President Bidens State of the Union address was a welcome return to reality, compared to the prior presidents speeches. https:/",-9
420,"RT And the take is wrong at its base level. I'm no academic or scholarly researcher, so I don't have empirical data, but I don't think people whose sole issue was abortion are going to suddenly stop voting. They'll shift the goal posts and see how much farther they can go.",0
2,RT Every young person needs to know about their sexual reproductive health and rights to enable them make informed life choices. Great thanks to our dear partners and everyone that ensures that these young people access this information and service. #SafeLoveUG #10AndBold ,0
1211,Are you referring to the slaughter of the innocent via abortion?,-2
1024,i am anti-abortion anti-birth control. i only agree that if a mother is truly in danger then there may be no choice but to do the last resort,-1
517,"RT I stand with women today at 2021 Womens Marches. I will continue to support reproductive rights, equal pay for equal work, and voting rights. I am committed to passing legislation that eliminates the systematic barriers that reinforce inequality. #WomensMarch2021 #Chicago",2
2124,"RT Alberta Political Party fundraising from 2021 Q4: $2,090,873 $1,200,823 Pro-Life Alliance: $121,503 $121,108 $68,114 $43,105 More: #ableg #abpoli #cdnpoli",-9
954,"RT The reasons given in objection to the legalisation of abortion are based on stupidity and ignoranc. And we cannot make decisions that affect 50% of the demographic based on stupidity. Guys, we have brains. Please use them.",2
1936,RT Former President Trump shares his thoughts about withdrawal of US troops from Afghanistan. ,-9
1961,"Jesus didn't bring up homosexuality or abortion in his Earthly ministry, both were common practices in the Roman world. He had a lot to say about religious hypocrites who twisted scripture to oppress people.",1
1977,Apparently republicans are now mocking individual personal decisions. They control womens reproductive rights. Whats next?,2
685,I still can't believe that there are places where abortion is illegal. It seems medieval to me,2
1342,We implore the Senate to approve this necessary and commonsense package when it comes to a vote. Maryland has a huge opportunity right now to become a leader on protecting and expanding abortion access for all. Let's do this!,2
843,RT The fundamentalist christian lobby has installed these judges for just such a moment. Lets see how they fall,0
92,It is my business. Like you I once didnt care. Till I found out a child (my daughter possibly) could go to the school and they would take her to a abortion clinic. Not telling the parents or caring if they conceited. Now a medical procedure is being performed on my child.,-1
2344,And heres the reason for the abortion topic in today. ,-9
841,RT Thank you for voting today on the #WomensHealthProtectionAct. Were counting on to urge his colleagues to vote yes and ensure that abortion is protected. #WHPA ,2
2442,RT This is why we need our lawmakers to prioritize the Equal Rights Amendment and the Women's Health Protection Act. Roe must be the law of the land! #BansOffOurBodies ,2
2372,"Child care should have been taken care of long ago in this great country of ours. Were going back to anti-abortion, but the same people dont give a shit about the kids after theyre born.",1
922,Your hatred of abortion doesnt make it wrong. The fact you feel that choice is wrong for a stranger is judgmental because you dont know them or their circumstances. Do you understand that at all?,1
970,RT The anti-abortion movement has always been inextricably linked to white supremacy and racism! The vile 'great replacement' theory has propelled and invigorated this movement in recent years. ,2
694,RT Texas abortion ban has sparked an increase of 11x in the number of pregnant people travelling for a abortion. As red states pass copycat laws aimed at restricting abortion barriers and being forced to travel for healthcare will impact more people. ,2
2409,RT Lawless It's stunning. It just adds to this perception that the court is acting out of political motivations as oppose,-9
2151,RT My sister lost her babys heartbeat at 5 mos. She had to carry a dead fetus (while being monitored for sepsis) for almost 2 more mos b/c they could not legally induce an abortion at that time. Its a healthcare issue people!!!!,2
1202,"RT With abortion now illegal, true crime fans everywhere are now patiently waiting for the next episode of Dateline or 48 Hours of a man who murders his wife and/or girlfriend because hes not ready to be a father.",1
2231,Murder requires mens rea & actus reus. Abortion provides neither. Murder kills a person. A fetus is legally not a person. Murder must be illegal. Abortion is legal. Murder must not be self defense. Abortion is self defense. Murder must be malicious. Abortion is not malicious.,2
2142,"RT Everyone deserves access to abortion care, regardless of age. We will support young people in IN by continuing to offer",2
831,RT Planned Parenthood says that 65% of abortions occur in first 8 wks 91% before 13 wks So 9% Are these the ones afraid to reveal it was incest/rape? Uneducated? Poor? Who knows that 9% deserves easy access the LAW provides for safe abortion unquestionably ,1
953,RT 1 in 7 young women experience birth control sabotage which is an example of reproductive coercion a type of abuse that limits ones ability to freely and safely make decisions about ones sexual health and body. Teen girls should feel safe to make decisions about their health. ,1
36,"Abortion clinics, schools,libraries etc you knew that right ?",0
1984,"Did it start with Christians allying withe Republicans on abortion and then as Christians joined the GOP, over time the Republican party ideas moved into the church?",0
2479,RT What bias? Andrea Mitchell brought on two abortion activist to openly strategize how they could overturn Texas' new pro-life law. ,-1
502,RT #ActForAbortion! 1. Donate to abortion funds: (@AbortionFunds) 2. Save indie clinics: (@KeepOurClinics) 3. Share abortion pill info: (@ShoutYrAbortion) 4. Pass the #WHPA: ,2
336,"At least in the United States there are no laws inhibiting the treatment of ectopic pregnancies, and if a physician refuses to treat an ectopic pregnancy and a woman dies then thats not pro-life thats medical malpractice. Cant speak to other countries.",1
1232,"I take it for an antioxidant boost, since vitamin C interacts negatively w/ my birth control. Also good as an internal deodorant too!",-9
2580,Please point me to where they say we support abortion,-1
1186,"RT In Sotomayor's dissent she says that SCOTUS may look the other way, but I cannot. What we're looking at is the biggest threat to reproductive rights in years. Story by ",2
758,That starts with celebrating the fact that we as a society can legally kill an unborn baby at full term. Liberals have literally held parades in New York celebrating the ability kill a partial born child.,-2
292,"Theres no such thing as a safe abortion. A babys head is crushed, arms and legs ripped off, or the baby is poisoned or starved to death. Abortion is murder. Everybody knows it.",-2
884,"RT If you look into abortion in other species, it is a perfectly natural process. In animals in the wild as well as in hu",1
220,"RT heard someone say, ""we just don't know what's in the vaccine and we're careful about what we put into our bodies."" cool... what's in tylenol, motrin, robitussin, birth control, etc.? Tell me you twitter scientist.",-9
1999,RT Never thought I'd be having this conversation in my lifetime - but more and more of my women friends in New York are talking about setting up an underground network to help women in red states have access to abortion here. We are living the damn Handmaid's Tale!,2
400,"But youll have to endure open carry in your grocery store, antivacers, banned books, assaults on womens reproductive rights, and so on. Ill pay the taxes.",1
2273,"RT Shiiid, try protected sex w/birth control and still getting pregnant. #swimmersgonnaswim",-9
582,"RT WA state could see a 385% increase in patients seeking out-of-state abortion care if #RoeVWade is overturnedmaking it harder for patients in WA to get the care they need. We've got to do everything we can to protect the right to abortion for everyone, no matter their zip code.",2
2339,"RT Completely wrong. The moment Roe v. Wade is overturned, it's illegal to use either a morning after pill or an IUD in Missouri. Former Supreme Court clerk here. You have no idea what you're talking about. ",2
1171,Very bad decision of President Joe Biden. Joe Biden has given the permission of this way many innocent unborn baby will die. ,-2
434,"As much as I agree with your abortion view, you can't abolish this just because they disagree with your views. Your views are yours. Their views are theirs. They are just as entitled to share their views as anyone else",0
673,"RT 7 I went quickly over state supreme court elections above, so let me pause on Michigan: MI's high court, which is 4-3 Dem, is now deciding the fate of the 1931 abortion ban. That illustrates why it'd matter if the court were to flip to GOP in November. ",0
795,RT This is horrible. Abortion is murder. Abolish abortion. ,-2
1426,"RT Thank you for having me The chaos and devastation will not be restricted to Texas or Mississippi or Kentucky. This assault on abortion access, on reproductive freedom, its now everywhere. And it is all of our responsibility to fight back. BansOffOurBodies ",2
2198,RT Pro-life until it comes to actually making a living.,1
971,Women can and do change their minds after initiating chemical abortion. Help is available.,-1
1454,RT Chair did not come to play. WATCH the earrings come off while she lays out why passing the #WomensHealthProtectionAct is necessary to establish a statutory right to abortion care in every community across the country. ,2
260,"RT Fort Worth came out for the Womens March and Rally for Abortion Justice. Now we do the real work, making sure we vote for real change! #WomensMarch2021 #KeepMarching ",2
8,"Most people that have any knowledge of science or medicine at this point are thinking.... ""most of them will die before they hit 18....stupid is as stupid does... survival of the fittest...I'm making bank baby!!..This is so much easier than abortion!!""",-9
252,"RT Here's my take on this morning's discourse: If you are mad at the phrase ""pregnant people"" because you feel it excludes w",-9
1073,RT International abortion solidarity is unconditional.,2
1208,"RT Even today, abortion ranks as uh, one of the lowest reasons/indicators for politics. See here from Pew. ",0
2219,And thank you to our pro-choice network for showing up and supporting the work we're doing in Virginia. Weyou. Solidarity forever! @NARALMissouri,2
1950,Democrats figure if you don't kill babies with abortion then they'll make sure they starve them to death. Biden created the baby formula as revenge against the supreme court!,-1
304,"The killing of one human being by another is murder, live begins at conception and ends with termination. What if it were your fetus or body parts being ripped out of your mother's womb while you were alive, I'd bet you'd be against abortion then! ",-2
1853,RT Catholics Must Hold Joe Biden and Every Catholic Politician Who Supports Abortion Accountable - https:,-2
2334,"RT Less than a month after the Supreme Court refused to block a Texas anti-abortion law, providers in that state requeste",0
1370,"RT On November 1, we need you there with us to make some noise for abortion rights and access in Texas and across the U.S. Let everyone know: We are the majority, abortion is essential, and keep your bans off our bodies.1/",2
1303,RT Damn Texas! The Abortion Pill is safe. The Abortion Pill is effective. The Abortion Pill crosses state lines. The Abortion Pill rebukes the Supreme Court. The Abortion Pill saves the right of women to control their own bodies!,2
1206,"RT to anyone out there that needs an abortion, california doesnt have a resident restriction you can travel and get an abortion safely in california",2
245,RT Did you know that the rate of ER visits related to #chemicalabortion increased by 507% between 2002 and 2015? Yet the FDA recently ignored that data and relaxed safeguards on #abortionpills. Learn more about the dangers of chemical abortion in ,-1
521,"They may argue that if the mothers life is in danger, then having an abortion preserves the health or life of the mother. My argument is that these are a very small minority of abortion cases. Most do not involve a threat to the mothers life or health.",-1
2463,"Lol I just named one of many including abortion, police policies,welfare, etc. Republicans are almost always at opposition to what a majority of black people support and its not even close",2
551,"RT CALLING ALL REPRODUCTIVE RIGHTS WARRIORS! Join us TONIGHT, January 26, for Janes Army to discuss the current war on #ReproductiveRights in IL & what you can do about it! Register now at https://t.co/pHqcC9tP5c #LiberateAbortion ",2
1071,"Clot risk is less than that of birth control. I cant find a damn thing on the booster, got J&j in April and boosted before the Omicron variant came out. Everything is on 3 shots not 2. Like not even the mix and match moderna booster? Anyway, i got the shot that was available",-9
340,RT Learn more about abortion pills from our contributing editor ,0
71,"You do not think there is an actual difference on, say, the issue of abortion rights between the party that nominates Sonia Sotomayor and the party that nominates Amy Barrett?",0
1021,"RT How would this even be enforceable? Is Mary going to get control of the Illinois state police? How have we arrived at a place where the loudest, dumbest people in the room are calling the shots? ",-9
1064,Do you actually think protests are likely to make the difference in whether Manchin & Sinema support filibuster reform and federal abortion protections?,0
1128,"RT Voters who voted on the issue of abortion in 2020 voted 90-10 for Trump. Voters who voted on the issue of abortion in 2021 (when it was a more pressing issue) voted 58-41 for Youngkin. Cut the electability bs, overturn Roe and save our children.",-2
859,RT Why The Supreme Court Probably Doesn't Care What Most Americans Think About Abortion Or Gun Rights ,0
391,"RT by another amazing colleague, Dr. Jen Karlin || For abortion care, physicians may need to step aside to support patients",0
428,"The politicians who endorse pro-life are overwhelmingly not that. You've probably been told this before, but making abortions illegal will do little to reduce how many happen. If you want that you'll need to promote safe sex ed and contraception, which isn't popular in that crowd",2
279,"RT The GOP attacks on women's rights have disgusted & revolted Georgians. We support reproductive healthcare access for all people, addressing wage disparity, and taking a firm stand against violence towards women. Ready to fight back with y'all. #InternationalWomensDay",2
2545,Multiple reports suggest he sold outkick for an excess of 100m. You are one reason why Im pro choice. You clearly should have been an abortion.,1
1287,"RT There are no words. To adequately describe a draft SCOTUS opinion outlawing the right to choose. Its devastating for the millions of women who will lose the right to make their health care decisions, thanks to a partisan court. Congress must pass abortion protections. Now.",2
750,"@TheJusticeDept @POTUS Is abortion against the law in Canada? In Canada, there is no criminal law relating to abortion. Abortion care decisions are made between the woman and her health care provider, within the context of a universal health care system.",2
