,text,label
688,RT Its funny that half these people crying about vaccine mandates and loss of bodily autonomy also believe that women shouldnt have access to abortion as if the right to choose doesnt fall under bodily autonomy. Cant be for one and against the other.,2
1439,Last poll I saw abortion as a main issue was about 8% you're setting yourself up for a hard fall if you think what majority of voters are thinking about.,0
1427,Healthcare is not a right. Abortion is yhe opposite of healthcare.,-2
299,"RT Justice Sonia Sotomayor denounced her anti-women right wing colleagues for looking ""the other way"" on Texas' abortion law: ""I cannot."" ""This case is a disaster for the rule of law and a grave disservice to women,"" the justice wrote in a scathing dissent ",2
1402,RT The Fifth Circuit is set to hear oral arguments next month in a case over Texas near-total abortion ban. @CNSkirkmcdan,0
2585,"RT How many times do we have to say it, abortion is murder of a life created by God in his image...regardless of how he/she got there the fetus is still a living human being...I'm sick to death of women using abortion as a form of birth control..it's not, it's murder",-2
451,"Sire, you are one of the wisest people on the subject of Wh Sup that I have ever heard. However, I need you to show me in the King James Bible from 1611, where the Supreme Being says he approves abortions. Ici e mon proof dat u r wrong! ",-2
2070,RT The way to argue this is to point out that Abortion isnt strictly a religious issue. It is wrong to take the lives of innocent human beings Abortion takes the lives of innocent human beings Therefor Abortion is wrong (Cont)..,-2
837,"Im reading it more as if your main goal is less abortion, making it illegal wont work that well. Which feels fair. Simply working for illegal abortion = more child poverty (which in this country leads to death) and more maternal death.",2
2465,Demons live through these people. They channel beelzebub and lord of the flies. Their sacrament is abortion and genital mutilations,-2
1011,cancelled abortion. singled out trans kids. and kush still aint legal???? yeah FUCK ABBOTT ,2
1142,RT Colorado will be blue as soon as the Gov signs the bill ,-9
2374,"RT #DeathSantis #RonDeNazi #ForcedBirthDeSantis Amid abortion battle, DeSantis vetoes birth-control funding again for low income women ",2
88,"Need to rid these money sucking gynos. Theyll its normal, birth control will help you until you need to get something removed. ",0
854,"RT PRAYER WARRIORS: This leak was meant to intimidate the Supreme Court into backing down. Pray for the end of Roe v. Wade. Pray the Court will defend innocent life. Pray the Court will stand strong. Evil MUST not triumph. Science, common sense, and LIFE will win. ",-2
660,"RT What? Dd you know ""abortion"" was legal until about 1910. Did you know that the International Covenant of Political and Civil Rights is an International organization. So, does the entire International community need to rethink what rights are? Or maybe you're on the wrong side.",1
149,RT i am pro-abortion. i would like to increase the number of abortions to the exact point that everyone who wants one can get it quickly and safely.,2
408,"RT The deepest-reddest states don't have sufficient OBGYNs. They already have high maternal mortality rates. ""Anti-abortion"" rebranded to ""Pro-life"" because it market tested better; it's roots come from racism. It has never been about life. It has always been about control.",2
141,"I honestly just see a lot of scared people in this thread. It seems like the old Cons think young kids are going to vote Liberal or NDP. topics like abortion, climate change, LGBTQ rights are on young ppls minds. People like Pierre Poilievre are ruining the Fed Cons. Fact",0
2091,"RT ...Having a MAGA-hatted, racist, pro-life high school student abusing an elderly Native American was a fact too good to",-9
253,"I believe in a woman right to choose. If you want to stop abortion. Make it a law that all men have to have a vasectomy, he can reverse it when he wants to procreate. It takes two to tango.",2
2356,"RT When we share #OurAbortionStories, we help eliminate the stigma surrounding abortion. Abortion is normal. #AbortionIsHealthcare!",2
3001,"RT As an adoptee, I endorse every word of this. Opinion: Take it from an adoptee choice is what matters | CNN ",-9
743,RT These FORCED BIRTH States threatening to convict a woman who goes to another state for an Abortion are INSANE! Whats next? Convicting someone who smokes pot in CA because its illegal in their own home State? #DemVoice1 #VoteBlue2022,2
916,"RT Once people in the West realise their problems stem from Zionist control over their governments, great social movements will give birth to a new world",-9
2318,"RT banning abortions doesnt prevent abortions, it prevents safe abortions. those with money & power will always be able to find a safe abortion when they need one. criminalizing abortion is an attack on disenfranchised communities who dont have the same level of access.",2
143,"Unions mean higher wages. If your a social conservative that means one person can stay at home. It means less poverty so you'll see less crime, lower divorce rates because of the stress money problems create, less abortion because people can afford kids.",-9
375,"Love the cover but an article about ""preparing for life after Roe v Wade"" suggests women will just have to ""adjust"" to not having body autonomy. Unless the article is about how to vote out those politicians trying to control women's bodies and make medical decisions for us,no",2
1972,"RT ""We urge the Members of the Senate to stand for our nations mothers & most vulnerable unborn by rejecting this extreme nominee, & we encourage the nomination of a judge who will honor our Constitution & the right to life."" -",-2
2358,"Presidents dont make laws, as you know. But, Trump has endorsed and supported numerous pro-life candidates who wouldnt have won otherwise.",0
2400,"RT , I am a woman who defends any woman's right to CHOOSE!. I lost 5 of my 7 pregnancies by miscarriage. Two brilliant sons and Yale bunch of Grandkids..doctors, scientist, etc.The USSC should make rulings on men's reproductive rights if they wish to rule on women's! ",2
804,"RT ""This right of privacy, whether it be founded in the Fourteenth Amendment's concept of personal liberty and restrictions upon state action..[or] in the Ninth Amendment..is broad enough to encompass a woman's decision whether to terminate her pregnancy"" Roe v Wade,410 US 113, 153 ",2
712,"Nobody said you had no right to your body. Were advocating equal rights, which isnt being recognized in the case of abortion; youre denying the preborns RTL.",-2
1985,"RT There are people who have dedicated their lives to increasing access to abortions. But now is not the time to create safe spaces & do abortion charity IN PLACE of a society wide fight to keep abortion legal. If Roe falls, we are sacrificing women. We need to be in the streets.",2
230,"Forcing a woman to carry an organism in her body for 9 months she does not consent to is punishment, yes. I absolutely consider that controlling and it should be addressed, especially if access to abortion was clear and easy.",2
1162,"RT NEW: Mississippi clinic has just filed its response brief in Dobbs v. Jackson Women's Health Org, the abortion case coming",0
782,RT NEW: The demonstrations that briefly disrupted last night's abortion debate resulted in 25 cabortion rights activists getting one-year bans from the Florida House. Police also arrested a Planned Parenthood organizer. For @TB_Times: ,0
1478,"RT U.S. appeals court reinstates Texas abortion law, two days after it was halted ",0
2437,"RT The WSJs statement here about lack of medical reasoning completely misses extensive studies of chemical abortion complications. Not to mention cases of coercion, trafficking, and other malintent is not even addressed! No Rs getting off the hook with this bogus reasoning! ",1
331,"RT I know none of this matters because McConnell doesn't make up these new ""rules"" in good faith. But man, Democrats really need to recognize that's the case and exploit his twists of logic when they provide an opening like this ",-9
939,RT Forced birthers are not capable of being factual. I went to the University of Manitoba where I learned not to impose my personal views on patients and the facts about abortion. Too bad they couldn't teach you that at Oxford. ,2
1462,"and my heart goes to millions of Polish women who feel oppressed by anti-abortion laws in their homeland, homeland ruled by party that undermines democracy and the rule of law in its approach to the judiciary, media, public appointments and civic rights.",2
2414,"RT Abortion will never become unthinkable. Your movement will fail. Abortion is normal, natural Healthcare and as long as pregnancy exists so will abortion. The majority are prochoice",2
943,"RT GOOD MORNING ABORTION PROVIDERS! Today and every day we #CelebrateAbortionProviders because of their deep commitment to their communities. Theyre committed to just, liberated futures. They act with love and trust. Thank you, to everyone making abortion care possible.",2
2242,only someone who doesn't need or easily has access to abortion would say something like this.,1
348,Lol! 'Leftism is fascism'. 'Abortion isn't healthcare' You are so far gone down the Kool-aid rabbit hole it's hysterical. BUH-BYE CRAZY.,1
604,This woman is a judge and she cannot offer her opinions or thoughts on viability of an unborn baby on live television. ,0
542,They were probably doing to be losers anyway is a pretty weak justification for abortion.,-1
528,RT Nobody is happy or excited about getting an abortion. Its traumatic and often not actually by choice. Would you penalize a woman who just had a miscarriage?,1
573,"The point is that denying someone communion for supporting abortion is about theological doctrine, not politics.",0
2460,"Personally, I would choose adoption over abortion. But I appreciate having the choice. The lives of many will be harmed if #RoeVWade is overturned. More poverty. At higher costs to women, eroding equal rights. #notdemocracy",2
1496,"RT If abortion isnt healthcare why does your side pass laws that ONLY doctors can perform abortion? Doctors must have admitting privileges? The clinic must meet x-standards? Almost sounds like yes, abortion is healthcare, and you know it. ",2
1310,"RT A truly dark day in America with the news reports that the Supreme Court has voted to overturn Roe v. Wade. This year, I signed the Freedom of Reproductive Choice Act codifying a woman's right to choose into state law. New Jersey will not go backwards on reproductive rights.",2
328,"RT These pro abortion, PRO MURDER women make me sick!!!! ABORTION IS MURDER! Use birth control or keep your legs closed, GOD DOES NOT CONDONE MURDER!! You are selfish and evil to murder your own babies!!",-2
207,"RT Ahhhh, interesting that it was a Republican, anti-abortion radical, Moscow Marge. I noticed that you ignore the war crimes on murdering Ukrainian citizens committed by your best pal Putin yesterday. God you're such scum #GOP #GOPRussianAssets #GOPLiesAboutEverything #MAGA #QAnon ",-9
2302,"It belongs in the states. If your ""polls"" are correct then you have nothing to worry about if you are pro-abortion. I'm sure you would have a more respectful opinion of the Supreme Court if it was 6-3-Democrats. You are dividing this nation with this dangerous rehtoric, Juan.",0
2159,"RT Abortion is healthcare. We don't even care if you destigmatize it at this point, just legalize it for everyone to have access to safe and affordable abortions.",2
363,"RT We will be holding a special stream on THURSDAY to solve a small selection of (regular) crosswords from the These Puzzles Fund Abortion Too fundraiser. Please donate to not only support abortion access, but also get the complete pack of snazzy puzzles. ",2
3009,RT Talking to clergy here: find your local abortion access fund or Planned Parenthood. Get Plan B from them and have it in your office. THEN TELL THE PEOPLE IN YOUR CONGREGATION. Go online and tell people. You can be an access point for people who aren't safe going elsewhere.,2
278,"RT I had asked a pro-life person earlier, why do pro-life red states have highest infant mortality rates? Babies being born & letting them die, isnt ProLife.",1
599,Do you think an abortion ban will stop women from getting an abortion?,1
2600,RT this guy got this girl pregnant because she said she was wearing crop T and he thought it was a contraceptive.,-9
1819,"RT I agree that insults towards Biden should not trend on Christmas, but reject the rest of your points. True Christ",-9
977,"RT This is precisely why the recent actions (and lack of action) by their so called ""pro-life"" MLAs is abhorrent. Don't tell voters you are ""pro-life"", then vote in favour of abortion bills. Simple.",1
865,"RT They are.Remember that in many countries, as in mine, woman are still fighting for the right of abortion.Genital mutilation and forced marriage still exists.We advanced our troops but we still have to hold the ground and form trenches.We had some victories but the war isn't over.",2
2418,"RT Middle school students destroy the deadly logic of anti-abortion: ""Women are not defined by whether or not they carry a child!"" #RiseUp4AbortionRights #Green4Abortion ",2
1970,"not just the right to obtain an abortion, but take affirmative action to protect abortion as a practice.",2
357,"RT Does an abortion as a result of incest perpetuate the cycle of violence? Experts weigh in. So does a 27-year-old Green Bay-area woman. Raped by her father, she was faced with a tough decision while still a young teen. reports. ",0
2346,RT Anyone who thinks there is a right to abortion in the Constitution is not qualified to be on the Supreme Court.,-2
457,"RT The thing about crypto is that republicans will force you to give birth and then do nothing to help sustain the actual living. From denying folks basic healthcare to blocking gun control legislation at every turn, they are the most pro-death group around.",2
531,"RT Please keep in your prayers, especially for the continued virtue of fortitude. The onslaught from the pro-abortion crowd will be vicious. Pray also for all bishops in the Church, that they too may have the courage to stand up to the culture of death.",-2
1619,"Dismissing them as psychopaths, narcissists, or ignorant doesn't make them go away. Believe me, the pro-life side has tried. Not treating abortion as a solemn thing or necessary evil is not going make the 2 medical practitioners sign against you.",0
2548,Call your #Staterep and demand they introduce a ban on Abortion! Help put an end to slaughter of our children Democrats are allowing by abortion lobbyists! ,-2
97,Thats certainly a twist. Nobody wants to think of themselves as pro abortion. We just want our government to equally let people make decisions with the help of their doctors.,1
72,"RT Abortion rights led to womens advancements across society & the economy. The data is the data, says Yet in Justice Alitos draft opinion, the justices did not even consider or acknowledge the data about how this will affect women. #Velshi ",2
2559,"RT Help the women who are going to need help right now. I say this as a pro-Choice catholic, who sees this as a justice issue. A woman should have the right to do what she wishes with her body. Period. It is not for the state to decide.",2
597,"RT Gov.-elect Glenn Youngkin says he would entertain certain antiabortion legislation next year, but it is not part of his day one agenda. Gun rights appear to be on the back burner, too. ",-1
1433,RT Fight for Roe v. Wade then Democracy! #StrikeForChoice Dec. 1 Commit Now! ,2
584,"Amd that is going to change. Thanks to the precedent of overthrowing Roe v Wade. Thanks, conservatives!",1
110,"RT On #InternationalSafeAbortionDay please consider donating to your local abortion fund, which can be found here. https:",2
730,Why are bringing abortion into this?? Who is talking about abortion?? Ok I get it you support the elite class leaders... Good luck,0
901,RT Watch this week's full episode of EWTN Pro-Life Weekly here: ,0
1542,I'm a baby survivor and I should get a pass to slap any mean killers because damn isn't that game hard as hell.,-9
2484,RT Volunteer to help make Pro-Choice Missouris Annual Gala + Auction a success! A wide variety of volunteer roles and time,2
1140,RT want to help people actually get abortions? the best place to donate is to state-based abortion funds NOT national organizations. here is a link where you can split a donation between 80+ funds and customize the no. of funds and amounts: ,2
1815,"RT 14 children dead...not even a blink of the eye to the ""pro-life"" crowd.",1
1839,"A FETUS is simply a stage in the DEVELOPMENT of a HUMAN. Embryo, fetus, baby. Simple science. Abortion is the MURDER of a smaller human.",-2
595,"RT Why though? I've read a bit about the terminology around abortion and studies have shown how using TOP has the opposite effect. It pushes the narrative that ""abortion"" is dirty and something to be ashamed of & covered. It's also inaccurate coz a live birth can be considered a TOP ",1
320,RT THE AMOUNT OF PEOPLE WHO JUST WALKED OUT OF THE HALSEY CONCERT AFTER NIGHTMARE WHEN SHE SPOKE ABOUT ABORTION WAS SICKENING. FIGHT FOR WHAT IS RIGHT. #AbortionRightsAreHumanRights #MYBODYMYCHOICE #halsey @halsey,2
734,"RT Since 1973, when Roe v. Wade gave women power and autonomy over their reproductive healthcare choices, women have had: Higher relationship stability Higher wages More work experience An increase in overall health and well-being Pro-choice IS pro-life. #DemVoice1 ",2
1045,RT #ActForAbortion from wherever you are: 1. Donate to abortion funds: https://t.co/YKn9i6D8mH 2. Save indie clinics: https://t.co/7a6lRroPjl 3. Share abortion pill info: https://t.co/bjYKAwvicq 4. Women's Health Protection ActNOW! ,2
1414,RT MiQuel Davies writes that Utahns should care deeply about the fall of Roe v. Wade. ,1
76,"Always put on a condom, reproductive rights are fundamental and women are entitled to their freedom",2
2456,"Overturn Citizens United, Congress should not be allowed to take money from lobbyists/no dark money. Limit the amount of money any candidate can accept and shorten the election cycle. Congress should not be allowed to buy/sell while in office. Make abortion rights the law.",2
322,You might consider educating yourself on the facts of when and where late term abortions are allowed. ,0
1974,"The amount of dehumanization you have to do to justify abortion is extremely odd to me. See I support abortion, but I don't make the mistake of mischaracterizing it as ""a clump of cells."" Its human, but if the mother doesn't want to bear the burden of a child, she doesn't have to",-2
397,"RT Our network of reproductive rights warriors fight for reproductive health in Delaware. We can only do this work together, so join us! Fill out the form here: ",2
407,RT We're calling on Ministry of Health to suspend the launch of the Draft Reproductive Health Policy 2020-2030 until such time as when all the missing aspects of reproductive health are included in the draft particularly access to safe abortion. #RejectRHPolicy #StopTheLaunch ,2
988,And every state has the right to decided its own abortion rules.,0
471,RT There is NO right to abortion in the Constitution.,-2
2396,Oh of course that's not an acceptable or desirable outcome! It's one of the reasons I became pro-choice when I was younger. I just don't know how to fix it ,2
173,"This is beyond disgusting. The more extreme the left becomes with such foul rhetoric, the probability of more states making abortion more restrictive or illegal increases. They are immoral and stupid ",1
1359,"But now the Court appears likely to secure victories for Ginni Thomas allies in a number of highly polarizing caseson abortion, affirmative action, and gun rights: ",0
2152,RT literally dont talk to me until Ive had coffee and mt birth control and ssris ,-9
2394,RT PHOTOS: Pro-choice abortion rights activists confront a pro-life march organized by the church group Witness for Life on their way from St. Patrick's Old Cathedral to Planned Parenthood today #AbortionRights #AbortionIsHealthcare #AbortionIsEssential #WomensRights ,2
1143,RT Texas abortion law to stay in place until Supreme Court decision ,0
1043, This to the 3 of you! And the entire pious GOP. Pro-life my a! ,2
1094,"You would also have to explain how you would do an abortion with surgery, because there the fetus is expelled after making it into little pieces, that is, manipulating its body.",-1
824,RT 2 new lawsuits have now been filed against that TX doctor who said he violated the state's six week abortion law. But bo,0
491,"RT this article incorrectly frames 15 week bans as a less extreme approach so let's make one thing clear - all abortion bans are extreme, and *any* pre viability bans have the same impact: decimating access at all stages of pregnancy ",2
579,"It's not enough in Oklahoma to remove the option of abortion. They now prosecute women for being unsuccessful/flawed gestational units. Yeah, ""gestational units"". That is truly all they see women as being. ",2
600,RT THE DEMOCRAT DEMONS ARE STILL TRYING TO KILL AMERICAN CITIZENS IN THE WOMB. STOP THIS HELLISH LEGISLATION NOW! @GOPLead,-2
1468,RT And let this be a lesson for anyone who wishes to shed innocent blood. Abortion or not.,-1
7,"I am not confusing issues. I am pro-choice. Even cadavers have the right not to share their organs. I have a right to my own body. Incidentally I almost died for my baby and chose to let her live at great cost (she died anyways), but that was MY choice, & that is the whole point.",2
109,"RT Father God, we pray, save the unborn today and we pray end abortion in America in our generation! Arise Lord and save the",-2
2520,RT Will Smith one of the first males w the birth control side affects,-9
372,Wrong! I just think there it a point where abortion is being used as birth control or for the wrong reasons. I believe there RE circumstances where abortion is the answer.,-1
57,Miscarriage not abortion you dumb fuck. Still didn't read it. Still making excuses. It's not irrelevant it's a woman's bodily autonomy taken away you snake in the grass. I've sent links and you don't even read them. You are to dumb for me to even waste my time with. ,2
948,"BTW, abortion is not always a ""health choice"", but it is an inconvenience choice. Abortion should not be used as a form of birth control, but it is used that way many times...",-1
22,RT A Pro-Choice Hacking Team Defaced the Texas GOP Website. So We DMd Them via @RollingStone,0
809,"RT Austin designer + illustrator created a zine with a history of abortion restrictions in Texas & why we are marching this Saturday, October 2nd! Download the digital zine: https://t.co/Oxh6WIkIVd Join our fight for at the Texas Capitol from 9am-12pm #WMATX2021 ",2
255,RT If youre pro 2A and against any gun control -you dont get to be anti-abortion.,1
398,"RT Abortion is a fundamental right. Womens decisions over womens health care belong to women, not to extremist right-wing legislatures. Today, the Senate will vote on moving forward on the Women's Health Protection Act to protect abortion rights.",2
1903,"RT Turns out "" pro-lifers"" aren't so pro-life after all ",1
58,"RT Reminder: Mexico's Supreme Court Decriminalizes Abortion Menstruating persons in Mexico didnt win this without a fight. They organized, protested and even started riots. Lets go. ",2
1806,"and I'm glad you've been given the choice whether to have an abortion or not, sir",1
463,"RT Why, it profits a man nothing to give his soul for the whole world. But for an abortion-tainted vaccine? ",-1
663,Im old enough to remember hearing Matt on a podcast a few years ago calling for compromise on abortion,0
251,if it's that late of term the couple wasn't ever planning an abortion anyway so that's moot.,0
516,RT Abortion harms women. Abortion harms women. Abortion harms women.,-2
492,RT California Senate Advances Newsom-Sponsored Gun Bill Modeled After Texas Abortion Law Democratic lawmakers approved the rule using the mechanism of the Texas abortion restriction for what they called something that keeps us safe and not #GunLaws ,0
12,"RT Today, nearly 450 Florida clinicians from across the state, spanning the spectrum of care, sent an open letter to state lawmakers with the simple message - abortion bans like #SB146 and #HB5 harm the communities we care for. ",2
790,"Only if you de-humanize the unborn. The pro-abortion side gives zero value to a new like prior to birth, others disagree.",-2
1841,RT Going to a Planned Parenthood rally today. Hot people who support Roe V Wade will send for waters/snacks $mysticyouth h,2
2388,"Just think of this: a woman starts getting abused by her husband after she gets pregnant in Texas and tries to leave. He threatens ""you leave and I'll report you for that $10k abortion bounty"". Even if he doesn't win he can make her life a living hell. Great job.",2
2415,"RT No one should have a say in what you can/cant do with your body. Its really that simple. Especially not people who dont have wombs, or those far past the ability to birth children. You do not need to justify why you want access to abortion, because abortion is healthcare.",2
349,RT I just learned all about Birth Control in a very extensive way . I just have to say this. I will wake up everyday from now,0
538,"hey amanda I bet you were super thrilled that gave you the abortion story this morning huh, Whats next for you I wonder. In deep at 6 and 11: The benefits of open borders and UBI for all? haha",-1
