,text,label
2191,"RT DemoKKKrat Communists say: ""Spare me the bullshit about constitutional rights."" (when it comes to guns) The same DemoKKKrat Communists claim that abortion is a constitutional right. You can't be a DemoKKKrat without being a Hypocrite. ",-1
616,"So dont point fingers at the hard work, lived experiences, and compassion of abortion funds and providers in Texas who are working their asses off to find safe, sustainable, person-centered options during this chaotic time. Theyre listening to Texans, because they ARE TEXANS.",2
1276,RT Gorgeous gorgeous folxs believe its time to finally protect our fundamental right to access abortion care - whenever we may need it Gorgeous folx also sign this petition to #PassRHEANow: ,2
1013,RT Can we say THANK YOU #FDAapproves ! FDA relaxes controversial restrictions on access to abortion pill by mail ,2
223,"Assassination Martyrdom, Slaughter of Innocence anything to create animus pitting one group against another |Race Sex | Abortion |2 Amendment Guns| Power | Greed | Natural Disasters| are SHOCK DOCTRINE Naomi Klein |",-9
1490,"Do you support abortion? Same concept, my body my choice.",1
70,"I'll pick up on the point then. The goal is to make abortion unthinkable. We'd prefer women to not even attempt illegal abortions. However, in the year Roe was decided there were fewer than 100 deaths of mothers in abortions, and more were from legal than illegal.",-2
119,RT Hillary Clinton: Todays Supreme Court opinion will live in infamy as a step backward for womens rights and human rights. ,2
2359,RT Starbucks to cover travel for workers seeking abortions ,2
1160,"RT The Supreme Court created a 'vigilante' loophole. Both parties are rushing to take advantage, with at least 31 copycat bills on a range of hot-button issues. via ",0
2185,RT BREAKING: No decision on Dobbs today. Please continue praying the Supreme Court overturns Roe v. Wade. ,-2
197,RT Already seeing impacts on Georgia abortion providers even though the states law is still on pause. #gapol ,0
740,"Again, be straight, don't call it ""healthcare"" when it's not. Please tell us what abortion actually is?",-1
315,"Oh, really....Disgusting people are those who murder the unborn.... As a reputable president once said...I see the people pushing abortion have already been born. ",-2
325,RT If the Supreme Court curtails abortion rights it could flip the script on the 2022 midterm elections #7News,0
63,They wouldnt need security if not for the circumstances of his birth which is not something he can control. They should absolutely get it.,-9
835,Positions as Ratings: Abortion: Likely D Drugs: Lean R Guns: Safe D LGBT: Safe D CJ: Safe D Judges: Safe D Immigration: Safe D Taxes: Likely D Environment: Safe D Energy: Safe D Welfare: Likely D Regulations: Likely D Unions: Safe D Trade: Likely Globalist ,0
1261,RT Its funny how we shifted from abortion rights to anti gun laws in a matter of weeks ..,0
624,RT yeah bro the team i support defines my take on abortion u really hit the nail on the head here,0
765,"White women immediately ran to the streets when it got leaked Roe-v-Wade was going to be overturned, but where was this energy back in 2020? White women are doing the same shit white gays did with gay marriage.",0
83,"RT Oklahoma basically just completely banned and criminalised abortion, with no exception for rape or incest. As usual with the in the last six years, the cruelty is the point. And disrespect for the law, and women. ",2
1227,RT June 2019 - Peter Dutton says women using rape and abortion claims as ploy to get to Australia via @GuardianAus,0
2023,RT Abortion centric feminism has been so harmful to girls and women's. It c,-1
851,"Including the right to privacy, which includes the right to an abortion.",2
648,"RT Carolyn is listing many relevant issues including forced sterilisation and contraception, forced abortion, lack of access to sexual healthcare and lack of access to services designed to address gendered violence. #DisabilityRC",0
532,"Just saw him yesterday teaming up with an anti-abortion group, PreBorn",0
1123,RT Iowa Supreme Court rules abortion is NOT protected by the state's constitution ,0
958,Women still have the same rights they have always had! Abortion is not a right and Roe was a debacle case that even Ruth Bader Ginsburg said did not hold water! But I guess now all you lunatic democrats know what a woman is !,-2
1295,"The bigger issue is having to go to another state to get an abortion. With the Biden gas prices, fuel will be expensive to get there. lol",1
347,"........my God, you know shit about it do you : -NO vaxxine by definition (look it up) - MY BODY , MY CHOICE is no abortion thing, it means ALWAYS no matter what - if injecting a chemical is basis for keeping your job, its not about health - GREAT RESET do your resarch.....",0
1952,This isnt about abortion. Abortion is a result of ethics. Im asking a meta-ethical question. I am skeptical of a naturalist telling society what is and isnt ethical.,0
1333,RT Only 27% of Americans want to overturn Roe v. Wade. But thanks to GOP rigging elections they were able to pack the Supreme Court and are now on the verge of imposing their religious beliefs on the rest of us. This is TYRANNY of the minority!! #SCOTUS,2
61,"Abortion is not a crime, but it will be in Wisconsin if Roe is dismantled. Please sign the petition to #StrikeTheBan and protect abortion: ",2
925,"RT The faux intersectionality of the anti-abortion movements feminism adeptly contrasts with racist blindspots in some liberal and white pro-choice spaces. We must do better. But there is no such thing as a ""pro-life feminist"". ",1
1805,are baby killers just like Putin. NAZI support for the murder of innocent lives. #Cowards #NotOneDollar ,-2
2308,"RT The GOP tracking women and teens' menstrual cycles is so perverted there are no words. This should disgust everyone no matter your political party or gender. They have gone too FAR, and this alone should make every woman and man vote Pro-Choice down the line.",2
1305,I wonder if theyd stick by that ruling if Saudi Arabia now decided to set up some Wahhabi Madrassas in Bangor. My hunch is theyd reverse it in a 50th of the time that it took for them to reverse Roe v Wade. #ChristianAlQaeda,-9
356,RT SAN DIEGO (AP) California bill seeks to use citizen lawsuits to go after gun companies in same way Texas law targets abortion providers.,0
1368,Woke up this am & realized my old birth control device that I just started using again after 2 years is 13 min ahead & I remembered seeing your tweet !,-9
2490,Where does the Constitution allow for filthy Abortion-On-Demand ?,-2
2314,RT You cant legislate family communication ILs dangerous Parental Notifice of Abortion only serves to make the most vulnerable youth jump through legal hurdles when accessing abortion care. Tell your legislators to repeal PNA: #RepealPNA #TrustYouth ,2
736,"True, shell find some feminist dude to trick her into getting an abortion after tricking her into letting him nut inside her.",-1
2617,"RT It is hard not to feel angry, troubled, and deeply disturbed about what overturning Roe would do to women across America Sen. Chuck Schumer remarks on the millions of people in the U.S. who will be affected by the Supreme Courts decision on Roe v. Wade ",2
1990,RT FU birth control for making me want to throw up all the time ,-9
571,Like Dems praising Pence literally a week before he was calling for a national abortion ban. Holy shit.,1
719,So where would you draw the line? Following safety precautions during a pandemic? Getting vaccinated? Abortion? Sedition? Are the limits what you determine based on your values? We don't know anything about this situation but you're free to judge?,0
900,Yes this is why cannot over turn roe v Wade glad we agree,2
461,"RT If Roe v. Wade is overturned, every person on dialysis needs to sue anyone who is a match to demand their kidney. Same for liver lobes. And blood, platelets, and bone marrow. The court will have said you have no bodily autonomy if another life depends on your body parts.",2
635,"RT .Dani Newsum & ""If, as is expected, the Courts anti-abortion radicals leave it up to state legislatures to determine the legality of an abortion, it is mission critical that #coleg act now to protect abortion rights."" #copolitics ",2
1027,I'm still looking for his stats on abortion among black Americans.,0
1355,"RT ""The main solution that white supremacists want for Black women having babies is to sterilize them, not to give them the freedom of their reproductive rights. It's a movement to dominate people."" An important listen from ",2
711,"That's how it works in Idaho. My body, my choice when it comes to vaccines & masks. Also your body, my choice when it comes to masks, reproductive healthcare/abortion, sexual orientation, reading material, etc",1
1411,"RT Abortion is so horrific. Everything about it - the poisoning of babies, dismembering the limbs, crushing skulls, the cove",-2
1930,"RT If individual liberty means anything, it has to include the freedom of every woman to make her own reproductive and health choices. In the days ahead, we must continue the fight to codify the right to choose. ",2
560,"RT GOOD NEWS! We know this isnt the end but thank you to everyone who continued to fight for Kentuckians' right to safe, legal abortion. ",2
1042,"The Bible makes it crystal clear that God views abortion as murder. But why would you care about that Eric, the married man who had an affair with a Chinese spy.",-2
81,This isnt the 18th century. People have sex for pleasure not for reproduction. Abortion is healthcare! ,2
2483,RT Republicans voted down funds to address the baby formula shortage after celebrating the Supreme Court leak signaling the rollback of 50 years of reproductive rights. It appears that Republican concerns for human life start at conception and end at birth. ,1
2421,I hope you feel the same way about abortion since it's a woman's autonomy over her own body.,2
2475,Non-steroidal anti-inflammatory drugs (NSAIDS) frequently help reduce the pain and work best when taken at the first sign of pain. Other treatments that can help include hormonal treatments such as birth control pills and vaginal rings. ,-9
550,"RT Our mission is to protect and promote the culture of #life, #religiousliberty, and traditional family values. We support the #FirstAmendment, the rule of law, and most importantly, we are dedicated to the pro-life movement from conception until natural death. ",-2
2289,"RT GOOD NEWS from the FDA! In-person requirements for medication abortion are GONE. This will make a huge difference especially for rural people, POC, and people working to make ends meet. Like we said: GOOD NEWS and WELL TAKE IT!",2
1267,"Wake up Irish. DUMP Repealers, abortion pushers, killers OUT who gave 21,000 Repeal abortion killed Irish unborn babies NOW. March for Life next Saturday Dublin. Support prolife groups, TDs. Vote pro aborts, Repealers, abortion pushers, killers OUT NOW. ",-2
2450,"With that logic in tow, overturn Roe v Wade. All 7 SCOTUS justices that voted in the majority, and wrote the majority opinion, were men. No uterus, no voice.",-1
267,Look at this it is disgusting. new law in Colorado that allows women to get an abortion up to the moment of birth and denies the rights of pre-born babies. They are sick,-2
1335,The fact that you just rabble on like it's a good thing tells me alot . Abortion is wrong period only if the mother's life is at risk then I should happen but there are a lot of lose women out there using Abortion as an contraceptive .,-1
994,"RT ""Roe v Wade must stand. Women must not lose this right to their bodily autonomy."" Thanks to Caroline Robinson for giving us permission to publish her speech from the recent abortion rights demo in Edinburgh o ",2
852,You know someone is going to come back with but there are 3M kids killed by abortion every day nonsense. So Ill throw this out there. No one has the right to infringe or control anyone elses bodily autonomy.,2
1286,RT Access to abortion care is a constitutional right. Period. Every day this law remains in effect millions of Americans can't exercise their constitutionally protected right to abortion care and will continue to suffer. Its time to pass the #WHPA ,2
1266,"8. Was this meeting when Leo, Koch & #45 agreed to conspiracy? NB McGahn was Koch's agent. Leo brings list of conspirators to #45. Evidence of agreement? WaPo subscription allows me to share access to this gift article, at no cost to you. Read here: ",-9
1915,RT A new law is forcing the states last remaining abortion providers to shut down. #BansOffOurBodies,2
1942,So I suppose a pro abortion person would post this? Duh...no! That's the way it works. It doesn't mean its wrong. Who would YOU prefer I use as my source? Doesn't look to me like those pics are fabricated.,-9
552,"Huh? Oh, Islam is one of my false religions. Truth is, I can find good abortions, but no Jews, so basically both covenants are void. If you're saved an abortion did it. I don't save. Living God is Sin, but Just. Who knew?",0
1056,"While Colombians have gained choice in managing their health (rejoice!), England is about to...checks notes.. REVERSE the only good thing Covid has brought?! Medical abortion at home to be scrapped in September. Sigh. ",1
2228,"are you going to call for a ban on alcohol, because you know its the alcohols fault not his. Now the world knows your husband is an alcoholic and feels rules do not apply to him What if he killed a child driving drunk would you just call it late term abortion?",-9
1026,use to do a great bit where he was calling for his kids who's names were all birth control chemicals lmao,-9
1053,Im not sure she ever qualified as pro-life. I think she just shamed the national media for not covering the Gosnell arrest and trial.,0
78,"RT You are misinformed if you think that abortion is easy, efficient and non traumatic at any time whatever the circumstances. Educate yourself in the trauma that women feel for many many years after an abortion ",1
301,RT #SCOTUS must affirm the right to abortion. Thats it. Thats the tweet. #AbortionIsEssential,2
481,"similarily penalized. Same for educational opportunities. So no, it's not about being pro-life. It's about anti-women's freedom to live their lives as they, not the government, choose. Rather like the Taliban, isn't it? /end",2
955,"RT Why not, the dictator Biden will defy the Supreme Court on abortion ruling. He uses his pen to manipulate for his agenda & will defy the Constitution. Get with it, SCOTUS is not overturning abortion. It is moving the law from Fed. Gov to states where it belongs Constitutionally. ",-2
405,"RT So, I'm not Catholic, but I know that in my church if someone was openly endorsing abortion they would be disciplined. Is your church going to deny communion to the Catholic politicians who voted for this barbarism?",-2
2351,Abortion has been a commonplace act in this country your whole life.,0
860,RT Its a pity your SDLP party leadership support the abortion of disabled girls right up to birth,-1
1452,"Does this nitwit even have kids of her own? If i can't speak on abortion because i have no uterus, then a barren 304 can't speak about kids.",-1
2218,Wouldnt the contraceptive be listening to youngboy?,-9
73,"RT Repro workers have been very clear about whats needed in this moment! Donate to abortion + practical support funds. Sign up to volunteer with your local clinic or fundif it takes them a bit to get back to you, stay steady, stay patient Follow the folks whove been leading! ",2
2478,"RT The idea is to get rid of the control group, so then theres not a big enough amount of people to compare to the larger va",-9
995,"RT Disappointing, This piece adds to the gaslighting in the medicine that its antis that are the persecuted ones, when time and again, it is abortion providers that are threatened, mistreated, and fired for doing their jobs. On the anniversary of Dr. Tillers death. ",2
699,"RT I'm a white man. Let me explain why the attacks on books, Critical Race Theory, abortion, voting, congressional districts, affirmative action, LGBTQ people, and Biden's decision to appoint a Black woman to the Supreme Court have nothing to do with race or gender (1/664)",-9
762,"RT Ok, Im angry. Im angry that two excellent abortion providers are forced to crowdfund in order to open a desperately needed clinic. Im angry that theyve only raised 37k towards their 250k goal. People need to STEP UP for ",2
162,RT to on this #InternationalWomensDay Join in the streets. We REFUSE to Let the U.S. Supreme Court Deny Womens Humanity and Decimate Their Rights! ABORTION ON DEMAND AND WITHOUT APOLOGY! ,2
952,"Extreme positions on timing of abortion and supporting semi automatic weapons due to the 2nd amendment cause the problem for many. Plus, Dems wanted to pack the court and get rid of the electoral college...everyone pushes for changes when it favors them. Look at the fillibuster.",-1
2001,Plz AMPLIFY bc Only BIDEN can SCOTUS from incinerating #ReproRights! All pro-choice protesters TELL #ExecutiveOrder NOW2 #PublishERA 2SAVE #abortion #BirthControl #ERA willbasis 4Fundamental Right @VP Re ,2
941,https://t.co/lQMNG2ktqV Abortion bans are never quite bans outright: Theyre bans only on those who cannot afford to circumvent them. They privilege the affluent. They hurt the poor. People of color are disproportionately affected by these bans.,2
786,RT Congratulations to John Reynolds-Wright and Sharon Cameron at NHS Lothian/University of Edinburgh for winning our David Bromha,-9
873,RT Id like to connect two dots re the Supreme Courts logic around 1) abortion and 2) adoption. The notion that women must bring children to term specifically to place them up for adoption relies on the linked understanding of white supremacy and non-white promiscuity. 1/,2
74,"RT Court On A Hot Tin Roof: Airing Out ""The Stench"" From The Oral Argument Over Abortion ",0
621,"RT Pink Shoes provides safe medical abortion instructions and FAQs available in 27 languages as well as local abortion laws,",2
2154,RT Women do. Every day. its not at all ok for you to act like they do not exist just because they do not fit with your dishonest narrative. Fake #s from a false study that only includes positive responses wont make the women you want to erase not real. ,-9
1009,The 5 member opinion will overturn Roe. At this point theyve seen relatively muted response to allowing the abortion ban to happen in Texas so they wont have any heartburn about overturning Roe.,0
2426,"RT It should not be for men, whether pro choice or anti choice to decide on this. Men as a group will never bea",0
1005,"I don't know if this has a conclusion, save that... If you need to have an abortion, I hope you can get it safely. I hope you feel secure in your decision. I really hope you'll be ok.",2
311,That answers that. But dont say gay I guess. Dudes also way too anti-choice for me as well.,1
1084,RT Republicans are introducing harsher abortion laws than the Taliban. Remember that this November. #VoteThemAllOut2022 Are you ready fight? #RoeVsWade ,2
984,If men took some responsibility this whole abortion problem would be over.,0
430,"I know they exist. I wasn't for the Texas abortion ban tactics for the reasons listed and I'm not sure I'm in favor of Newsome mirroring those tactics.I believe there will be unseen,tragic consequences. Will gun nutz recognize a political ploy when they c 1 ?",1
421,RT U.S. doctors see spike in vasectomies following end of Roe v. Wade: report ,0
2275,"RT On abortion:Harris said how dare they tell women what to do with their body. Democrats didnt have an issue telling women they most get the covid vaccine; otherwise, they would lose their jobs. How many nurses lost their jobs for not taking the vaccine. Hypocrites much!!",2
124,"Does the vaccine stop COVID? No, it doesn't. Therefore, it's a personal medical decision. It's equivalent to abortion.",1
601,RT Some of the same people at the Insurrection have been harassing and targeting our members outside clinics for years. We mean it when we say that threats that target abortion clinic staff and patients are another form of hate and violence inflicted by white supremacists. ,1
2277,RT Chris Rock and the Truth about Abortion | Opinion by ,0
652,"Yes Im non-binary and had an abortion and trans people need abortion access too, this isnt just a womens issue and not all women are capable of bearing children! ",2
3010,"How about just murderers in general huh?! I cant unite with a murderer. As for baby killers, I can think of a few things Id like to do with them",-2
1088,RT Michigans abortion providers brace for a ban or a surge ,0
169,"RT WATCH: As the FL Senate prepares to vote on the strictest abortion ban in FL history, Floridians across the state are seeing this ad with a simple message: Stop Attacking Our Rights #BansOffOurBodiesFL ",0
863,"RT ""Pro-life"" policies harm pregnant people. That is why we are unapologetically pro-abortion. There's no common ground when our lives are at stake. #AbortionIsEssential ",2
144,"5th Circuit did NOT uphold the Texas abortion ban. It simply ruled that the DOJ has no standing to sue Texas, which is correct. Maybe the DOJ can file criminal charges against Texas lawmakers for treason. Read my column to understand why: ",0
17,What gave it away?! I hope yall do know Im a strong support of Roe V. Wade! ,2
921,"RT While appearing at a pro-choice event in Texas, Democrat acknowledges has overwhelming support in the part of San Antonio he representsbut declines to make an endorsement between Cisneros and anti-choice Via ",0
342,RT We had the biggest Women's March ever in 2017. We've been marching. NOW it's time to work to ELECT progressive pro-choice WOMEN at local and state levels in massive numbers. ,2
2203,RT I COULD NOT FINISH WATCHING THIS HORROR OF ABORTIONIT MADE ME ILL ,-1
1113,"RT If they can revisit Roe v. Wade, they can revisit Citizens United.",0
675,"""Pro-abortion comrade"" of course. Your kind started the culture of death in America. Find Christ and repent. ",-2
1465,"You really think women use abortion as birth control? Birth control fails, contraceptives fail, and you want to tell someone to simply not have sex? Telling people what to do w theirselves is weird & not your business. Theres people who literally DO NOT want to have kids.",2
2311,"what the fuck r u talking abt.. do u know what being conservative is.. its not abt drinking, partying, and sex.. sk (the government) is opposed to same sex marriage, abortion, etc the rights for women in sk rnt even equal. women still get discriminated over there.",1
2184,"RT Abortion is not a health care procedure, it is the purposeful killing of a baby.",-2
2148,"RT This is basic science, Unborn babies are babies and abortion takes a human life. As someone who used to call themselves a conservative, Im curious which of these statements you disagree with? ",-2
1018,"RT Who is Robert Pitman, the judge who blocked the Texas abortion bill? ",0
2146,"Abortion is covered by the scripture that says Thou Shall not kill. Just because man justifies killing babies in the womb, God still calls it murdering the innocent. ",-2
1396,"RT A girl I spoke to today: ""I would rather an abortion than the burden of a child."" Our culture has turned having the responsibility of motherhood as a crippling burden. No women needs freedom, you need PURPOSE. This is could be your highest purpose, as wife and mother.",-2
2029,"RT It's just gobsmacking that Republican lawyers have the chutzpah to say ""Roe made abortion so divisive, let's return it to the political realm where we can have a civil debate and achieve consensus""",1
1072,"Phew! For a hot second there, when they said they were going to subsidize prescription birth control, I was afraid I'd actually have to like the provincial NDP. Thanks!",1
506,"Not murder? What would you call the vast majority of abortion cases, where the mothers life isnt in danger or extenuating circumstances like rape or incest? At this point you are advocating for pure evil.",-2
38,"Fetus and Baby are semantics, meaning entirely different things.And because a Dr or Nobel Prize winner says fertilization begins the development of human life does not mean they are saying at any time of z/e/f stages it is a human being or baby or that abortion is murder.",1
1330,"Believe me, those idiots will think that is now time to campaign on banning abortion.",1
2006,"""May this water that brings a curse enter your body so that your abdomen swells or your womb miscarries. ok, that is not abortion, you say. Where in the new testament is abortion prohibited?",2
1965,RT Every time I hear a discussion on TV about Planned Parenthood or abortion rights I have to remember the states that are doing this are the same ones who dont want to give help to people who have children with needs of any kind the same people who deny assistance of any kind ,2
2439,"abortion is legal here, hope that helps, those two cunts outside the clinic dont count as a protest as nobody takes them seriously in a civilised country, we protect womens rights here",2
1949,"RT Absolutely horrifying. As a reminder: these procedures happen after the unborn baby has a heartbeat, after he or she develops pain receptors, and after the baby has arms, legs, fingers, and toes. ",-2
1344,"RT In 1970, before the Roe decision, only 11% of women had college degrees. The right to abortion has enabled millions to pursue education and careers. We cannot go back. All people deserve to choose the path that is right for them.",2
1235,"i fully emotionally understand being vaccine hesitant (though i don't logically understand being anti-vaccination). the anti-choice buttheads can go take a hike, though, obviously.",1
