,text,label
967,"Notice even lefties agree newsoms is wrong^ the thing they just can't grasp and are going to get got by is guns are a protected right, abortions aren't, Newsom and the left loses on both their arguments they'll cry after all the warnings, this will screw the gun control crowd",-2
968, How come the democrats aren't calling for gun control after the TX school shooting this time? Curious don't you think? The silence about it is deafening. Any theories? ,-1
969,"RT Like many of you, we are deeply saddened by the school shooting in Oxford, Michigan that left 4 students dead, 7 injured, and countless traumatized. One way to honor the lives lost and forever altered is to talk about how to prevent school shootings. 1/x",1
970,"Ohhh statistics! Ok now do gun deaths by country! I wonder what's the reason I hear about so many gun deaths a year, bud.",1
971," While the verdict in Kenosha will leave many Americans feeling angry and concerned, myself included, we must acknowledge that the jury has spoken. My full statement: ",-1
972," Located In Beautiful North Central Texas, Gun Nutz United/Squirrel Arms LLC, Your Friendly One-Stop Shop For:- Custom Rifles Built To Suit Your Needs!- NFA Item Transfers & Processing!- Firearms, Accessories & More! Visit: & Click ""Shop"" Today!- ",-1
973,"hell yea, cleanin my gun every morning just in case tho ",-1
974,"Your fire arms and ammo were counted and put on a list and sent to the president. Yes,your guns were regulated by the govt.They knew who had the guns and how many. There is not one single word in the 2nd amendment that states your guns can't be regulated. Thats the way it started",1
975,Don't forget Cathy McMorris Rodgers. She was opposed to the Violence Against Women Act because it was too restrictive in allowing men to get guns to shoot women. Gun rights over the right to live? What the fuck?,2
976, Daily reminder that rioter and arsonist Joshua Ziminski fired the first shot the night of the Kyle Rittenhouse attack htt,-1
977,Gun ownership and Gun Violence are two different things. We apologize Governor. If the law(s) said banded while committing a crime we would agree. Sir the criminals will continue to prey on the innocent. Simple ownership should not be a crime. We hope we don't regret this.,-1
978,"I think I'll do thata quick search shows An overwhelming majority of murders are committed by illegal gun owners . Ref. 2019 Guns in America: legal vs illegal. Oh look, legal gun owners kills shooter in Church. Looky there 95% of Chicago murdersillegal. Now U go.",-1
979,His audience understands that you can't use a self-defense plea regarding a gun you're not legally allowed to carry.,1
980,"It didn't though. You can literally 3d print a gun now anyways, no use in banning them. Also that's a one way ticket to all out civil war",0
981,Unfortunately you're right. The right to carry a gun trumps all rights to life.,1
982,"""Put the gun DOOOWWWN!"" A warning howl came from Alice, a warning that she would yell.",1
983,"The problem with your statement is it ignores any context. The majority of gun violence actually happens in the states with the strictest gun laws, meaning it's harder for law abiding citizens to obtain one, but not criminals.",0
984, Without the 2nd amendment our elites wouldn't hesitate to lock us down Australia style.,-2
985,"I clearly stated they attacked Kyle Rittenhouse, no sign is necessary. It's just dumb luck that while defending himself, Kyle also did a public service.",-1
986,Stricter gun law states have more fun violence in them,-1
987,"Maybe some of those terrorized women should buy a gun, train with it, and carry it. God made man, and woman; Sam Colt made them equal.",-1
988,RT If we shouldn't have to show ID to exercise our right to vote..Why do we have to show ID to exercise our #SecondAmendment right to keep and bear arms?,-2
989,RT So another dead young man in what will undoubtably turn out to be gang violence. How is spending Billions going after legal gun owners going to stop this? If you care about gun violence then address the actual problem. #cdnpoli ,-1
990, A footnote to my on the hazards of individual gun ownership. 1/x ,1
991,Unfortunately gun control is a loser for Democrats.,-1
992,It doesn't matter if they are ineffective. And enforcement is also a problem; the people who say that are very same members of Congress and the gun lobby who then cut BATFE budgets to make it impossible to enforce the law.,-1
993,I can chose not to eat MCDONALD'S. Gun nuts chose whether I live or die.,1
994,"a semiauto AR is not a military weapon He was defending people's home, Kenosha losses at least 50 million just due to riot damage, and i bet you have no idea how much it cost to Minneapolis. His 'victim' was felon, has pedofile and violence background, and deadly assault. so, NO",-2
995,"RT For too many kids, The Teenage Dream is shattered by school shootings. Gun violence shouldn't be part of growing up. Please share this important PSA from #TheTeenageDream ",2
996," Another week of needless gun deaths.Our inaction on gun safety, ghost guns, and gun violence has created a tragic version of Groundhog's Day.What will it take for us to wake up? ",2
997,"Maybe some of those terrorized women should buy a gun, train with it, and carry it. God made man, and woman; Sam Colt made them equal.",-1
998,RT To own a gun you must have liability insurance to protect who you might shoot...Make it happen.,0
999,The problem with your circular logic is that the dead don't get to share their side of the story. Maybe they felt threatened first? Justice isn't determined by who has the biggest gun or the fastest draw. That fucking assclown had no business driving to MY state to hunt people.,2
1000,"An ati nomad and a Hatfield sgl I've made into a pack gun. They're variants of the same base gun. Little bit of work and they fold just about in half. Hatfield has wood furniture, manual safety and a vent rib the ati is polymer with a standard barrel and no safety.",2
1001,Brazilian President: Everybody Buy a Gun  Armed People Cannot Be Enslaved by the Elites' | International | Before It's News ,0
1002,"RT Every year, 700 children in the US die by gun suicide; 350 children unintentionally shoot themselves or others; and most school shooters are students with easy access to guns at home. Yet 5.4 million children in the US live in homes with guns that are both loaded and unlocked. ",1
1003,"Because when you own a gun to protect yourself, it doesnt mean it just goes and shoots ppl. In the event you are attacked, you have your gun to protect yourself from more attack. ",-1
1004,"Yes, they're consummate A-holes. And cowards - takes a coward to need a gun",1
1005,"RT we need gun control now. kids should not have access to your guns. Innocent lives are taken bc ppl aren't responsible with their guns. there have been too many school shootings, this should not be our norm.",1
1006,"No one has machine guns. There are plenty of gun laws. However, our failed District Attorney refuses to enforce the laws...",0
1007, May the expanding danger of the Rittenhouse decision intensify the commitment of the majority  to demand change in the nation's lax gun laws.,2
1008,Gun dinosaurs are exceptional I don't know why I haven't drawn many,1
1009,"His assault on the armed men? Pointing a gun at someone is also considered assault, did you know that? So they assaulted him first. He was simply defended himself from someone pointing a gun at him",-1
1010," Call me when they acquit a 17 year old Black defendant who was armed with an AR-15 and who killed two people at a Trump rally in ""self-defense."" Until then, sorry if it's hard to believe there is anything close to a level justice field.",1
1011,The largest areas of increased violence come from cities with the strictest gun laws. BTW Trump never encouraged gun sales. You are brainwashed so just stop and do 2 minutes of research before you tweet stupid things that are easily debunked.,-1
1012,"RT how many innocent victims of guns in the home in a single year?--& many of them children, at the mercy of adults. yes, I am from a ""gun culture""; but it was a rural hunting culture, & very different from today's NRA-propaganda urging homeowners to own guns ""for protection."" ",0
1013,"       *with no supervision.. It's more dangerous than.. unrestricted firearm carry, and or no gun laws at all... --in the long run.... There must be a way to verify age restriction.. and overall dangerous content.. It isn't about free will, it's being responsible. ",2
1014,0.000056% of all gun owners. Not a very effective death cult.,-1
1015,"Texas where Guns Rule & Texans are Gunned down daily. No training, No permit, No background checks. You want a gun, you get a gun. In Texas everyone gets a gun including the good the bad & the untrained #TexasGunViolence #TexasDailyShootings",2
1016,"RT In 2019, the TSA apprehended some 4400 guns - but that was 5 guns for every 1 million passengers screened. The 4500 guns as of mid-October 2021 = 11 for every passenger screened. IE gun carrying by air travelers has doubled since before the pandemic. 5/x ",0
1017,I swear you Americans really need to change your gun laws. Any angry moron can wield one and kill needlessly. Such a bloody Shame.,2
1018,"RT Following Oxford High shooting in her district, Rep. Elissa Slotkin has authored a bill penalizing gun owners if they fail to secure a gun and a child uses it to harm themselves or others. ",1
1019,"I've watched two family members die including my husband. Rittenhouse is a sociopath. A liar, a gun toting white ring terrorist. He's not a medic as he claimed he was going to be, he's not a police officer as he said he was going to represent. He's a maniac terrorist.",1
1020,"Conservatives are anti war lol. That's why we have so many guns, so no one will start one. A gun behind every blade if grass.",-1
1021,RT We're a nation takes downtime between mass shootings to watch documentaries on creative geniuses that we lost due to gun violence. If you love the Beatles so much stop the NRA. Give Peace a Chance,1
1022,Wisconsin law needs to be changed is why #Rittenhouse got away with that murder. If you decide to be a vigilante then be prepared to die or lose everything you own because of your hatred! There's a cost to being a #Racist or #WhiteSupremacist. Buying a gun can kill you! #Aubrey,1
1023,Because he had just seen him shoot a dude and then try and flee the scene? Isn't that the sort of thing gun rights nuts say it's the right time to point a gun at someone who's in the middle of a spree with an illegally obtained gun?,1
1024," This whole I'm toting a gun, therefore I'm a patriot BS is really getting old! ",-1
1025,Disgusting. An indictment of America's gun culture. ,1
1026,Suggestion you should make a storage so people can store their guns incase they don't want to get rid of a gun they like but want to try a new one,-1
1027,You are saying its impossible to use BASIC gun safety? If you can't follow BASIC gun safety than yes. Ban all guns from movies.,0
1028,"That's an interesting comparison on Mr. N's part. An assault weapon and life, equal? Similar? I don't understand his version of logic at all.",2
1029,whos wallowing? tax cheat landlords like Eric Adams? whos wallowing? little baby piglets who insist they deserve our limitless respect cause they passed a city test & carry a gun like Eric Adams? go fuck yourself forever you dumb pig.,1
1030,"The GOP is out of step with what America wants and needs. From elections security to abortion rights, to gun controls, and addressing climate change. Mandates to save lives is a PRIORITY! and always has been until felon Trump took over.",1
1031,"How about we remove your cell phone, computers and anything elsr you use to exercise your First Amendment right to freedom of speech? Since you don't care about my Second Amendment right, I don't care about your first? How do you like them apples?",-2
1032,"The 2nd amendment was originally about militias. The Supreme Court didn't start interpreting it as an individual right to gun ownership until ""District of Columbia v. Heller"" in 2008. You can't trace that back to the tax grievances that led to the Revolutionary War.",1
1033,"Yes, I can understand your point of view. : ) GOP's got MTG, L. Bobo, all these gun nuts /wannabe celebrities that are just beyond strange. They actually seem dangerous to me.",1
1034,"RT 3,629 illegally-possessed firearms taken out of criminals hands so far this year by your NYPD cops. 37 arrests for illegally carrying a gun, this weekend alone. Now we need #consequences for the criminals who chose to carry them & put our fellow NYers at risk! ",1
1035,WHY NOT ASK THE FOLKS IN CUBA NORTH KOREA CHINA VENEZUELA IRAN UGANDA HOW THEIR TOTAL GUN CONTROL ISCWORKING OUT. ,2
1036,RT To own a gun you must have liability insurance to protect who you might shoot...Make it happen.,-1
1037,A bunch of little cry babies that can't handle real comedians. The leftist destroy everything! The take the gun away from all.,-1
1038," ...Guns in the hands of honest citizens save lives and property and, yes, gun control laws adversely affect only the law ab",-2
1039,"RT Like many of you, we are deeply saddened by the school shooting in Oxford, Michigan that left 4 students dead, 7 injured, and countless traumatized. One way to honor the lives lost and forever altered is to talk about how to prevent school shootings. 1/x",0
1040, NEW: A 19-year-old Florida college student was arrested after classmates told police he was planning a mass shooting the day before winter break. Police said the student sold his car to purchase a rifle and hundreds of rounds of ammunition. #flapol ,0
1041,"Your going to listen to idiots who want to remove your right to vote, remove your constitutional rights, let anyone carry a gun regardless of age or record,take your property if they want it by saying imminent domain, bullshit stop the republicunts now, or we all lose. ",1
1042,"There's also the near murder. The person you push and taunt all the time has a breaking point. Don't be the asshole that takes a peaceful man/woman to his/her breaking point. If he had pulled the gun himself, the destinies of the girls would have been altered forever. Wild!!!!",1
1043,RT The dismissal of the gun charge is further evidence of the corrupt and political prosecution of Rittenhouse. The gun law in question quite obviously didn't apply to Rittenhouse's circumstances and so there was no good faith basis to bring it. #MaliciousProsecution,1
1044,"RT Masking kids and forcing vaccines on healthy people with natural immunity prevents nothing and is simply politically punitive, much like gun laws that punish law abiding gun owners but do nothing to prevent crime. The left has always ignored the data. Always.",-2
1045,Is everybody forgetting about Beto? HELL YES WE'RE GOING TO TAKE YOUR AR-15's AND AK-47'a! The proposal of a public gun registry?,1
1046,"Thank you! On a related note, how difficult is it to say ""gun safety"" in place of ""gun control""? Or ""balance the Supreme Court"" instead of ""stack the Supreme Court""? It's so frustrating. ",1
1047,"While the verdict in Kenosha will leave many Americans feeling angry and concerned, myself included, we must acknowledge that the jury has spoken.",0
1048,"Both of you can threaten me with your armed militant shit all day long. Not impressed or intimidated, but apparently you guys need the assault weapons to communicate.",2
1049,Why you were there even if it was to fight doesn't matter. At the point a bullet was fired was it self defense. If I'm being chased I am going to assume someone is going to hurt me. Rosenbum should have told the police there is a guy with a gun over there.,1
1050,"RT Dear gun control advocates: People who want to kill, will kill. ",-1
1051," If the Alex Jones standard being applied in his case applied to the corporate media, Steve Scalise could sue Maddow for the mass shooting her deranged super fan went on after watching her show. I wish Scalise had sued Maddow, he should have, she incited terrorism.",1
1052,Research how many guns Americans own. Then research the gun deaths. Stop being a pigeon for the government.,1
1053,This is my rifle and this is my gun. #fullmetaljacket,-2
1054,"You're so right. Those parents need to be held accountable. They didn't pull the trigger, but they provided the gun and enable to the shooter. They caused that massacre along with their son.",0
1055, A man who survived being shot by Kyle Rittenhouse during a protest last year against police brutality in Kenosha has filed a federal lawsuit alleging police enabled the violence by allowing an armed militia to have free run of the streets during the demonstration.,0
1056,What assault weapon are you talking about. None are sold at any gun store that I know of. They would require special permitting thru the ATF with special fees required. #KnowYourRights,0
1057, Jan. 6 insurgent told police to back off because 'We all have weapons' ,1
1058,"// suicide , mass shooting threats hardblock ASAP!!! ",1
1059,"Basically the same idea as non-stop gun laws. Criminals have no problem breaking the law to murder others using a gun, but for some reason would obey the gun law. ",0
1060,"RT I joined the gun violence prevention movement because we all deserve a safer future. We've made progress, but today's SCOTUS case puts that at risk. The NRA's extreme agenda threatens our constitutional rights & public safetythe Supreme Court must reject it. #GunLawsSaveLives",-1
1061,It's not like she is black women who lied to get her child in a better school and was sent to prison! She just drove her underage son with a high powered assault rifle over state lines to murder 2 people!! Don't you see the difference?,1
1062,There is no lack of gun control already. That's not the problem.,0
1063,Off-Duty DC Officer Shoots Man in Georgetown Amid Armed Robbery: Police  - NBC4 #dmv #dmvnetwork #dmvnews ,0
1064,RT MAGA Mindset: Bringing a mask to school won't kill anyone. But they want them banned cuz it costs them freedom. Bringing a gun to school WILL kill. But they DON'T want them banned cuz that's the price of freedom Understand? I don't ,1
1065," ""Convicted pedophiles, armed with guns, stalking around Kenosha threatening to shoot people can be turned into 'peaceful protesters.' Fires that burn on camera for all to see can be erased from the collective memory."" By @DouglasKMurray",-1
1066,RT The propaganda over gun control and gun violence is aimed at the wrong direction and always has been PERIOD! How about we call it what it is gang violence and illegal gun owners cause the PROBLEMS!!! There I said it!!!! Since the so called politicians won't say it!!!! ,0
1067,RT Thank You Senator for meeting with FFX volunteers to discuss our gun violence prevention priorities this session. We are so incredibly grateful for everything you do to address this public health crisis #MomsAreEverywhere #VALeg #VAGov ,2
1068,RT Stunning how many libs really seem to believe that rioters burning down a neighborhood are not inciting violence but a lawfully armed citizen trying to put out those fires is by mere presence We are not in war of lofty ideas with the Left- We are in a war for basic truth.,-2
1069,You need someone with a gun to stop the shooter obviously. That's how this works. #ArmedGuardsInSchools,-1
1070,"No, he followed it exactly. There's no ambiguity. It's black and white. If Kyles gun was 1inch shorter, then Kyle would have broken the law. The law is actually pretty clear, check it out below. ",0
1071,"You people are idiots! Criminals and mental people will always get a gun! It's the person who did this fault, not the gun! So take away guns from law abiding people, let criminals have them and see how it goes! Ok moron!!",1
1072,"Assault rifle is a term, it's not describing the action taken with a weapon. What do you do, go around calling things ""assault hammer,"" ""assault knife,"" ""assault sedan?"" An assault rifle is a select-fire rifle.",0
1073,Or any first world country with common sense gun regulations.,1
1074,He was threatened with a gun & hit with a skateboard & kicked in the head.  I guess you base opinions from lack of info,-1
1075,"And after our piece of shit governor of California okayed the doxing of gun owners , this is no surprise.",1
1076," I just think it's insane that so many Black schools in the hood had metal detectors, but none of them EVER had a mass shooting before or after they implemented them ",-1
1077,"RT So supports : more gun control, bill c 6, carbon tax, vaccine passports am I missing anything? #VotePPC",2
1078,"RT Before the Kyle Rittenhouse trial, I had never heard of a ban on calling murder victims ""victims,"" and never saw a defendant pick jurors. I mean, that IS batshit crazy right?",-1
1079,"You haven't how their freedom from medical debt has changed how they live. We could definitely use that kind of real freedom, not the silly ""right"" to buy a gun.",1
1080,"Places with less gun control, have lower gun violence. Houston v Chicago More responsible gun owners = less gun deaths.",-1
1081," Canadian homicide rates were virtually unchanged after gun registration was introduced (151/100,000 in 1998 and 149/100,000 in 2002).",-1
1082, Texas..the state where children wearing a piece of cloth on their face to save lives is considered child abuse but regulating guns to stop school shootings is considered a violation of rights.,2
1083,"RT We are indeed at a strange impasse; the Liberal government continues to ""crack down"", hard, on legal, licensed gun owners while softening enforcement on unlicensed criminals ... what could possibly go wrong? #WhatAMess #LiberalCrime #SoftOnCrime ",2
1084,UK headed just like Australia! Too bad there's no 2nd Amendment ,-1
1085,Nobody is putting a gun to their head. They're making choices.,1
1086,"RT Lawmakers have failed us too many times, so we're going to replace them with candidates with a proven track record of fighting the gun lobby and for gun safety. Are you a or volunteer ready to #DemandASeat? Sign up at ",-1
1087,"HOW DID THEY STOP VIOLENCE BY GANGS THAT SOLD ALCOHOL DURING THE PROHIBITION? LEGALIZED ALCOHOL. YOU WILL NEVER STOP GUN VIOLENCE UNTIL YOU ELIMINATE THE THING PEOPLE ARE FIGHTING ABOUT. IF ITS MONEY, MAKE UNIVERSAL BASIC INCOME. HUMAN LIVES>MONEY. ",0
1088,"RT I just want every woman to have a gun, the world is so damn dangerous!!!",-1
1089," Shooting threat at my son's school. Fuck you, and fuck you @NRA.",2
1090,"RT Let's not allow guns in airports. No gun, no accidental discharge, no panic, no PTSD. We have choices, America",2
1091,White Las Vegas Mass Shooter Stephen Paddock Committed the deadliest mass shooting in the history of the US with 59 dead and more than 500 injured all in one day. DAMN!! ,1
1092,"His DAD lives in Kenosha, you stupid waste of oxygen. He had every right to be there. Idiot.",-1
1093,"You're so right. Those parents need to be held accountable. They didn't pull the trigger, but they provided the gun and enable to the shooter. They caused that massacre along with their son.",0
1094,"Gotta disagree with you there. The whole point of the second amendment is protecting the right of violent rebellion against an oppressive state. However in the case of #jan6 specifically, the rioters were acting from terrible motives and were incredibly incompetent to boot.",0
1095,they claimed to have fixed it but all of the gun designs in infinite are ugly and often don't even communicate function,-1
1096,I don't go places where I would obviously be assaulted cause that means I would have to hurt someone else to defend myself. Rittenhouse knew he would get to use his gun that night. He knew he was putting himself in danger. Untrained. With a gun.,1
1097,"RT off gets mad when gun calls him p'off, and he's so ready to break the machine because its causing them to fight #OffGunxMintClassOf2021 ",2
1098,Pretty simple actually Assault on energy policies Gun grabbing Cultural issues WV doesnt align with urban latte elite woke liberals,-1
1099," In Glasgow a boy involved in a fight at school returned brandishing a gun & chanted ""Allahu Akbar  I will bomb you.Police are investigating. ",1
1100,That's wrong. States with strong gun control laws have lower rates of gun mortality than states with weak gun control laws. In America gun control works.,2
1101,RT He got shot..a black gay cop saved him..still wants no sane gun laws..,1
1102,"Rosey was chasing Kyle. We don't know why, but Kyle was evading. 2.5 secs before he shot Rosey, someone behind them shot into the air. It's dark, he has no idea if Rosey is armed, but given the shot and Rosey being a wacko he does have reason to believe he may be armed.",0
1103,"RT For most of this summer, and I have been trying to learn more about the surge in gun crime in Minneapolis. What we found is that the city is on track for the most violent year in a generation. A few notes on the reporting below: ",1
1104," The suspect in the Arlington, Texas mass school shooting was a victim of bullying, according to his family. The suspect was apprehended unharmed after he turned himself in. BLM activists had wrongly predicted he would be killed for being black. ",0
1105,He was attacked & self defense was necessary! You're an idiot! Lock & Load America! Protect our 2nd Amendment Rights at all costs!,-2
1106, This is why the 2nd Amendment is non-negotiable. Don't let them Australia your America. ,-2
1107,After the Dunblane school killings in 1996 gun laws were changed in UK and we have not had any similar atrocities.,-1
1108,Don't matter if he couldn't have a gun or drove anywhere.... murder is not what happend. He DEFENDED HIMSELF. If someone breaks into your house and your kid picks up your gun and shoots the person would that make the kid a murderer?,-2
