,text,label
558," Don't care! There's much more to be concerned with in today's society! School shootings, 1/6 domestic terrorism, COLA, climate change, inflation! Shall I continue?",1
559,Thank you for standing up. We seem to be losing on the gun control. The gun lobbyist should not be able to control our Congress with money. I know our 2nd amendment states we should have the right to bear arms but kind. Stop the kill.,2
560,"Well, what steps have the US government taken to date to kerb the number of school shootings? It certainly doesn't send the message that they *don't* tolerate it.Imo, guns are not something that members of the public should have access to unless their job demands it.",2
561,He waived those rights when he threatened and attacked what he thought was a pushover with a gun,0
562,"RT NEW: A top gun-violence expert warns that America's surging gun sales and rising political extremism could spell ""disaster in the months ahead, by ",2
563,It's all good intentions I know but someone does not have to die for this to take place. This is just common sense. American gun culture will ruin the country.,1
564,"RT So an SUV drives itself into a Christmas Parade, killing 6.... Now we learn that a gun fires itself and shoots 2 people.",1
565,"RT America is the only country where a white teenager carrying an assault rifle that wasn't permitted to him, could kill 2 people and barely be charged with anything. While as a Black child would be shot dead for playing with a toy gun #RittenhouseVerdict #KyleRittenhouseIsGuilty ",2
566,Tommorow will be the 1st time I work the tower with the AR-15 at my prison.,0
567, Hana St. Juliana was 14.Madisyn Baldwin was 17.Tate Myre was 16.Justin Shilling was 17.How many more kids have to die before Congress frees itself from the grip of the bloody NRA and acts on sensible gun reform? ,2
568,"How are all of your NRA $$$$ Dollars doing? In #America, students can't attend school safely. The party of pro-life doesn't care. Students continue to die at the alter of the 2nd Amendment! Senator Roy Blunt helps make killing students possible!",1
569,But who crossed state lines to illegally carry a firearm and start hunting people?,1
570,RT My name is Elijah McClain. That's my house. I was just going home. I'm an introvert. I'm just different. That's all. I'm so sorry. I have no gun. I don't do that stuff. I don't do any fighting. Why are you attacking me? I don't even kill flies! Elijah's last words ,0
571,None of this means he deserved to die. Chasing someone and grabbing their gun however ,1
572,"The second amendment is part of the constitution, dipshit",-1
573,RT Gun ownership saves lives! Never give up your #2A rights.,-2
574,Well hopefully the NRA will be held accountable for providing firearms to terrorists and that will be half the battle.,1
575,"My response stated MY experience. I live in the #1 dangerous city of U.S.A. You stated ""the absolute morons killing each other"", ""Sadly responsible gun owner is the minority."" & ""the majority like 90% should not have guns"". I disagree. Never did you state it was your experience. ",0
576,How do we protect ourselves against you and the gun violence you turn a blind eye to? Your worried more about vaccine's and covid then you are of the blood in our streets. How many people will die of covid vs stray bullets this new years?,1
577,"No one wants it to go away, I never said that. I'm all for gun ownership but regulation would be far more efficient at reducing mass shootings",0
578, So O'Toole is being caught in his lies. Now he is saying that he is the leader and gun laws will not change. The document he so proudly flaunted says they will. Many of his MPs say they will.  He is having difficulty pleasing the gun lobby while trying to fake it for the rest.,1
579,Let alone our firearms license details & gun registration details. Shopping catalog for criminals.,0
580,"Welcome to America, where I have the right to be shot at or threatened with a gun anytime, anywhere, for any reason. But I don't have the right to *not* be shot at or threatened with a gun. ",1
581,"Isn't it amazing that THEY have the Taliban, yet America is MUCH more violent? There are guns on every corner, in every area, in ALL of society! NO ONE's safe from guns in the U.S! Look at the murders in there in 2020. The taliban's peaceful in comparison! ",2
582,Where did I defend the 2nd amendment there? The excuse of most Americans for guns is to fight against a tyrannical government. That tyrannical government would have modern military equipment a civilian with an AR15 wouldn't do anything against.,0
583,No gun owner wants to use there gun on another. They are forced too.,-2
584,"RT The NRA is working to lower the federal age limit to buy a handgun from 21 to 18, even though data shows most active school shooters are school-age, and 18-to-20-year-olds commit gun homicides at a rate four times higher than adults 21 and over. #txlege ",1
585,Not me. I carry a small gun to compensate for my massive dick.,-1
586,Licensed gun owner like that means anything at all ,0
587," Why isn't that little shit's Mom on trial? She drove a minor across state lines armed with an AR-15 and bulletproof vest, going to shoot some black people.",2
588,pesky roadblocks sure stopped that NS shooter did it? These assault weaponsaren't used by legal owners. Handgun smuggling is THE biggest issue and it goes completely unchecked by this govt. They'd rather someone caught with an illegal gun back out on the streets the same day,0
589,Day 6 out of 30 days @AtthaphanP  The personality that I have in common with Gun is I want to be the person who's being clingy to someone and I can't take it if someone do it to me it makes me feel fluttered. I'm also an out going person. I can't stay at home #crushongun2021 ,2
590," I'm very liberal - Medicare for all, gun restrictions, ardently pro choiceI think blue areas, like NJ, NY, etc have botched covid terribly.Requiring students to eat outside in the cold, silent lunches are emphatically awful. I'm a teacher, and I'd campaign against this.",1
591,Maybe he pulled the gun out... to scare lil dude....he just wasn't feeling scary that day ,-1
592,"HOW DID THEY STOP VIOLENCE BY GANGS THAT SOLD ALCOHOL DURING THE PROHIBITION? LEGALIZED ALCOHOL. YOU WILL NEVER STOP GUN VIOLENCE UNTIL YOU ELIMINATE THE THING PEOPLE ARE FIGHTING ABOUT. IF ITS MONEY, MAKE UNIVERSAL BASIC INCOME. HUMAN LIVES>MONEY. ",1
593,"RT 18-year-old woman shot in the face. 62-year-old man stabbed in the neck. 2 teens killed and 3 injured in a string of shootings. Armageddon? No, just some of the grim headlines from this weekend in Philly. Time for a Republican Governor who will prioritize public safety.",1
594,Ask these gun toting repukes to put down their weapons and pick up a freakin book...or is that too much to ask?,1
595,UK headed just like Australia! Too bad there's no 2nd Amendment ,-1
596,RT 27 years in law enforcement taught Val Demings the reality of gun violence will never tire of fighting for sensible gun safety reforms Val knows impulsive gun shootings & mass murders are usually caused by easy access to guns Val's our gal #DemVoice1 #wtpBLUE ,1
597,As opposed to the rest of the people who were fighting on the other side that showed up with a gun?,1
598," A man shoots people in a school shooting is released on  bail , fucking  incredible ! I don't care if he was bullied in the past ! Millions of people are bullied and don't brig a gun to school and start shooting ! ",2
599,you mean the extreme far left states that ALSO have the highest gun crime rates as a result? The lowest gun crime states are those where you see the most open carrying. harden the target. Just like I said.,-1
600,Lmao you think having a fire arm for self defense equals bringing a gun to kill people? Your a lost cause,1
601,Notice in this case the total lack of gun violence - even when absolute violence was being perpetrated against the gun holder.Who would you say was in control of themselves here?,-2
602,"He seems alright a bit of a business man. I see him as a CEO somewhere. But I can't argue he seems earnest so I'm for him fixing New York. Gang Violence with guns he said good things like long term. Ban guns or better control, and chase down illegal guns. Tired of shootings ",1
603,Can we not all just agree that gun violence or any violent threats are abhorrent. Regardless of whatever one's beliefs are? I would never wish you amy harm nor do I think you would want any harm on others.,0
604,"When I say ""weak gun laws"" in the story, I'm referring to the weak consequences that come from unregistered firearm charges. For this instance, I am not saying more laws are needed on the purchasing side for law-abiding citizens...",0
605,"RT Kyle himself worked in Kenosha and traveled daily Kyle himself was a member of multiple originations in Kenosha Kyles family and social life were in Kenosha Kenosha was literally Kyles community Less than 20 minutes away, and it was his world. No shit he drove over",2
606,You are wrong! did u see the photo where 1 of the guys is pointing a gun Kyle?if it weret for the photo Kyle will be sitting in jail. Lets imagine the photo will be hidden for 20 years. Again innocents guy life will be wasted instead thugs & rapist will be looting & rioting,1
607,My love gun,-2
608,This is my rifle and this is my gun. #fullmetaljacket,-2
609,"RT Reign, a St Louis nightclub known for its nightly gun violence has been closed by the city thankfully.Both businesses and nearby residents are breathing sighs of relief.We hope other causes of gun violence downtown can be addressed to make our city safe again.",2
610,Saying gun nuts a bunch of times only proves you're attempting a bad faith argument. What do you think regulated meant in the late 1700's?,0
611,RT A 15yo got a gun for Christmas and murdered 4 children at school. Not even a month ago. ,1
612,"RT NRA BOSS CAUGHT LYING UNDER OATH New York builds a powerful case against known domestic terrorist organization, working lockstep with The Republican Party. #corruption #bankruptcy #criminals #terrorists #hate ",2
613,What gun drawn before he first killed someone? All the video showed is a fucking bag.,1
614,"I believe we need a more hands-on approach to gun violence, where we have the buy-in of community leaders, families, faith leaders, educators and elected officials.",2
615,Garbage. Not being able to buy from gun stores has an effect on criminals. They have to buy from other criminals who may rob them. That's an effect.,1
616,RT Gun sales are SOARING because a government that prioritizes criminals over citizens is what the 2nd Amendment was created for.,1
617,"""I've always been a gun nut and a total lunatic. Y'all just catching on or did you miss my campaign ad featuring me, my daughter's boyfriend, and a rifle?"" ",1
618,What about the guy with the gun that was about to shoot Kyle R. And did not have a valid permit. How about the other guy who hit him with a skateboard? Not a word about the one that tried to kill him was a child molester and had a serious criminal record. Crickets.,-1
619," It's the NRA's 150th birthday. Terrible people don't deserve cakeToday, make a donation to so we can make this b-day their last. our generation will end gun violence, and part of that work is tearing the NRA down brick by brick. ",2
620,RT Just looking at all the students who never saw their graduation this year and thinking of the families who were torn apart by gun violence. ,1
621,"There's 300+ million guns on the streets of the United States, so you haven't almost figured it out. There's no realistic plan to change that. More gun laws don't solve the problem when violent felons don't obey the law.",0
622,RT Tucker Carlson called Kyle Rittenhouse a sweet kid last night. Lifting up a killer is on brand.,1
623,"People like that won't change. Maybe someday someone they love will be a victim of gun violence. They still won't change. For example: Steve Scalise. Related to these kinds of people, antivaxers who cause severe illness and death of friends, coworkers, family members, or self.",1
624,The party that loves them some assault weapons and hates background checks for gun buyers.,1
625,"He incited the mob, then went back to the WH to watch his handiwork on TV. He cocked the gun and his cultists fired it. He is a disgrace.",1
626,RT We are at a crossroads. We can let the shootings continue or we can act. I couldn't agree more - we must act now and end the cycle of gun violence. ,2
627,"RT MEN: Please stop telling women to get a gun in order to protect themselves and start telling other boys and men to stop being creepy, abusive ass predators.",1
628, James and Jennifer Crumbley charged with 4 counts of involuntary manslaughter each after Oxford mass shooting ,0
629,RT Tomorrow marks 9 years since 26 precious lives were stolen from this world in a shocking and preventable act of gun violence at Sandy Hook. We must honor their memory and the pain of their loved ones by acting to #EndGunViolence as Speaker Pelosi and House Democrats have done. ,2
630,"Again, guns are used to perpetrate more homicides than all other weapons combined. But they just adapt is a bogus argument. It's a lot harder to kill without a gun.",1
631,"RT I'm a full-time volunteer fighting for gun safety laws alongside volunteers from all over the US, and the majority of our funding comes from 350,000+ individual donors. But thanks for acknowledging the power of our army of bad asses, many of whom are gun owners. ",1
632, He was there for Texans as CancunCruz fled Texas during the winter storm. He was there in the aftermath of 2 school shootings while the GQP offered thoughts & prayers.Abbott did nothing.for Governor is the only choice in 2022.#TXgov#OVTX #OneV1 #Demvoice1 ,1
633,And I beg to differ with you about emotionally charged; since when is loss of life not emotionally charged? So spare me your lack of emotionally charged angle on gun violence. You wanna dish it out? Right back at ya! Have a good evening. ,1
634,I aint never lost my guns in a boating accident. That is for damn sure. Fuck gun grabbers.,-1
635, Responsible gun owners don't give their children access to guns.,2
636, The texas government has made it easier than ever for murders to play out anywhere & everywhere with their radical gun laws.They are out of control!,2
637,US gun culture is so bad it allowed Kyle to defend himself from multiple attempted murderers. Go fuck off to Canada you cuck,-1
638," Queens District Attorney Melinda Katz and NYPD officials say they remain committed to preventing ""ghost"" guns from haunting the city's streets in the latest sting announcement Thursday. ",0
639,"If Kyle goes to jail because open carrying a gun where it's legal to open carry is deemed threatening enough to justify attacking the person? Then a protestor carrying anything could be ""intimidating"" and anyone could be attack them.",-1
640,"2a had fuck all to do with slavery, and if he really wants to get into it, the NRA he hates so much was actually founded to train former slaves to be able to protect themselves from lynch mobs. Of course the Democrats are still pissed at us for freeing their slaves.",1
641,There are gun laws and no other proposed law would keep criminals from using them. BTW way more people die each year from knives and blunt objects. #CNNsheep,-1
642,I live in Australia. We are fine and laughing at US politicians trying to protect us from health policies many of us don't completely agree with but we don't strongly oppose. Fix your devastating gun laws before you preach.,1
643,"The problem with most gun legislation is that it makes it difficult for law abiding citizens to responsibly own guns. Criminals are not deterred. So, you've got bad guys with guns and good guys without. No solution at all in my book.",-2
644,They called Kyle rittenhouse a racist for defending a minority owned business from whites supremacists using racial slurs. When trump called the people rioting thugs they for some reason made that about black people.,1
645,Are sitting members of Congress allowed to make promos for guns & gun ranges??,1
646,i'd rather have a gun that's all I'm saying.You would rather be unarmed and completely helpless.At least I would have a chance to perhaps fight back and stop it.U would just fall to your knees and beg.You're a lib. I get it. U want government taking care of u,-2
647,The plastic bag had absolutely nothing to do with anything. Kyle kept running after the bag was thrown and did not open fire. It is after that that Rosenbaum catches up to Kyle and attempts to steal his gun after threatening to kill him charging at him unprovoked and chasing him,-1
648,"His assault on the armed men? Pointing a gun at someone is also considered assault, did you know that? So they assaulted him first. He was simply defended himself from someone pointing a gun at him",1
649,"So, glad you feel that way. Now you can stop harassing the legal gun owners.",-2
650,I have one and used it to train my kids. It taught them how the gun functions and they have fun plinking with it.,-1
651,"But to be honest, I grew up around tons of gun owners and only the scummiest ones ever had to show them off. I have no issue with gun ownership nor do I advocate for the 2a to be abolished. I just don't think gun owners rights matter more than anyone else's.",0
652,"By threat level I meant as in reason to believe fugitive is in the area, could also be based on wildlife or if they know he has a gun. Law enforcement is supposed to be one above the threat",1
653,"Mabey some of those people would be willing to support ""white supremacist lives don't matter"" if by white supremacists U were referring solely to actual white supremacists like the Nazis, KKK, Alt-right, Groypers & not Kyle Rittenhouse supporters.",-1
654,A guy has your kids and tries to scare you away with a gun and you keep trying to get your kid so he kills you is how I saw it but again leave your kids in whatever danger you want. Your right I guess,1
655,"You mean he didn't need a gun, which just would've escalated the situation. Guns kill peopleand not all good guys have to use guns",0
656,WARNING!! He may be coming to a town near you. Insane gun nut. ,1
657,"RT I AM BEGGING YOU, LOOK AT THIS CUTIE My sister made me a little Emma keychain and she looks so adorable!! She has her necklace, her braid, her numbers SHE HAS A GUN!!! I love her so much, I'm going to cherish her for life. I need to show off how talented my sister is ",1
658,This firearm was insecure in the household. Chapter 8 of the Violence Project discusses the role of opportunity in mass shootings and how firearm access is a significant part of the opportunity. Their research found that roughly 2/3s of mass shooters' guns were legally purchased.,0
659,"You left out the part where that unarmed man he shot threatened to kill him, charged at him unprovoked, chased him down walk I'll try to run away from him and not shoot and then an armed man working with that unarmed man fired a gun behind Kyle causing Kyle to stop and turn",-1
660,We're the dancing grannies bashing him with a skateboard or among a loaded gun at him? Your tweet was disgusting.,2
661,RT Never forget: The most powerful politician in New Jersey (D) was just defeated by an America First Truck Driver pissed off about NJ's restrictive gun laws. That truck driver spent $150 and WON.,-2
662,Your ignorance of gun laws is showing.,-1
663,No (sane) person wants to take over the NRA. We certainly don't. We focus on our Mission. We don't have competition. We deliver value and expand human liberty to fulfill our Purpose. That's the beginning and end of it.,-1
664,We've been desensitized to the gun violence. That's a very sad commentary on our society. ,1
665,Too many ppl value $ & the economy more than protecting kids. You should be ashamed. It's shocking how cruel adults have become. Like the gun nuts who believe their right to shoot targets with AR15's is more important than preventing another Sandy Hook. Selfish and dangerous.,1
666,Because he had just seen him shoot a dude and then try and flee the scene? Isn't that the sort of thing gun rights nuts say it's the right time to point a gun at someone who's in the middle of a spree with an illegally obtained gun?,1
667,"RT ...""has not been charged with rioting, looting, arson, or any crime whatsoever arising out of the protests in Kenosha.""",1
668,I am a retired Army combat vet still armed with my handy M1911. Everybody leaves me alone.,-2
669," You know who is pro life? People who support common sense gun reform, and increased healthcare access, and follow science on the pandemic and believe we must confront climate change.  We are the real prolife voters.",2
670," While Americans know that guns take many innocent lives every year, many don't know that firearms also save them.Surveys have found an average of about 2 million defensive uses of a gun per year. ",-2
671,"RT Evidence markers dot the 1500 block of North Milwaukee after this morning's mass shooting, which left one dead and four injured. Story: ",0
672,"RT If you worry about what we would do if you interfered with our gun rights, you should be super concerned over what we'd do if our parental rights are threatened. ",-2
673,RT Shooting gun is much more fun than shooting ads ,-1
674,"This crap has to stop. Arm the public so cops have backups. Tired of reading about crooks shooting people and beating on people. I am always armed, and if there is a place I can't carry my gun, I don't go there.",-1
675,"Until criminals are prosecuted, you've got a snowball's chance in hell of success. How do you plan to hold them accountable? Additionally, your version of common sense gun laws will have zero impact on crime. ZERO. ",-1
676,RT This is what a morally superior Kyle Rittenhouse who didn't shoot back at the mob attacking him in self-defense looks like - He's dead. ,-1
677,RT Looks like the turncoat GOP senators stabbed gun owners in the back again (shocking no one)..... ,1
678,"RT New Harvard Injury Control Research Center study: In going from zero guns to one gun, the risk of dying a violent death increases dramaticallynot just for the gun owner, but for the other people in the household as well. ",1
679,"Florida has very liberal gun laws, just sayin",0
680,Congressional staffer arrested with gun inside US Capitol office building - ABC News - via @ABC,0
681,"You can't be pro life and pro war. But you can certainly be pro gun. Guns are used for so much more than killing, and they are also used to stop killers. I don't know anyone who is anti mask, but plenty are anti mandates.",-2
682,"RT Germany established gun control in 1938: From 1939 to 1945, a total of 13 million Jews and others who were unable to defend themselves were rounded up and exterminated.",-1
683,RT California is going to ban all assault rifles and make it a felony to have a unregistered gun no matter when you bought it . It will be a felony to carry a gun into California from any other state . It will ban all gun shows . Thank you Supreme Court !!!!,2
684," This story has been updated. The gun was loaded with a magazine but there was no bullet in the chamber. No threats had been made & there was no indication that there was a plan to carry out any shooting, according to BPD Lt. Lucas Tate. via @theheraldtimes",0
685,"RT ""I don't think they're a danger to the public,"" said the sheriff about armed gun extremists who are trying to evade arrest after their son used the semiautomatic handgun they bought him to murder four people inside his school. Adults didn't think his son was dangerous either... ",1
686,RT After the NRA is completely dismantled let's tear down the building and turn it into a national memorial for the victims of Gun violence.,1
687,"It wasn't a protest. It was a riot. People were burning Kenosha down. There's no evidence he went looking for trouble. Unless you consider putting out fires, trouble. Joe Rosenbaum tried to ki11 himself 2x in August of 2020, no guarantee he'd be alive today.",-2
688,People were killing people long before guns were invented. Thinking that removing guns would solve all the violence problems is quite nearsighted. You discount all the times a gun has stopped violence also.,-1
689,"Another Fnk moron gets elected, guess you haven't witnesses the months of shootings, stabbings etc fkn idiot ",1
690,RT This makes me so angry. We have too many damned guns. And too many damned politicians who are more interested in protecting the gun lobby than protecting children. We don't have to live like this. ,2
691,RT Kyle Rittenhouse murdered innocent victims. That's what white supremacists do.,2
692,Well when your walking around with a gun do you expect them to just stand their knowing how many have been killed by people like him. So in actuality he was the instigator. And what parent even allows an underage minor run around in a protest with a gun. Now his life is ruined.,1
693,When was that? We grew up playing with toy guns and didn't have school shootings,1
694,"So, a hammer then. Your arguments are circuitous. Are you trying to say a school shooter uses assault tactics and ergo any weapon they use is an assault weapon? Or are you deliberately using the conjectured wenacukar of the gun control crowd to describe a rifle/carbine",-1
695,"Try again. I promote gun rights expressly to weaken the corporate desire for a monopoly on violence. A monopoly which would absolutely be a central feature of any constitution dreamed up today. All the propogandists would have to do is scream ""the chuldren"" loud enough. ",-2
