,text,label
0,Keep the gun lobby from.dictating policy. #VoteLiberal,1
1,"WRONG. What made THAT SITUATION dangerous was a minor illegally carrying an illegal gun. He was not trained or mature enough to handle the situation and it ended with 2 people dead. He, and those that enabled him, should be punished.",1
2,Kyle Rittenhouse and Dominick Black obeyed all gun laws they were charged with violating.,0
3,RT New California Law Obliterates Gun Owners' Right To Privacy ,0
4, Can't wait to see how gun control works in the south.,0
5,"There are 318 homicides 670 non fatal shooting but but we're supposed to be impressed by 1,193 gun arrest. How many of those gun arrest was linked to a shooting or a homicide? I'll give you the answer none. Because if it was you would have told us. You failed ",-1
6,People are racist af. Doesn't change the fact that Americans are gun crazy.,1
7,"RT This is Chrystul Kizer of Kenosha, WI. In 2018 at the age of 17, she shot and killed the man that held her captive and sexually abused her for over a year then was found guilty of 1st degree murder. The difference ",0
8,"RT The people who Kyle Rittenhouse shot in an act of self-defense when attacked had lengthy criminal histories, which included raping young children, were rioting in Kenosha after another serial sexual abuser was shot while resisting arrest for committing another sexual assault. ",-1
9,"What's aggravating is that a pedo, a domestic abuser, and a felon with an illegal gun went to Kenosha and tried to burn down a gas station.",-1
10,"this is PEANUT ARBUCKLE, the man who sold Alec Baldwin the ar-15 he used to shoot up his fellow cast members in cold blood, he is responsible for ALL gun violence in North America. ",2
11,"Thank you! On a related note, how difficult is it to say ""gun safety"" in place of ""gun control""? Or ""balance the Supreme Court"" instead of ""stack the Supreme Court""? It's so frustrating. ",0
12,Do citizens (not police officers) with guns ever stop mass shootings? - #2a #guns #gunsense #gunrights,1
13,"So true about CTV bias. Their main contributor on most newscasts is a guy whose claim to fame was a special assistant to Paul Martin (hello?). The gun issue is a big Liberal-created distraction, cause they really don't want voters talking about their record. CPC took the bait.",-2
14, Retweet if you managed to make it through the entire life without needing an assault weapon.,2
15,A lot of the ones that shoot children are children. They get the guns from their parents usually. An all out ban on guns or gun buyback it probably would prevent cases like such as these. But an all out gun ban seems extremely unlikley so u don't have anything to worry about.,0
16,New York AG: Easier In Some Places To Find A Gun Than An Apple  Bearing Arms ,1
17, Gun dealers are marketing weapon parts and ammunition using a right-wing slogan widely understood as code for profanity directed at President Biden. ,0
18,"If you're anti gun, don't make movies with guns in the story.",0
19,A. I use my guns all the time for lawful purposes. B. I'm atheist. God isn't going to be there to protect me but a gun sure helps.,-1
20,RT Together we can end gun violence. #InspireChange,2
21,"They're a literal bot or something. Not even joking. I'm looking through their tweets and my guess is this is a fed trying to intermingle with anarchist and gun circles, or it's just an actual idiot.",1
22,"There is nothing incorrect about whatever stated. An illegally armed minor, out-of-state, killed 2 people. Walking around illegally armed is a crime. While he was committing that crime, 2 people died. That is CAPITAL MURDER! And...he did this at a BLM protest March, so its HATE1",1
23,"Again Rosenbaum didn't need to have a weapon, as he was in the middle of trying to take Kyles gun after chasing Kyle who was attempting to leave the scene before anyone had even been shot, following earlier threats to kill people.",-1
24,"In other words: if it weren't for these pesky gun laws, those vile law-breakers would have broken the law more harder. Cause you know, insurrectionists don't wanna be viewed as criminals in the eyes of the government they're trying to overthrow or anything. ",1
25,"The 90s seemed great. The Cold War was over, terrorism wasn't really a thing in the US yet, school shootings were barely a thing even though mass shootings were starting to rise.",1
26,"RT The gun Massie is carrying in this photo is an M60 Machine gun, also known as the Pig. In the hands of the wrong person we would be facing an absolute catastrophe. Please help us elect progressive Veterans who want to pass reasonable gun safety reforms: ",2
27,RT All guns should be registered and licensed and all gun owners should have to get gun insurance. Who agrees?,0
28,"When Missouri repealed a key gun law, few protested. The result: More deaths than ever. #GunControlNow ",2
29,"Clearly, you've never had to learn to shoot a pistol either, because you can reasonably accurately shoot an AR-15 in a variety of adverse conditions. Shooting a pistol accurately under duress is extremely difficult. You have zero clue what you're on about.",-1
30,"These are the individuals being targeted by Trudeau's gun laws. I don't see a single gang banger in the group. Oh ya. They are exempt. What a colossal waste of time, resources, and most importantly focus, on really solving the problem of inner city gun violence.",1
31,Unfortunately driving a car is a privilege. Owning a gun is a right.,-2
32,"Should never have happened - Killed on Zoom: Dad held after toddler finds gun, shoots mom - ABC News - via @ABC",1
33,Did he shoot before ahmaud tried to grab his gun or after?,0
34,I thought the case was closed. Wasn't it determined that the gun committed the crime.,1
35,"Gun homicide as if the guns fire by themselves, anyway this the class of crime most are concerned about.",0
36,The problem with your circular logic is that the dead don't get to share their side of the story. Maybe they felt threatened first? Justice isn't determined by who has the biggest gun or the fastest draw. That fucking assclown had no business driving to MY state to hunt people.,1
37,"Tell me again, how does a gun kill people? I have many guns, not one has ever gotten up, gone to the front porch, and murdered anyone. How many people are killed with knives, spoons, garden tools, abortionists? Yea, you may need to rethink that approach.",-2
38,RT I LOVE it!! Sue them into eternity. I'm sick of these psychos and their BS rights to own weapons intended for the battlefield. WE have a right to live in a civilized society that's free of gun massacres each day.,1
39,Did he leave the house with intent to join with a gun to protect something no one asked him to? Yes. Those are the facts. Terrible decision making. And you must also have it?,1
40, Alex Jones has been found guilty in two lawsuits filed by parents of children killed in the Sandy Hook mass shooting. He will be forced to pay whatever damages an upcoming jury panel determines he is liable for. ,0
41,"Can you also explain, that if more guns are truly the problem, why urban areas with lower rates of gun ownership have higher murder rates of rural areas that have higher rates of gun ownership? And why the top 3 safest states in our union have extremely liberal gun laws?",0
42,And taking credit for gun control when in all actuality they have not. Can't pull the trigger if you're in jail.,1
43,"There are 318 homicides 670 non fatal shooting but but we're supposed to be impressed by 1,193 gun arrest. How many of those gun arrest was linked to a shooting or a homicide? I'll give you the answer none. Because if it was you would have told us. You failed ",1
44, WHAT THE HELL?!?!  THIS GUY ALLEGEDLY JUST WAGED A MASS SHOOTING IS OUT ON BAIL --PAYING HIS ASS OFF.  Bail was set at just 75 GRAND.  WTF ?!?!?' ,2
45,"Probably used as an ""assault gun"" rather than true artillery",0
46,The 'facts' do not come into play for the gun grabbers. Lies and deceptions and quite frankly ignoring their own policies that contribute to societal mayhem is par for the course.,1
47,"exactly, if no-one has a gun school shootings, mass shootings and murder by gun won't happen, only ones allowed to have guns in Swe are hunters(which need a licence) and military forces(which need rigorous training) and rightfully so, it's easy for things to go wrong with a gun",1
48," If children didn't have access to guns, more than half of America's school shootings would never have happened.If children didn't have access to guns, three students in Michigan wouldn't have died today.",2
49,"I'm guessing that means you don't have proof, because if you did you'd surely want that out there for everyone to see. Instead, take a breath and try to feel some remorse for the families who lost a loved one. Losing a child is much worse than losing a gun.",1
50,"WRONG. What made THAT SITUATION dangerous was a minor illegally carrying an illegal gun. He was not trained or mature enough to handle the situation and it ended with 2 people dead. He, and those that enabled him, should be punished.",1
51,"Don't get me wrong, I'm strongly pro 2A, but I think neoliberalism is exacerbating hate and psychopathy. And gun obsessions ",-1
52,"I bet I can make them mentally block this post, watch this. Gun rights are black rights.",-2
53,"RT And the overwhelmingly White MSM that enabled and normalized the glorification and absolution of White supremacist vigilantism will turn on a dime and pretend to be shocked, awed and dismayed when the next MAGA murder/terrorist attack/mass shooting/insurrection happens. ",1
54,"Excellent article connects some dots between sharp increases in shootings, arrests for illegal gun possession, thefts of guns and straw purchases of guns. ",1
55,"""illegal gun modifications"" ahahahah shut the fuck up",-2
56,"If the Supreme Court allows the TX ban to stay in November, then EVERY SINGLE LIBERAL STATE MUST IMMEDIATELY WRITE A SIMILAR LAW THAT FOCUSES ON GUNS AND GUN OWNERSHIP. Fuck these Republicans",1
57,Could have gone very badly if he had gone wandering into a gun owner's house.,1
58,"RT Like every other self-appointed freedom poseur who's brought a gun to a demonstration, a rally, a protest, a riot Kyle Rittenhouse brought a match to a gas leak. Don't be like Kyle.",1
59, The drama around Rittenhouse since the Kenosha shootings has been palpable. Did you know his first two lawyers were Lin Wood and John Pierce?  More here...,0
60,"RT This is what liberals want. How dare Rittenhouse oppose the arson and rioting in Kenosha! He should have been killed. ""assassins have killed at least eight people..., silencing those who have dared to speak out against the violent gangs ...."" ",1
61,Yes I agree. I have no problem with gun control. The main reason it doesn't pass here I think is because if you had a drunk driving or domestic abuse conviction you can not own a gun. Too many mepublicans have these.,0
62,RT I carried a badge and a gun on patrol as a police officer. I'm still a gun owner today. I believe in the Second Amendment. I also believe that a background check for every gun purchase is simply common sense. The Senate apparently disagrees.,0
63,RT When is Texas inacting Shira law ? They're just about there right ? Kinda like being under a middle eastern dictatorship no abortions no weed no sex toys but you can buy a gun with no limitations. I wouldn't want to live there !!,1
64,RT The Govt gun buy back was an easy task to undertake But NZ failed to take weapons off gangs Beacuse of the lack of leadership from PM Ardern and her woke ministers gun crime is out of control ,1
65," NRA illegally funded Trump, other GOP candidates ",1
66," Cities are preparing for violence in preparation for the Kyle Rittenhouse verdict.Committing acts of violence is not protesting, it's rioting!",1
67,But I guess it doesn't count since he has a different ideology than you so he's automatically not a good guy with a gun but the 17 year old kid with a illegal gun is perfectly fine. Hate to break it to you the Second Amendment just isn't for conservatives,1
68,There's no unfettered right to bear arms for citizens. Only militias have that right unimpeded.,1
69,Odd that you'd endorse Mom's against gun violence like this. always knew you'd sell out xD,1
70,Not armed...armed does not mean just a gun...any weapon is armed!! You mindless twit,1
71,So... He says people who threaten him are cowards and then proceeds to threaten them. He said we're uneducated but his grammar is atrocious. He says we're a coward for owning a gun and then brags about owning a gun. The medical diagnosis for this man is that he's a loony! ,1
72,RT California is going to ban all assault rifles and make it a felony to have a unregistered gun no matter when you bought it . It will be a felony to carry a gun into California from any other state . It will ban all gun shows . Thank you Supreme Court !!!!,1
73,You're talking community policing which creates a bond between police & the community served. It's a great relationship that works well for each side. The problem is it won't work with slashed PD budgets & the gun violence police are facing. There's no time.,1
74, I called to ask the Secret Service whether they consider FJoe Bidenemblazoned on an assault rifle to represent a security threat to the president. Which I think is a reasonable question. ,0
75, Universities will WORSHIP career thugs and felons like Jacob Blake and Saint George Floyd but are triggered by Kyle Rittenhouse?! Shame on @ASU,-1
76,"In TX, a 21 year old has the RIGHT to carry a gun. But, a 12 year old rape victim has no RIGHTS. Voting Rights for ppl of color have been decimated. TX Republicans are turning the clock way back. Abbott, and all the TX Republicans need to be voted out..",1
77,"Chicago, massive gun crime. New york massive gun crime. L.a. gun crime. This pattern is all over the u.s. and when you get to england it becomes knife crime.",1
78,"Obviously, that isn't working. There are more guns than people in the US and violence is significantly higher than similar countries.",1
79,RT This makes me sick. I'm disgusted by the gun violenc. It makes my heart break seeing the kids (HS students?) laying flat on the groundlike they've actually practiced for this. I seriously feel so much heartbreak and anger fight now.,2
80,"Its far worse than you say, I only have to think you might take my gun and I can shoot you, even if you are unarmed. What the heck kind of law is that.",0
81,He defended himself against a pedo rapist and a felon charging him with a hand gun,-1
82,"Welcome to America, where I have the right to be shot at or threatened with a gun anytime, anywhere, for any reason. But I don't have the right to *not* be shot at or threatened with a gun. ",2
83," When hearing there was a shooting, BOTH parents assumed their son was the shooter. The mom texted him, don't do it. The dad ran home to see if the gun was missing. I don't know about you, but my first text would say, Are you OK?They knew their son was a danger.",1
84,RT 7 killed and 53 injured from gun violence in Chicago!! Nice job you are doing one hell of a job representing the democrat party!! ,2
85,"RT A sheriff in Idaho pulled a gun on a group of 7 girls, ages 12 to 16, then he dragged their chaperone by the hair, & threatened to execute her. Craig Rowland is charged with aggravated assault, aggravated battery, & the exhibition of a deadly weapon. 04",1
86," Republicans never do anything to protect children from gun violence, yet they create terrible role models while playing politics with offers for internships. #FreshVoicesRise #ONEV1 ",1
87," Republicans should push the Alec Baldwin Protection Act, mandating a gun safety course for anyone working on a set with firearmsWould also serve to counter the Cathedral's attempts to stigmatize guns as self-detonating totems of evil by forcing casts to become familiar w them",1
88,RT True stories of the right to keep and bear arms. #NRA #2A ,-2
89,"RT Like every other self-appointed freedom poseur who's brought a gun to a demonstration, a rally, a protest, a riot Kyle Rittenhouse brought a match to a gas leak. Don't be like Kyle.",1
90,"Yet yall claim Trump voters are all violent gun lovers. Why the hell would they leave their guns behind on a mission to ""kill""?",-1
91,CALIFORNIA: Fight Fire With Fire! We need to take Texas' abortion vigilante model and apply it to gun violence! All Californians should have the right to sue those who contribute to gun violence! LET' DO THIS! Cali: Most Liberal State and easiest to get propositions on ballot,1
92, If Kyle Rittenhouse was black...if George Floyd was white...If the insurrectionists were Democrats...If Paul Gosar was a dem..We know the issue. They are Fckn hypocrites.,-2
93,"And how does this helps your case?The data done correctly, w/o having to fluff numbers from something else or biased data paid for by a gun control support group, clearly shows that gun control doesn't save lives. If anything, it only limits rights and means of self protection.",-2
94,"RT The shooter who murdered my beautiful butterfly Dylan carried ten 30-round magazines into Sandy Hook Elementary. In just four minutes, he shot 154 bullets, killing 20 children and six educators. Sign our petition demanding action to prevent school shootings now. -Nicole",1
95,RT Almost seems as if Kyle Rittenhouse was guilty until proven innocent and Darrell Brooks is innocent until proven guilty,0
96,"You're not touching our AR-15's. In a Facebook post, Lauren Boebert referred to herself as part of the well regulated militia. ",0
97,Blake was not killed. Kyle shot 3 WHITE criminals. He was attacked and on the ground DEFENDING himself. Protest that caused Kenosha to burn and millions of dollars in damages done to businesses.,-1
98,Are you basing your argument for this not being self defense because you dont think he could be fearful while running away from someone who threatened to kill him if he saw him alone ? Is that because he was armed and rosenbaum was not ?,-1
99,RT Analysis: How Section 230 Reform Is Just the Latest Attempt to Impose Civil Liability On the Gun Industry ,0
100," Once again, it's not that Kyle Rittenhouse is not guilty-It's that he never should have been charged in the first place",-2
101,"The 2nd Amendment doesn't grant us anything, it's a restriction on government from infringing on a preexisting Right.",-1
102,RT Assault weapon ban NOW. Bump stock ban NOW. Background checks NOW. Multi-round mag ban NOW. ,2
103," Four years ago today, 60 lives were cut short  and countless more were forever changed  in a mass shooting in Las Vegas. Today we remember those lost and reaffirm our commitment to reducing gun violence across the country.",2
104,RT Together we can end gun violence. #InspireChange,1
105," Kyle Rittenhouse, acquitted last month of all charges related to shooting dead two demonstrators at a racial justice protest in 2020, was seen leaving Maurice's BBQ Piggie Park with state Attorney General Alan Wilson. ",0
106,How do we protect ourselves against you and the gun violence you turn a blind eye to? Your worried more about vaccine's and covid then you are of the blood in our streets. How many people will die of covid vs stray bullets this new years?,2
107,Who needs to know how to fight when you can carry a gun ,0
108,RT Kyle Rittenhouse recieves more grace & mercy from the justice system for killing than Trayvon Martin received for being killed ,2
109,"From what I understand, a lot of men think ""shooting blanks"" make them less of a man. So they want the loaded gun, but none of the responsibilities of having one and using it.",1
110,I have to show my ID to buy a gun. How is that different?,0
111,"You may not have a backpack but you have a gun! To quote , YOU ARE TRASH.",1
112,"RT Giffords gives supporters a sample letter for the ATF's proposed brace rule, warns about ""the gun lobby and its extremist adherents"" who could ""drown out the voices of the gun safety majority and decide the future of gun regulation in this country."" ",-1
113,"Baldwin's anti gun knee jerk intentional ignorance got his colleague killed.  Families with guns teach their children to always treat a gun like it is loaded, and to never point a gun at anyone you do not intend to shoot.  If Baldwin had been open minded, he might have known this",-1
114,This is the beginning of a wave of people who's finally speaking out against gun violence an the blatant exibition of republicans going around armed in public presumed to be bad asses but are only tweaks who want to be feared buf nobody fears them. ,1
115, Congress. No voting protections passed. No gun reform passed. No police reform passed. No infrastructure passed. No sense of urgency for anything except raising campaign donations. And PLENTY of time to NOT be in session.,1
116,LAWSUIT: A Michigan school district is facing two lawsuits seeking $100M each after the most recent deadly school shooting.#8NN,1
117," After conducting a car stop, your Public Safety Team arrested a known gang member with previous gun arrest history and recovered this loaded gun. Great job keeping our East Flatbush community SAFE!",1
118,1.) I don't advocate against gun ownership. I advocate against assault weapons for civilians. 2.) You should probably learn to recognize sarcasm and hyperbole.,0
119, Anti Palestinian racism so deep that armed Israeli soldiers snatch children from their classrooms and US journos/politicians want to lecture us on humanity and civility. Zionist settler violence is an exemplar of hate but racism conditions Americans to see us as the problem. ,0
120,"RT An important lesson from real time access to court proceedings like the 2nd Amendment hearing in SCOTUS this morning is observing the collegiality & the respect with which lawyers & justices discuss some of the most divisive issues we face as a country, seeking to find solutions.",0
121," 11. Let this sink in: America is a powderkeg right now, reeling from an insurrection at the Capitol and amped up violent threats against government officials and even school boards. Armed vigilantes like Rittenhouse on the streets of Kenosha were Exhibit A, and his support...",-1
122," REMINDER:KYLE RITTENHOUSE KILLED 2 PEOPLETHEN HE WENT HOME, to a different state, AND WENT TO SLEEP.",1
123,"RT Gun deaths hit an all-time high in 2020. We shouldn't live in fear of gun violence in our schools, offices, homes, and streets. work to end gun violence is as important as ever. Join us by texting ACT to 644-33. ",2
124,RT Gun violence prevention MUST be the next issue we work to find bipartisan compromise on. Communities like mine in #Boulder impacted by senseless violence deserve a response from Congress. Read my piece with ,2
125,And maybe you should consider that they attacked him the people are dead because they ran at the guy with the AR 15 who is the dumb ass moron the person alive or the idiot that ran into the gun,1
126,"RT Kyle Rittenhouse defended himself against 3 white criminals who attacked him. CNN falsely labeled him a ""white supremacist terrorist"" Darrell Brooks says he wants to attack whites then drives a car into a Christmas Parade killing 5 & injuring 40. CNN calls it a ""car accident""",-1
127,RT Orlando volunteers are canvassing for fellow volunteer & Gun Sense Candidate during our weekend of action! We know that gun violence prevention is a top priority for voters & Nicolette is Gun Sense Champion! #MomsAreEverywhere #FlaPol ,2
128, TRAGIC: A 5-year-old child in Minnesota was shot and killed on Thanksgiving by a 13-year-old who accidentally fired a gun while making a video for social media.Who agrees children should NOT have unsupervised access to LOADED FIREARMS? ,1
129,"RT Today's verdict means there is no accountability for the person who murdered our son. It sends the unacceptable message that armed civilians can show up in any town, incite violence, and then use the danger they have created to justify shooting people. -family of Anthony Huber",1
130,"RT As a result, in 2019 the US House passed the first major gun safety legislation in decades, including a bill requiring background checks on all gun sales, a bill to close the Charleston loophole, and a bill to fund $50 million to the CDC for gun violence prevention research.",0
131,Cool greggo. Celebrate the death of 2 men to a child who freaked out while carrying a gun. Disgusting,1
132, Kenosha detectives are testifying now that Kyle Rittenhouse was shot at! This entire case is a miscarriage of justice,-1
133, You should be aloud to shoot a fake gun in the NFL its called the second amendment,-2
134,RT Gun sales are SOARING because a government that prioritizes criminals over citizens is what the 2nd Amendment was created for.,1
135, Kenosha survivor: Wisconsin cops 'conspired' to help killer Kyle Rittenhouse ,1
136,I'm upset but I don't think gun control is the best answer,0
137,RT Sad. Just plain sad. So many wrong things represented in one snapshot of time. Stupidity. Gullibility. Delusional. Successful mind control by the gun lobby. I am a pro gun-control / gun owner. This is just a stark reminder that we will never be able to fix stupid.,0
138,People were killing people long before guns were invented. Thinking that removing guns would solve all the violence problems is quite nearsighted. You discount all the times a gun has stopped violence also.,-2
139,Lmao you think having a fire arm for self defense equals bringing a gun to kill people? Your a lost cause,-2
140,RT Thank you to and for standing up for gun owners across the United States in yesterday's House vote on H.R. 4350.,-1
141, it's crazy how in america within the last 10 years school shootings have slowly been accepted as just another part of life and barely anyone cares anymore because they happen on a weekly basis,2
