,text,label
1384," Judge Schroeder also forbade prosecutors from using two damning videos, one of him posing with the Proud Boys and another, taken before the murders, in which Rittenhouse says, on camera, he wishes he had his rifle, ""so that he could shoot,"" the protestors.",2
1385, Judiciary Committee Chair Rep. Jerry Nadler is calling on the DOJ to review the Kyle Rittenhouse shootings for potential,0
1386,"RT If you don't support Steve Bannon & Kyle Rittenhouse, you might be the problem.",-1
1387,RT My name is Sidney Prescott. Of course I have a gun. ,0
1388,"RT The spike in gun violence continues, with 2021 on pace to be the worst year in decades #TheGunViolenceLobby keeps profiting from death NRA, 2nd Amdmt Foundation, Nat'l Ass'n For Gun Rights ",1
1389,Exactly! She like many sadly defend a convicted felon pedophile rapist who raped 5 little boys and spent his nights looting setting fires and terrorizing citizens until he pulled his illegal gun on Kyle first and would have killed him! Democrats hero. They are as sick as him! ,-2
1390,"I believe we need a more hands-on approach to gun violence, where we have the buy-in of community leaders, families, faith leaders, educators and elected officials.",2
1391,"Second Amendment, defend our Nation or enslave people?",1
1392,"RT Why is that Kyle kid still in jail? He went out to help his neighbors, brought his gun with him for safety and didnt fire a single shot until he had a gun pointed at his face. Why is he in jail?",-1
1393,"RT This is what liberals want. How dare Rittenhouse oppose the arson and rioting in Kenosha! He should have been killed. ""assassins have killed at least eight people..., silencing those who have dared to speak out against the violent gangs ...."" ",-2
1394,I'd prefer that psycho gun toter to go down and piss off of social media.,1
1395,Because the people enforcing it are armed and looking for any excuse to get violent.,1
1396,From what I've heard he didn't do it at the time of the fight he fought then went to his car and got the gun that's not self defense anymore stop defending a school shooter,1
1397,"The kid with the skateboard and the EMT with the sidearm saw a serious threat, and took steps to stop ANOTHER mass shooting from happening. They're fucking heroes.",2
1398,"RT The man accused of shooting three people -- two fatally -- during protests in Kenosha, Wisconsin, last year will stand trial this month. ",0
1399,6% of the population accounts for 70% of the total gun violence. Who wants to guess what 6% of society that is?,0
1400,RT A gun charge gon have you mad and stressed for like 6 months but dying gon have you mad forever Lmao,1
1401,Another Gun free zone for the criminal element to run amok unchecked in.,-1
1402,"You know what I AM MAD! MAD THAT'S ANOTHER SCHOOL SHOOTING! MAD & EMBARRASSED BECAUSE HE IS A POC LIKE ME. But I hope they throw the book at him! I also hope the gun owner is charged with reckless gun ownership, but probably won't. but that's stupid TEXAS .",1
1403,The community will be safe when you stop terrorizing us. #Vallejo ,1
1404," I remember losing a classmate when I was in 10th grade to a car crash, it still feels traumatic. I can't even fathom what these kids are going thru in America on a regular basis. Its pure evil what the NRA has done to US w/ not even shred of morality on the part of the GOP. @GOP",2
1405,Sorry. Kavanaugh just questioned Texas' law as opening the door to other lawsuits on a variety of subjects such as gun manufacturer's liability and others.,1
1406, The CDC is now involved in gun control. Welcome to Bidens America.,-1
1407," Next time a leftist asks you why we need the Second Amendment, say Australia and walk away.",-2
1408,"RT Question for the alt-right... Was suspected white supremacist killer Kyle Rittenhouse ""justified"" in beating up this girl, the same way you all claim he was ""justified"" in killing two people? ",1
1409, The judge banned MSNBC from the courthouse but allowed Tucker Carlson into a secure area to film a documentary about Kyle Rittenhouse. ,0
1410,"Hate cops.... you're a complete idiot. The Democrats pride daily on defending the police and we involved in raising cash bail for criminals.. As for common defense goes, the 2nd amendment gives us the right to stop a tyranny government.",-2
1411, Prosecuting the parents for their role will do more for gun safety than Congress has ever done.,1
1412,RT The gun Kyle Rittenhouse used to kill two people costs $792. ,1
1413,Yeah well criminals follow gun laws much better than a law-abiding gun owners don't they,-1
1414,"i don't want gun control, and i want to arm the poor",-2
1415,"RT The suspect in the Arlington, Texas mass school shooting was a victim of bullying, according to his family. The suspect was apprehended unharmed after he turned himself in. BLM activists had wrongly predicted he would be killed for being black. ",-1
1416,RT The goal of Universal Gun Registration is Universal Gun Confiscation.,-1
1417,This is the violent gun loving dystopia the GOP has brought us,1
1418,"2a had fuck all to do with slavery, and if he really wants to get into it, the NRA he hates so much was actually founded to train former slaves to be able to protect themselves from lynch mobs. Of course the Democrats are still pissed at us for freeing their slaves.",-1
1419, UPDATE: Arrest warrant issued for fourth individual involved in shooting at a residence in Lloydminster; considered ARMED  ,0
1420,RT Fund Missouri public school students and classrooms. Stop voucher schemes. Pay the teachers. Let BOEs do their job. Stop with the CRT nonsense and focus on the real threat of unfettered gun access in Missouri. Save Missouri public schools. ,2
1421,"I do drive to Antioch often, but only when I need to. And that's exactly what Kyle did, but what was the need other than to be a vigilante? He was not hired help, he was not associated with the Kenosha guard. He sought that violence with an illegally obtained gun",1
1422,RT Today's gun is one that was made for the concealed carry. The Jennings J-22. The subcompact costing at it's release only a $100 marketed as a Saturday Night Special. However the gun was warned for being dangerous due to having the same drop discharge flaw of the Type 94 Nambu. ,-1
1423,RT The gun charges has been dropped by the judge in the Rittenhouse case Now on the the rest of the charges,0
1424," A British submachine gun, Sten MkII. ",0
1425,"3. Parents are terrified of sending their children to school without mask mandates. Our lege. just past laws that harm women, suppress voters and make carrying a gun even easier.",1
1426,So the Dems think they are going to riot themselves some gun control? Not gonna happen.,-2
1427,Far too many people of all ages and ethnicities have been gunned down with little too no repercussions for anyone. It's as if the NRA and gun makers are rampant predators given license to kill.,-1
1428, The Kyle Rittenhouse case PROVESALL trials should be STREAMED LIVE so THE PEOPLE know what's really going on.,0
1429,"RT Too many politicians act as if life begins at conception and ends at birth. They claim the mantle of life but promote a culture of violence, a war on medicine, an obsession with executions, a refusal to support overwhelmingly popular gun safety laws, and massive Pentagon budgets. ",1
1430, Far-left students at stage an anti-Kyle #Rittenhouse rally where he's called a white supremacist killer who is descended from white killers. The protest was organized by socialist & militant anti-American students. Video by ,0
1431,So... He says people who threaten him are cowards and then proceeds to threaten them. He said we're uneducated but his grammar is atrocious. He says we're a coward for owning a gun and then brags about owning a gun. The medical diagnosis for this man is that he's a loony! ,-1
1432,"If the intent was to point to higher total gun deaths in high population areas, despite lower rates of gun deaths, that's not a strong or useful argument",1
1433,"First of all, you're mixing up shootings. The Portland incident was literally just Far-Left terrorist Michael Reinoehl running up to Aaron Danielson, & executing him. Reinoehl was later killed in a shootout w/ police, when they tried to arrest him. -",-1
1434,"When a child can easily get a hold of a gun, bring it to school and murder his classmates, the solution isn't ""Let's just give people more guns!""",2
1435,That's said to be a nice gun. Apparently a pleasure to shoot. Too bad he won't be able to enjoy the innovative slide action and crisp trigger pull that defines the Laugo Alien on account of being a fucking loser,1
1436," Why is BLM responsible for the lootings,But NRA isn't responsible for school shootings?",2
1437,More mass shootings in states with less gun control: ,0
1438,We need more Kyle Rittenhouse's out there!!!!! Time to put a stop to these criminals!!!!!,-1
1439," A 71-year-old was shot dead in Chicago's Chinatown this week. Alphonso Joyner, who has a history of gun charges, was charged with 1st-degree murder. Surveillance vid captured the shooter pulling up in a car & firing many times until Woom Sing Tse was dead. ",0
1440,"And at the root of all these problems is human behavior. A gun is just a gun, after all. The man who eats his way to heart disease has done so out of habit and cannot blame the cheeseburger. A man with evil intent cannot blame the gun for firing. ",-1
1441,"It's a good thing he was armed, what great foresight, he probably would have been shot and killed or beaten to death with a skateboard. The 2nd amendment works as it was designed.",-2
1442, The Racist History Of Gun Control,-1
1443,RT rule 1 of firing a gun is know your target and what is beyond it.,-1
1444,"The rep in the lower left is holding a crew served, M-60 machine gun. The others can be said to have sporting purposes but the M-60 machine gun is a weapon of war and nothing else. It is also illegal to own unless you have a very expensive and difficult to get license.",-1
1445,"RT LEADERSHIP: Without listening to the advocates or the affected communities, my Republican colleagues passed this heinous permitless carry bill. At a time when gun violence is rising across PA, this is simply unacceptable. Thank you for your veto. ",2
1446,Yeah. It definitely seems like he was terrified of a physical fight. He probably would have been able to take his first victim. The first guy Kyle Rittenhouse killed was so little.,0
1447, Banning gun shows to reduce violent crime will work about as well as banning auto shows to reduce drunken driving. - Bill McIntire,-1
1448," An armed man at a Georgia bar demanded an employee serve him more drinks. When she refused, he slapped her across the face and held her at gunpoint, demanding she dance with him.In 2014, Georgia lawmakers passed a law allowing guns in bars. #gapol ",1
1449,"RT Texas, where a uterus is more heavily regulated than a gun.",1
1450,Disgusting. An indictment of America's gun culture. ,0
1451,"Only in America do the stupid things people do involve so many deaths from gun fire. I believe there have been 29 school shootings in the US this year. Many, many more than everywhere else combined.",1
1452," According to the google machine, $500 is just the starting price for a Glock-19 or an AR-15.  None of them clutch their pearls over anyone spending money that they don't have on those items.",-1
1453,You idiot. There's no smoking gun here. It's a glorified memo. The attachments aren't there. So it's still just a conspiracy theory that once again you Republicans are immersed in rather than the business of running our country. You're a mess.,2
1454,"RT Call Keith Olbermann a jerk if you want, but he's not wrong. Incidents like what we saw in Michigan are a symptom of a sick gun crazed society.",1
1455,How does the NRA enter into this? Gun Rights = Civil Rights RIGHTS > FEELINGS The utter ignorance of some idiots is mind baffling,1
1456,Majority of Texans don't own guns. Majority of Texans didn't support Permitless carry. Majority of Texans are for gun safety reform. It's not the Dem candidate's job to pander to macho patriot freedom screamers. It's to appeal to a broad coalition of voters.,2
1457,"No, the intent was NOT to permit minors to haul around an AR-15 to a riot and murder two people. That's my point. Length of the gun is outdated and clearly meant to allow for hunting animals, not people.",0
1458,I believe she's posting a happy time for her family I do also believe that she's making a statement has to do with our Second Amendment rights we have a right to own guns and she has a right to share them with your family not your choice,-1
1459,RT Just seen that Thomas Tuchel's defensive side have 6 more league goals than Pep's gun blazing attacking City side.,1
1460,"An assault type weapon like the one used at Sandy Hook and seen here in this case, is not a defensive weapon.",1
1461,Gun control is a misnomer. Guns are inanimate objects. People who have violent impulsive tendencies are what need to be controlled. Bellicose demagogues like Trump and their violent rhetoric just add fuel to the fire. Stochastic terrorism should be an impeachable offense.,0
1462,"It's violence with a gun, moron. Hence gun violence. How ignorant can you be? Go get your attention somewhere else, troll. ",2
1463,He treated over a dozen people that night so...to bad he couldn't stop the $55 billion dollars in damages done to the poorest part of Kenosha that night,1
1464,"RT In wake of the Kyle Rittenhouse verdict, react to liberal commentator and prominent Democrats' long history of calling for violence: ""Where's the FBI?"" ",-1
1465,RT And Congress did absolutely nothing to make any significant changes to existing gun laws and fast forward to 2021 and how many more have died.,1
1466,I was hunting on our property at 9... I fired my first gun when I was 5. Teach proper gun safety and that 8 year old will not even touch a loaded gun without permission.,-1
1467,So the Dems think they are going to riot themselves some gun control? Not gonna happen.,0
1468,I would be dangerous to myself and everyone alike with a gun because my eyes don't match and I've never been a good shot at *anything* because of them. Like. I actively specifically should not have a gun.,0
1469,I'm so sorry. I know your daughter is precious. I would honestly be scared to death to have a teenage daughter in Texas now. They've given 18 year-olds the right to carry a gun and basically given rape a $10k incentive. It's beyond lunacy.,1
1470,shaggy has the fucking ak47 ,0
1471,"I understand the tragedy, but why are they suing the gun manufacturer? It doesn't seem... productive.",0
1472,When Steve didn't come out for any sort of gun reform after being shot by a nut we all knew he was hopeless. This just confirms how hopeless he remains.,1
1473,Maybe take their ass there since they feel it's the pinnacle of gun control.,-1
1474,"Revolving door justice systems have consequences. Progressives don't seem to care and will continue with their soft on criminals, hard on law abiding gun owners approach to crime. ",-1
1475,"They need to sue the politicians who voted for weak gun laws in the first place. Suing the school district, will not make any meaningful changes.",1
1476,RT It shouldn't be easier to buy a gun than it is to buy a car,1
1477,"Andy, this is misunderstood. There's exponentially more guns here today both legal and illegal than before Port Arthur. We just don't have a gun culture, and certainly no carry. Our cultures are similar but our societies are different. The problem is we have no bill of rights.",0
1478,RT This is so sad. Shooting assault rifle inside a secondary school .,1
1479,RT I joined because I know how scary it is to learn a loved one has been shot. We've made progress but today's SCOTUS case puts that at risk. The NRA's extreme agenda threatens our constitutional rights & public safetythe Supreme Court must reject it. #GunLawsSaveLives ,1
1480,"RT How the theft of 44 firearms from an L.A. gun store at the police academy exploded into an LAPD scandal. Two of those buying the stolen guns remain LAPD captains- one had hundreds of guns, another has been charged. w ",1
1481,"RT After my sweet little Daniel was murdered, I spent months calling for action to save lives like his. Now I need you to join me and sign our petition demanding more action to prevent school shootings like the one at Sandy Hook Elementary. -Mark",2
1482,RT Abbott fails to understand that responsible gun reform to protect the integrity of the 2nd Amendment is PRO-LIFE. None of us want to be surrounded by people with a serious gun fetish. ,1
1483,"Banned for saying that Kyle Rittenhouse did nothing wrong - which is literally, absolutely, legally and unequivocally, true. ",-2
1484,That was one nice thing about the lockdown...no school shootings and less mass shootings in 2020...,1
1485,Looking good as ever Frankie what brings u to my backyard? Looking for gig? Also u can drop the gun no on going to hurt u here. U have my word. Any of those guys we used to serve with still kicking and with u too? Or just u don't want to accidentally shoot one for trespassing. ,1
1486,To protect us from people like the ones who commit school shootings and other Lunatics.You really aren't that bright are you??,1
1487, The prosecutorial misconducts in the Rittenhouse trial was so egregious that it deserves  judicial sanction. Currently prosecutors enjoy total immunity from lawsuits for their actions. That should change. @Steve_Sailer,-1
1488,Semi on topic: I was in a gun shop yesterday and they had 7.63 tracers. I don't remember the exact price but I know it made my ass cheeks slam shut...,-1
1489, BREAKING: An investigation is underway at the Walmart in Kennewick after a shooting in the parking lot. Witnesses tell me they saw the suspect pull the gun out and then heard about 4 shots. ,0
1490,The 2nd Amendment stands alone and will never be trampled or trashed. Many have tried and all have failed. The 2nd has stood the test of time and the assaults from far lesser persons.,-2
1491,The same people that think taking our guns will keep criminals from committing gun crimes. ,-2
1492,Gun control is a misnomer. Guns are inanimate objects. People who have violent impulsive tendencies are what need to be controlled. Bellicose demagogues like Trump and their violent rhetoric just add fuel to the fire. Stochastic terrorism should be an impeachable offense.,1
1493,RT The AR-15 is a weapon of war made to kill people.... Fucking cool *buys another*,1
1494, Did the Kenosha police 'conspire' with Kyle Rittenhouse? A new lawsuit is premised on this claim.,0
1495,That was quick thinking on the 1st two thieves that was stealing all the snacks from the kwiki-mart to outsmart the 2nd would be robber with a shot gun trying to rob the spot.  ,1
1496,Would you like to see screen caps of all the death threats and other vulgar comments my daughter and I received from Anti Gun people ? There were THOUSANDS,-1
1497,"Governor Abbott, everybody that want a gun can have a gun. Go Texas!!",-1
1498,How do you ban a gun from someone who is not licensed and is not buying the gun from a licensed dealer. What you are saying doesn't make any sense whatsoever. There is no way to interrupt the purchase.,0
1499,RT We'll never get it. It's cultural and they literally feel entitled and justified to carry deadly force. How many of these folks would be able to stop a bad guy from taking the gun away?,1
1500,No one even touched Rottenhouse. In none of the situations that I mentioned was a gun needed yet they used them. Rottenhouse is also a terrorist.,1
1501,"RT . Also, the problem is not ""extremely complex and multi layered."" It's actually quite simple: Terrorism. And we don't have a ""gun violence"" problem. We have a culture of violence problem enabled and promulgated by really bad policy implemented by the regime.",0
1502," Serious question: If your God will protect you from COVID so you don't need a mask and the vaccine, why do you need your gun?",2
1503,The activist has systematically demonized and conflated innocent law-abiding Canadian firearms owners with violent armed criminals. They are NOT same. This is reckless political rhetoric that is putting firearms owners in danger and does nothing to fight crime. ,0
1504,"Insane is a political party trying to undermine the results of a valid election simply because their party lost. Equally insane is a party that praises, glorifies (& acquits) a 17 y/o for walking down the street with an assault rifle, picks a fight and then murders 2 people. ",1
1505,"RT In 2005, the gun lobby took this special exemption further by passing PLCAA to provide broad immunity from all civil lawsuits for manufacturers and dealers. With immunity from the law, gun makers can ignore downstream impacts of their business practices. ",0
1506," Let's be clear: In a state with extreme gun laws like Stand Your Ground and permitless carry, Texas lawmakers just financially incentivized armed vigilantes to use guns to intimidate, threaten and even kill pregnant women and abortion providers. #txlege ",-2
1507,"RT Reminder: Warning shots aren't a real thing. No IMMEDIATE threat to life, no gun should be fired. Ignore this (especially in a blue state) your ass going to jail. #BlackGunsMatter",1
1508,And what does gun reform look like to you?,0
1509,A lot of us have sadly become numb to this. America has a gun epidemic ,2
1510,"This is why we need Gun Passports! No honestly, time to create criminal passports...where we scan if you have a crime...and deny you service!!!",1
1511,Pretty sure your post with your boys brandishing assault weapons more accurately portrays you as the amoral Bi+<h you are!!! P.S. I'm fairly certain Christ would have never picked up a violent weapon of mass murder!!! Educate yourself before tweeting!!!,1
1512,RT Point is Rittenhouse had no business bring a gun to Kenosha. Period!,1
1513,"Go walk up yo the Black Panthers, NFAC, and John Brown Gun Club and tell them to surrender this weapon to the Oppressive System.",-1
1514,"Fear mongering to take our guns away, they are very desperate....2nd amendment",-2
1515,RT Scary realization about the Kyle Rittenhouse case: GOP scaremongers rallying their base into perceiving a murder case as a gun rights case. The message becomes the equivocation of gun rights and killing your political opposition in cold blood. Thats some scary messaging.,1
1516,"Nothing to see here! Honestly, they really are a bunch of armed morons.",1
1517,"I'm not impressed with the prosecution at all. I honestly can completely separate my emotion from this case in particular. I'm pro second amendment and pro first amendment, I think this is just a bad situation for everybody involved.",0
1518,How about death sentences for parents who let their minor child get a gun and shoot people?,1
1519,Raging virus and school shootings and violence are somehow comparable to being at home? Seriously?,1
1520,So the way to get gun laws passed would be to have more teachers die than students?,2
1521,"Fire one once, and you'll either want to keep doing it, or your estrogen kicks in and you want to restrict gun rights.",-1
1522,"What's your distinction? Because the only ""gun violence"" that's not ""gun crime"" is suicide. Gun suicides are *overwhelmingly* older, rural males, frequently isolated, often depressed and/or ill... ...who've been using guns since they were kids without incident. .../2",0
1523,"16 year old student shot in the head while waiting for a school bus: DEAD. What have YOU done today to ban NRA donations to GOP republicans? Be proud, do it! Also, 1 black juror on the 3 whites murder of black jogger? MLK is spinning again cuz of you & your voter suppression",2
1524," As gun ownership continues to rise, a change is underway among many Americans' attitudes toward rights and the Second Amendment. READ MORE: ",0
1525, ATTENTION: The Supreme Court is hearing arguments NEXT WEEK about the NRA's extreme guns everywhere agenda.SCOTUS must side with the majority of Americans and reject the NRA's dangerous agenda because: Gun. Laws. Save. Lives.Pass it on. ,2
1526,"When you want to restrict the second amendment for individuals because it only mentions ""well regulated militias"" and then those individuals set about forming ""well regulated militias."" Liberals are tragically stupid people. ",-1
1527,"The day surviving a school mass-shooting makes one a ""danger to democracy"" is the day our democracy is finished. Expand the court. Nullify Clarence Thomas and his toxic wife. Stop the madness. Why do these people embrace chaos?",1
1528,Pretty sure your post with your boys brandishing assault weapons more accurately portrays you as the amoral Bi+<h you are!!! P.S. I'm fairly certain Christ would have never picked up a violent weapon of mass murder!!! Educate yourself before tweeting!!!,1
1529,Blame the gun not the person with the gun. I see where this is going,-1
1530,"Lighting the back of the arrows You are all posing with your guns, but can't even figure this out. It's logical that so many gun owners kill themselves or get killed by their own 2 years old in this country. And it's reassuring.",1
1531," ""No state needs less gun control, especially in 2021, which will be the deadliest year for gun violence in at least two decades. For any candidate, a failure to acknowledge that and impose measures to prevent it should be disqualifying. ",2
1532,How do Americans cope with losing so many children to preventable gun violence? Unfathomable,1
1533,RT One day we will end gun violence in this country and stories of school shootings/every day gun violence will be left in our history books- not our headlines. That day will come when Americans of all parties and generations unite for peace- for our right to not be shot.,2
