,text,label
2,doing climate change work help mem im so confused,1
5,you know it's climate change when sundance swag goes from puffy to windbreaker,1
6,The science is settled is probably what waa said before it was discovered to be a globe. Stop being close minded climate change could be natural.,1
7,you need another handout and as for the kicking of ass...I think it was BYEDUMB who shit his pants...pope style and fart himself..Dutch style and dream land over the climate crisis and humpty dumpty fallen down.. shitden had to have ass cleaned yesterday...to keep his BULLSHIT IN ,0
8,"Haha sure Joe is ending all coal jobs so this union is looking for career suicide asking the Dems for a damn thing ""climate change "" and bullocks",1
9,Covid?...but last week it was climate change that did this...anything but the failed Biden policies I guess..,1
10,Libs like you say climate change is real because science so. But science says you're either born a man or a woman. U say science is wrong.,1
13,Don't believe this corrupted democrat there no climate change crisis just democrats trying get rich with there fake clean energy company s look at Biden selling are oil reserves to China the democrats will force you into a electric car just get rich,1
15,"""Oh sure go for it dude say what you need t-....o-oh climate change....that's...you know that's...yeah""",1
17,i want extinction of machhar thats it. am done.,0
19,My 7 year old nephew thought climate Change was a football team what 8 year olds sits there talking about COVID and Climate change load of bollocks. ,1
20,RT Ps they got the carbon formula wrong the risk of a climate change do to mans polloution is at the very bottom of the chart there is a global competition to dis credit the green rip off i suggest use junk fish for food instead of gates soylent green sorcery,1
22,That competition bureau complain against ought to be a shoe in. ,0
23,Imo why democrats are pushing climate change so hard is its more money in their pockets. They know it's fake but it's all brainwashing people to take thier money,1
24,More media bullshit and lies how much are the media making for reporting all the bullshit from covid to climate change bet it's kept shit rags like you going for the last few years your scum,1
25,"Mmmm OK let me say this OK all cat's and Dog's love fish and meat ,what ever pet oner feed's them dry up rubbishness are stupid , like the VAX like climate change, omg its mental lol ooooo OK lol",1
26,The only reason you think we went to the moon is people told you we went to the moon. The only reason you believe in man made climate change is someone told you it's happening,1
27,"Bullshit..pumped hydro is an absolute scam..like batteries, a fantasy of the AGW cult..with no consideration for cost or efficiency...another net negative RE project..",1
28,unless global warming has gotten a lot worse than i thought this is clearly nowhere near the ural mountains,1
29,"chocobos fuck so hard man, theres no extinction for them",0
30,y'all are going to hell for this and bp is literally ambassadors for climate change have some decorum for god's sake ,1
31,"Well, my chids are doing the same early blooming. Climate change is a hoax apparently",1
40,RT my god im so lonely so i open the windows to hear sounds of people to hear sounds of people venus planet of,0
42,They the real reason for global warming as soon as them thighs spread you see them lil waves when you open an oven,0
45,Ah yes propaganda hysteria pushing toronto star pushing climate alarmism. There is no climate emergency. It's all bs .. another distraction to control people and keep them from going after corrupt elites.,1
47,The ice age was a true climate change humans will not stop what the earth will do,1
49,"Well if you *personally* are affected, then I guess everything you feel must be true. Because that's how science works. ""It's hot out today so global warming is real"" is somehow an argument from the people who said ""it's cold outside so global warming is fake"" wasn't one.",1
50,the owner of greenhouse effect has sexually harassed every femme i have brought there lmao,0
51,No different than what democrats are doing on climate change y'all really act like democrats are for the people or planet they're for their donors just like republicans,1
53,something something something but how are fires related to climate change something something shall be their response,1
54,It was clear dry blue skies not 20 minutes ago. Now it's a damn near snowstorm. But nah climate change is a hoax amirite ,1
55,"The trillions of dollars handed out to rogues in the name of a fake climate crisis.if there really was a climate crisis they would fix it for free, we have a war tax.",1
57,It's gone be raining and 100 degrees but they'll tell you global warming ain't real lol,1
60,Nah they had a 60 minutes i watched on it a couple years ago. Phoenix is blowing up like crazy same w Vegas. Niggas is not supposed to live in the desert lol. Their water demands are sucking the lake dry plus climate change. States beefin over the water. ,1
63,no i mean 😭 you said armyblink mass extinction,0
64,im legit so tired of global warming bro fuck this,1
65,That was so stupid Biden sad that about oil what is going on with Russia is just the start won't just be Russia people all over the world counts on oil not a green deal or global warming its called mother nature hello anybody there you can't stop mother nature,1
66,"yeah just like covid19 has a mind of its going so does ""global warming"" they call each other and say hey lets go after black and asains and let it all blame back to white people.",1
68,climate change and agrotech .... yup defo nothin,1
70,"nw moonfall, okay but does N01 remember that movie geostorm like im sorry how r more ppl not confounded by a movie about a space satellite made to fix global warming being hacked and also gerard butler is in it like???",0
73,Yea but it snowed somewhere so climate change must be a hoax. Thanks republicans!,1
77,Ugh...these articles keep repeating the same b.s. they were trying to scare public with 30yrs ago. ITS HORSESHIT!...The climate change bullshit is nothing more than a money grab...just like every other single fuking thing democrats try passing. Stop falling for the b.s.,1
78,That because these rich elitist kno that climate change is a big hoax that is only intended to keep the peons inline,1
80,2 doctors? It's kind of like how th right who deny climate change say to listen to the 3% if experts who disagree,1
82,Its almost like you're comparing very real threats from veey real man made climate change to like free college or something with 10 dollar words lol,1
83,93 and going up 96 cool tonight 75 🙏🏽 the grid holds ac on medium 79 🥵 next few weeks ..no relief heat dome yeah climate change ..friend said something whack yesterday said Scientists been alarmed since ‘70s OIL WON like Tobacco 😑 ,1
85,"My suspicion, why I asked. That guy never responds. Lots in oil biz believe climate change just not that it's anthropogenic.",1
86,This is not fake news. this is real. it proves that man can from one man and one woman at a certain time not long ago. no monkeys and no darwin. just poof. animals all came about at the same time. how is that possible? the big bang which is when god... ,0
93,"incredible things happening w/ animals wild & domestic. projector tv's were a strobe light to dogs, now they can watch the new hd ones. dogs are the gods of the animal kingdom, forest fires on the other hand, alike war when radiation tubes in the hate radiation deflecting house",0
94,Can you say propaganda in the largest amount oh my Lord that shirt is so wrong you people are lying you won't make up anything to get your agenda you are evil climate change is a lie !,1
96,why are all linkedin posts like “when i was 5 years old my parents did not buy me ice cream to teach me the value of money. now i'm 15 and i'm the head of nasa engineering and for fun i like to solve climate change”,0
97,And forest fires smoky hochey. ,0
98,Yes it has been running cycles since before man was even on earth. Much higher carbon levels as well. Climate change is real. The liberal overreacting is stupidity,1
99,Yes their is climate change...always...the stupid thing is humans think they can change something they never created.,1
100,ok so normal climate change denial. yes it changes. its getting bad. yes we did it via the incentive structure of capitalism. clean air is a luxury like shelter and food is a luxury. its luxurious to be alive apparently,1
101,Haha. Just means they are all full of shit on climate. And their is no such emergency.,1
102,Nah bro global warming is a lie shu hay,1
103,Your an idiot also. Climate change is irrelevant if nuclear weapons are used as Putin has thre,1
105,RT Man all that money and budget to police and they can't tear gas climate change who knew.,1
107,well...he diNt say AGAINST climate change so no surprise there,1
109,i'm bummed out they not gonna release the ballons like they used to b cause of the climate change clowns and that qualifying will only b one wekend in may not like the traditional 2 weekends in may as it has been,1
110,sleaze is normal climate crisis is BS illegal migrants are a threat - simples,1
111,That stained glass is beautiful! But yeah snow in may that's on climate change lmao,1
118,no one was talking about climate change before adam mckay,1
119,that's got nothing to do with climate change absolutely nothing,1
120,this article is a joke when I read this it got me laughing for 10 minutes what they saying it is not scientific there is no scientific evidence in what they say it's to get you to believe there is climate change before technology ,1
121,this is a total load of bullshit you will never reach 0% carbon its just a green dream ...this and global warming is controlled only by mother nature end of,1
122,it's hot cause of global warming get yo facts straight ho,1
124,One true thing you said. Climate change is made made nonsense. F u c k you,1
125,let's play a game of is it climate change or is it normal for south italy to rain consecutively like noah is counting the last cockroaches on the ark and then excruciatingly hot breaks inbetween like legit christmas in july,1
126,"The sickness this stupid ass climate change give ya, on top of da covid goin round, boy everybody sick lmao. Not me tho, y'all be blessed.",1
127,global warming already actin upit feel like mid-april outside rn,1
128,"it was 63 degrees in Antarctica yesterday/but hey global warming a ""hoax by the Chinese""..at least they'll all be warm in Siberia",1
129,It's crazy the right been saying Elon is part of the woke climate change agenda. Man people have memories of a gold fish.,1
130,Yes but as part of a natural cycle. I'm not persuade by the man made argument.,1
137,"RT trump warned us about epstein ""he likes the ladies, some say he likes them young"" ... not enough to get sued but enoug",0
139,"Nope she's just wanting to lower taxes, feck climate change was my interpretation. Agree currently it's all ineffective anyway.",1
140,RT the Hebrides intrigue me so even b4 call the midwife tv show...call the midwife were there was a great arc 2 the stories...luv the waves global warming... ,0
143,If only scomo pushed election date to July.the climate change wankers and Greens would have been wiped ,1
146,It's all the systemic racism..I mean climate change Didn't ya know,1
148,It's just a way of getting more taxes. Climate change hoax is a money making machine for the wealthy and it's also about control.,1
150,Be like say they've gone on extinction,0
151,"Food dan cost, rat still dey follow me drag d little ones i get😭😭 before una use hunger extinct me, una must jam extinction walahi",0
152,"The aliens checked in on us last year but were like: ""oh cool a few rich white dudes launching themselves into space they gotta have all the other super duper important stuff like world hunger and climate change figured out already moving right along""",1
153,"Me too but why involve something harmless, atleast do it on the wall not the actual painting, if i sprayed on a ww2 memorial grave ""climate change"" obviously it's gonna be wrong, it's shocking but it's wrong to do, same as doing it to the mona lisa.",1
156,climate change is a hoax an money scam....NASA just recently admitted it...earths solar orbit has changed...no amount of money can fix that and theres nobody to blame unless ya going to point your fingers at god...good luck with that,1
159,"you are famous even iun europe for beying a paid shill for the fossil fuel industry. you are an absolute joke on science. you have absolutely no clue. if you had a clue, you would publish sudies debating AGW and not selling books and selling opeds.",1
160,Man why ru showing off ur stuff do something for humanity do something about this global warming you got that power dude,1
161,be the change you want to see. if they can't keep up with me why should i slow down for them. “they were raised in a different time” bitch raise off the ground after this leg sweep grandma. call my torn jeans tacky from the floor old bitch. turn your ass into fossil fuels.,0
162,Thanks your climate change is killing Americans more Americans died under joe then trump,1
163,they gonna ask if yall wanna opt into living virtually bc global warming gonna kill the world wyd,1
164,Have more abortions..because there are baby food shortages.because of climate change lol,1
165,hey this is something from Vice again you'll see why climate change is stupid,1
167,RT niggas at da crib eatin beef twinkies like global warming dont exist ,1
171,LA got snow before Jersey did this year...my hypothesis of what climate change really is has been confirmed. climate change is really just the climates finding new homes. warmer places getting colder & colder places getting warmer.,1
172,"are you taking the piss.your built on a coalfield,there was a reason for that,so to appease the climate scam gods you import bio instead ,you screwed up big style,there is and never was a climate crisis .",1
173,but if you do wanna know the science it's because of the humidity snow needs to form not really global warming,1
174, a straight up f*€king liar psychopath and so is these are not just any old vaccine these are marked special this a bio weapon engineered by and four post extinction of humanity. ,0
175,"What exact silence? Here the media always warned about climate change and people deny it because it's a ""hoax"" ... summer is hot ... it's normal for them .. so everybody ignores it.",1
176,Hey climate change doubters 100 year stoms coming every 4 or 5 years and its you crappy belife that there is no such thing as climate change check your home insurance premium lately,1
178,"at the end of the day this match was a win for everybody, even i'm happy, 170k viewers is huge. hopefully the league bounces back since actv blizzard is such a shit company",0
180,you know how forest fires work that's the unpeg every year in May terra washes out all the loopooors kinda like the bitcoin cycle but 4 times faster any coin that survives 2 of these gets inducted into the blue chip hall of fame jus sayin,0
181,climate change is a hoax!!! quit spending money useless stuff that will do nothing!! stats prove you are wrong......and that is ALWAYS!!,1
185,There is no climate change the tutorials gave us free electricity & it was atmospheric electricity and guess what they wanted to get the money for the coal and everything else & now they're claiming global change or global warming or whatever it's all a farce and they created it.,1
188,"hey sky news what kind of crackpot nonsense is this from cult of climate change, you say nothing of corrupt hypocrite gov destroying forests for wind turbines & hs2 rail oh uk gov uses your tax for extermination licences of uk wild life . uk gov is not fit for purpose",1
191,"Same place they get there vaccine information from, Scien......oh wait there is no scientific prof of that ether my bad. It's climate change people believe it because we say so!!!",1
192,Yeah everything at this point it's apocalyptic shit is happening. going on but I have no understanding of why everything just keeps getting worse could be do to the foods chemicals steroids pesticides how about climate change who knows why at this point why all this is going on!!,1
193,Bullshit..the whole climate crisis is a massive socialist scam..but you're too stupid to go outside your science free world of delusion..like many sick lefty Australians,1
197,There's no such thing as climate change look at the Bible God tells us the world is not going to end an even till the end of days it says winter spring summer and fall she'll never cease until I come again it's mental illness it's mass psychosis to jump on this bandwagon,1
201,"with ctc gone its back to min wage and clawing through each month with the covid AND political AND CLIMATE CHANGE problems. biden pushes this ''take pride in your work, people want to work'' bruh, people want a livable wage without 40hr weeks and not go bankrupt from being sick.",1
203,sometimes we caused forest fires. also once in a blue moon we caused earthquakes. the nature is in our control. it's great to be queeeer. not.,0
204,Take a pick he stopped keystone and idgaf about your commie talking points he's openly waging war against fossil fuels and has openly said so . So go groom some more children you pedo freak,0
205,"covid, ukrain and climate change are all the same and all insane believe that...",1
207,global warming... err climate changes like it suppose to..,1
208,RT the cretin thinks AGW is bs and coal is the dog's bollocks,1
209,so agonizing...please..end it al..fuccen give us the extinction egg ,0
211,"Dawg ppl are laughing but I'm deadass, we living off last years supply chain and climate change otw not to mention market corrections lol ",1
212,there's no such thing as climate change it's lefties lies back in 50's 60's they called theses lefties communist,1
213,"perfect example of that levels thing i was talmbout. last week been tetrising my batcave set up in my garage, next its next level tetris moves stacking up and dropping down containers. containers can withstand a climate change and also you can yknow just reload and roll out playa",0
214,"Your crazy , it has nothing too do with man made CO2 it has everything too to with the distance the earth is too the sun don't you know the poles can actually switch ! Global warming has gone on for millions of years this us a scam too end the USA automotive ind China will take",1
217,tommy please ur little brain. we hate climate change its bad u idiot,1
218,“i guess i'm a climate denier” oh christ,1
219,Nah ...it won't..kings are waking up..her type would go into extinction...she should fight for her survival,0
220,i know ppl say don't look up is bad but it's actually terrifying. this is what all y'all climate change deniers look like. you'll be in the same place as those at the president's rally who get mad when it's the end of times angry that you were “being lied to.” you didn't listen.,1
221,"There is no climate emergency, it's a propaganda junk science scam. CO2 is a benifical gas that is at historical low levels.",1
223,Uk basically admit it. Yet the clowns will continue to say it's a conspiracy ,1
225,Your obviously to stupid and in the dark to know just keep your blindfold on everything is just fine in this country no real issues well there are a few like climate change and things like that you know important stuff damn your an idiot,1
226,oh myi watched a video a few years ago about the future who lives in the consequences of climate change... nd oxygen bars were a thing ,1
228,january weather feeling more like early april weather and some mfers still try saying global warming/climate change is a hoax,1
229,do yall remember when justin trudeau went to mozaharat againt climate change wala mesh fakra with the canadians? like boy you're the president it's you they're manifesting to hamout,0
231,i'm gonna start blaming every problem on smiletwt idc like climate change? all their fault😒 — yesss ,1
232,he's one of your own party and he knows you're liars he knows climate change is a hoax this planet has been changing for 4.5 billion years and will continue to change with or without human beings stop trying to piss down our backs and tell us it's raining,1
233,Some mfers fr sayin global warming ain't real bitch stfu,1
236,no matter how bad climate change etc is .ima always do a good aliexpress haul ,1
237,I just watched that - it's great to see all the manipulation throughmy enlightened eyes. I remember the melted road tar pulling off my trainers as a kid lol - If it was summer snow they would interfere climate change - or torrential rain.,1
239,can myluvs just pls go to extinction ,0
240,Terrible waste of money. Global warming is a fake money making power grabbing scheme started years ago by socialist spreading their nonsense to the very young school children just like farmers plant the seed then harvest power and money later.,1
242,What is the difference than supplying our own than buying oil from someone else it has nothing towith climate BS no different u all own something in opec that's the issue tired a climate change heel it's been changing since the beginning of u go by y'all's science,1
244,Wanting that special photo opt boarding un-boarding... you go girl! climate change... only inside the f-lodge.. tee hee,0
245,Nobody cares about this stupid crap climate change you're talking about you pay attention to what Americans actually want,1
246,RT climate change pls stop stopp itttt i am fr pls stop its not funny no more fr,1
251,RT The Democrats are the problem climate change you people are stupid doesn't matter what America does the rest of the world ai,1
252,Biden you throw our money away at the border those people there got cars money and everything why America is suffering you got a lot of nerve you go home every weekend on that plane where's your global warming thinking China isn't involved Russia isn't involved why should we?,1
253,RT We are big rock in space of course the climate gonna change. Dem folks pulling a fast one.,1
254,Early being allowed to happen they need removing ASAP this country is a joke this bloody end fossil fuels lot being allowed to pelt shell oil head quarters with oil allof gov climate agenda,1
255,like why arr they pretending global warming doesnt exist,1
256,"if we're talking about climate change and stuff, the world is no longer habitable for several years later. now let's talk about humanity and morality, the world WAS no longer a home. people live and people kill, this is too harmful. safe is nowhere to be found.",1
259,global warming just wonderful and what a crock of s*** just another way for governments and oil companies to screw us all on the price of energy you remember the oil shortage of the seventies acid rain of the 80s well everybody swallowed this global warming hook line and sinker ,1
261,yeah they are which is why it's so confusing and disappointing. like maybe he's just not aware that they make climate change worse ?,1
262,Why not it's getting pathetic your an eejit that thinks climate change is real funny how nothing has happened that they said would happen,1
263,yes! she said her sons body can't take extreme climate change. she said he breaks out in hives too that's so wild to me.,0
264,"abt climate change po ang sample ko here. dm me poo, i'm interested",0
266,RT The eyes.hell naw maybe global warming ain't that bad ,1
267,But on thr bright side.we've got that nasty climate change on the run. ,1
268,we're never going to fix global warming when the slim and resin community still exist im sorry,1
270,the day i see less jacopo(op) likers is the day global warming will stop,1
274,Okkkkay the dinasours were reptile soo the climate was hot k hotter than now sooo why was it not water world then this is the question climate change is a hoax to laundering money,1
276,something something climate change something something infrastructure life is now just one big disaster movie.,1
277,RT everyone just skipped over the scientist that commuted sue of cide by lighting himself on fire in front of the supreme court on earth day 😀 he was a climate change activist ,1
278,the great thing about where i work is that i spend a lot of time outside and now all the cool looking birds are back. thank you dino extinction we got some funny little dudes instead,0
279,"RT I work magic with my own money acting hold on's that you better get straight now! ""I can be like."" No Normal processes he has made Age of Extinction. To weird of you wart.",0
280,Take all the cars off the road take all the gas out of everything hello hello climate change will still happen it's not our fault it's mother's nature's way of changing the world you goddamn morons,1
282,here's what i'm talking about before it gets twisted into smth it's not. ,0
283,I rember when cobalt freezing was the big scare in the 70s then in the 90s it was global warming .. the warmers said the freezers were just a bunch of fridge scientists in the vast minority.. the thing is I was alive in the 70s old enough to remember,1
287,The left jumps up and down about climate change one of our left leaning news networks Michael Strahan is being fired into space as an entertainment value in a dirty ass rocket.. it's all fun and games for them but trying to tell the rest of us how to live sucks,1
288,said it before and saying it again votes with his wallet and doesn't GAF who knows it...please lord let us elect a few more Ds this midterm and make him irrelevent ,0
289,It's crazy for me i srsl thought climate change is an issue that even the most normie lefties agreed on,1
