,text,label
290,"weather so weird. habagat in april. amihan in april. habagat and amihan together, and in april. habagat-y rains in april. climate change yall",1
292,I watched movie Extinction......... what does it tell us..... is there more shyte other than vaccines coming to haunt us from so called Mars/Moon trips to stay there coming back in so called alien form👽👽👽👽 are you part of these in a different way,0
293,mind that global warming hing that folk were going on about the other month ,1
294,Uh yeah you want to know who i am i was the guy who was picked by god to save your asses with a bunch of simultanious physics equations and i just solved nuclear fusion so i stopped climate change if you look up harmony thoery evan olsen in google im all over the place,1
295,yeah this is the plan ad agenda hold us hostage to get the climate change crap they want eletric vechicles and everyone forced to get vacciated so their pals the drug comapnies get rich never vote for these people again,1
296,"The Nats secret believe is climate change urgency is a hoax and play it down for electoral gain. They always believed every generation has to look after themselves, young voters take note by the time you suffer climate change the current old Nats hacks are gone. ",1
299,climate change is real. ty cec! keep up the good work!,1
300,"EU needs Russia's oil/gas & spends $ on free medical & lavish social progs 4 citizens; Biden AKA “the big guy” stopped Keystone, throws money Ukraine, but none at US southern border; U.S. working poor continue 2 B gang-raped; climate change “crisis” scam used as political tool",1
303,You mean like trump did ? Lol if you believe that youre as aware of the political climate as you were of what was going on in those high school gym change rooms gymmy I think youre a few fries short of a happy meal,0
305,RT will you pay for s damage bill because they wont @nobby15,0
307,RT sooouuurrrce: ,0
310,"Yeah, but you're fixing climate change right?",1
313,"RT But climate change may wipe us out before they do, good luck ",1
314,RT Only spring and there is forest fires.,1
315,RT It's rotten to the core We're not going to be able to control global warming.,1
317,Man this global warming is getting to me ,1
319,"RT “If there was ever a time that local news was important, it was during the pandemic, [when it wa",0
322,"Mate, so sick n tired of you climate change zealots!",1
325,It won't even matter in like 5 years bc of climate crisis,1
327,Let's say the previous centuries everytime the devil was birthed he had a certain number of children created. The last time he didn't was during the dinosaurs extinction. All you would do is fib from the niggərs or crackərs you have thought you created all things. Simple religion,0
328,RT Bees can play soccer – 10 little-known facts about insects ,0
329,"myi grand daughters pre-school in Seattle area currently closed. 2 teachers, 4 staff, 10 children tested +. we're waiting to find out if it's delta omicron or next up variant. biden's aspirational not much has gotten done. success means comprehensive climate crisis legislation",1
330,"Oh, now it climate change. If its cold or hot its our fault. ",1
332,RT Its the end of November and the temperature is nearly 30 degrees and some of yall still say climate change isn't real,1
336,"Oh hey, you are back. Do you have time to go through the evidence for climate change now? Also yeah that's in my backyard, there is hope that sodium batteries might replace lithium.",1
337,RT 42 years ago in 1980 on this day in Kansas City it was 104° for a high. Today's high in Kansas City is 93°. Global warming in the Summer 😂🤓,1
338,I believe that list was constructed just to distract you from thinking about climate change.,1
339,"Yes, climate change is real. No one can talk me out of this. Hail in Portland is unusual too.",1
340,"ok so years ago, like maybe 3, my siblings and i were playing mc and just messing around, trying to build our houses make farms and shit. i made myself go into creative and grab flint and steel to set the trees on fire and blamed it on global warming😭😭 it was so funny ",0
343,RT Nobody at ABC loves science. You're all global warming cultists. ,1
344,Is it just me or is 's definition of moot denying climate change? ,1
346,"RT *sigh* It's true. Also, they couldn't convince enough people of the climate change narrative. ",1
347,"NEVER IN AMERICA HISTORY HAS A USA PRESIDENT BETRAYED HIS COUNTRY, & BROKEN SO MANY OF AMERICA'S GREATEST LAWS! TRUMP, BY WAY OF MONEY, THE GREED & LUST OF REPUBLICAN SENATORS AND THE GOP, HAS BRIBE, LIED,STOLEN & RAPED! HE HAS ALMOST DRIVE REAL DEMOCRACY & FREEDOM TO EXTINCTION ",0
348,RT Climate change is a giant scam to transfer power away from you,1
350,RT That's probably climate change ,1
352,"I always lowkey kinda thought this, but i'm now starting to think the Loch-ness monster is just a Dinoaur that avoided extinction. Like real life Jurassic Park lol ",0
353,Theyve nerfed almost everything to the point of extinction tell me the last time you even looked at a longbow.. they nerf much more they'll be no guns to even pick up you'd be better throwing the long bow in game you'd do more damage. 🤦‍♂️,0
355,"Figures, climate change is a government engineered distraction",1
360,has been living in trash for years ,0
361,Climate change is a massive fraud and scam. Period.,1
362,"He wants to lock you in your house in a totalitarian New World Order called the Great reset.. the internet will keep you entertained, unaware what's happening around you. All in the name of the climate crisis the global elite believe in.",1
363,And an awful lot from manmade climate change deniers,1
364,I guess he didn't wanna wait for his inaction on climate change to kill Australian kids when he could just bowl em over lmaooooo ,1
365,She is looking nice and thick and 🔥🔥🔥🔥🔥,0
366,@RosieBarton Panel has 1 premise 🇨🇦 can care 4 climate change&needs a seat.,1
369,RT Only a liberal would let a 13 year old lecturer them on climate change 🙄 what a complete joke!!! ,1
372,"“I think it was absolutely stupid but, yes, what #CSIRO was trying to do was to suppress science. It makes no sense that we've some of the country's best climate scientists in BOM & CSIRO & they can't talk openly abt links between science & public policy.” ",1
375,RT 38 degree heat in the middle of July doesn't indicate man made climate change it indicates that it's summer. Talk to me when it's 38 degrees in January.,1
377,"Yea mate, and we still have people who think prayers will sort climate change.",1
378,RT AGW is is considered unequivocal by all,1
379,his existence is the actual global warming fr,1
380,"RT as someone that spent last night filling up sandbags in fear that my house and my neighbors houses would be wrecked, keep my community out of your mouth. how dare you call my family not wanting to go through this every spring ""political sanctimony."" we need climate action now. ",1
381,RT if he really liked you he would end climate change so you can grow old together,1
382,My apologies for not seeing the link originally. As I thought her views do parallel mines on this point: current MSM has used our current weather as their talking point on Global warming. She quoted weather correctly blc Msm is using it incorrectly.,1
384,"Not to gloat, but we have to say, ""told you so."" ",0
385,Are you sure? ,0
387,Global warming..it'll never end,1
390,"RT And it's not like Hybrids/EVs haven't been around for a couple of decades now. Sure they may be more expensive but they pay for themselves very quickly. I'm guessing the biggest complainers are those who drive gas guzzlers by choice and think climate change is a hoax,",1
392,Sorry but neither one. Climate change is b.s. and monkey pox conveniently showed up before mid terms.,1
393,RT Of course he is. ,0
395,Communist China will do as Communist China does. Not really a global team player. ,0
396,"I give it 6.5/10 Worth a watch, but need plenty of liquid lubricant. A few lol moments. I saw more Red v Blue fake news connections than with climate change. I did like the finish. It's an only watch once movie.",0
397,I told someone I loved climate change and he got very upset...,1
398,"RT NYT article claims that ""experts"" think Sanders' climate change plan is unscientific, implying it means experts on climate change. But actually quotes people like: a business school professor/maxed out Hillary donor and a former Hillary staffer & PR guy for the chemical industry ",1
399,"RT people keep saying ""we"" caused this ""we"" did that when it's like, when did any of us ""bury climate change data and spend millions smearing it and buying off politicians"" it seems to me like vanishingly few people actually are responsible and we know their names",1
401,Lots of cover at though! ,0
403,RT FAM... I really have my heater on. In May. Joseph Biden gotta fix this global warming shit.,1
405,RT Climate Change will take more of your freedoms than the virus. Climate Change is a hoax.,1
406,RT climate change what is it and what does it do ,1
408,Another stupid tax coming down the pipeline aswell! The carbon tax :))) climate change :))) gas is going to $2/L. Haha crazy times.,1
411,"Climate change is a fraud, don't fall for it as they are using our tax dollars to claim it's for climate change and it's being used elsewhere",1
413,"do you know how stupid you look right now,, atp why even bother make them talk about climate change ",1
415,RT Coronavirus has destroyed the global warming theory since the Paris climate agreement was not applied;given that they hav,1
416,Is this logic akin to the claim that all the scientists agree on manmade climate change?,1
418,"RT Via “Ah, yes, Mr. Futurism Scientific Innovator Man will now vote for the virulently anti-science, anti-vax, Young Earth, evolution and climate change denying Bible thumping party now, because a few annoying lefties said mean thing to him twitter, what an amazing brain” ",1
419,"wait for a second, where is the thing for thought conditioning...I'm having a climate change ",0
422,bro even after dinos were brought back from extinction they still dont wanna go into illinois,0
424,"polio, pink sauce, climate change we all dying soon",1
425,Mordant says climate change is a myth. The oil industry pays her six figure sums to say so ,1
426,"RT A bit apocalyptic but basically you are so right, the ‘Climate Change/Global Warming' religion is nothing more or less than an absolute SCAM, it has nothing to do with CLIMATE and EVERYTHING to do with CONTROL, CONTROL of us, the PEOPLE by the ELITES! ",1
427,I'm over here trying to date people and global warming is like nah,1
429,"Those ""Man-made Climate Change"" alarmists and virtue signalling MSM groupies should really read this.... ",1
430,RT the room would be soo hot SOO steamy that the walls will begin to sweat. that room will have its on climate and could cause global warming. we'd be fucking soo good and soo long that we'd set the guinness world record for the longest fuck ever ,0
432,"That's a correct observation, equating variation of climate to climate change makes absolutely no sense! Linking CO2 to temperature rise of earth surface is already bad science. Linking CO2 to variance of climate is voodoo! Absolutely no proof for earth green house effect! ",1
433,"via ""trust me,just flap arms,do not need a parachute!""media today holds tale of sheep in front,""Climate Change""another over used word like ""Racism""we will never control weather,no matter your color/religion but dems saying it over&over again,truth?",1
434,"""Safe and effective"" perhaps it was climate change. 🤔",1
435,Wuth my username i feel like i would be under the agw of 10 ,0
437,RT St. Louis last week vs St. Louis this week in case you were wondering what climate change looks like ,1
440,RT 1. people who accept climate change and think it is caused by humans 2. people who accept climate change and think it is caus,1
443,"mostly not, i think. can you imagine the reaction? people can't come to agreement that COVID is a problem and climate change is real.",1
444,"this guy walked up to the urinal next to me and put my stream to shame, he could prolly put out forest fires judging from the turbulent sound of the splashback and duration signifying the vast amount of liquid his bladder can contain",0
445,When Comrade Bernie says “Climate Change” once a paragraph you know it's a fraud.,1
446,Not yet LORD KNOW it ÁLL Demagogué@Jacob_Rees_Mogg Cake&Eat IT Bullsh*teřEtc³ #LIPSTICKTHISPIG⬇️called brexit ÓR WHERE'S THE BREXIT DIVIDEND&CAKE? Do we still hold Áll the cards? So WHY THE ACTUAL fUK ,0
447,Maybe check you went to a legitimate institution if you don't think anthropomorphic global climate change is a thing. I did.,1
448,Which yes those things were def bad but not enough to hate the whole game. Everyone loved extinction and exo zombies/survival. And I only heard praise for the campaigns. AW mp was fast paced which everyone loved and ghosts people still found ways to have fun in the mp,0
450,I don't understand why Faze what to be a villain.,0
451,"We tried to. There's no workable scheme to offer help to. Other counties integrate them, and you know what? Before long they become tax paying citizens and no net loss to society. Just wait till the climate change refugees start coming north...billions of them....",1
452,Not so surreal for anyone working in climate change. Been the case for decades now... ,1
453,No dude because I know the difference between risk mitigation and risk extinction.,0
457,I agree. Climate change ALWAYS happens. It has for millennia.,1
459,Priti patel ain't gonna like this guess she'll have to ban juries as well ,0
460,"She just said a bunch of words and didn't answer the question. My debate teacher in high school would fail me for that answer. Also, remember when Biden shut down the keystone so we had to buy Russian oil instead giving billions to Russia, because “climate change”",1
461,RT WE WILL NOT BE BYSTANDERS WHILE FOSSIL FUELS DESTROY ALL LIFE JOIN US ON APRIL 9TH https://t.c,1
462,"RT Biden can't say “American ingenuity/vaxes saved us, get back to normal!” B/c progressives will say “Only able bodied cis ppl can be normal!” Biden can't say “we'll alleviate gas prices & further isolate Russia by drilling” B/c Slate will say “Biden green lights global warming”",1
464,Lol he passed a climate bill while still doing things to make climate change worse.,1
466,So what. There will be many more while climate change happens. Oh it's not man made it's called Nature.,1
467,Could be but I doubt it. People have been floating eotw prophesies for decades like global warming. Could happen but right now is more fear for compliance. Similar to how a bully would say if you pay him he won't hit you.,1
469,The biggest climate change came from Dora's pussy. A bastard that changed the Greece by destroying it.,0
471,Nah.. this' Age of Extinction,0
472,"RT i had my climate change related breakdown last december, and since then i have resolved to hoping that when the first h",1
473,"RT I tell climate nuts all the time “ taxing us to change the climate is about as effective as what the Aztecs tried” yet lefties and most regular people belive it to be gospel mostly due to 10 years of media brainwashing. The Aztecs sacrificed 80,000 people in 3 days to bring rain.",1
474,"A slight tilt on its axis can change weather. The claim will be climate change causes it, but what comes first the chicken or the egg Tilt? But did humans cause climate change over thousands of years everytime the axis moved or is it just this day & age the reason has changed?",1
475,Oh look Albanese is on #THEIRABC LOL He was doing his really 'natural' 'smile' before he got the first question. Hang on? He launched into some unhinged rant about 'climate' change? WHAT? oh dear.,1
476,"Let me guess, it's either putin, climate change or covid. Oohhh, maybe the vaccinsted. The usual BBC go to things to blame.. ",1
477,RT You care as much about inflation as you do about climate change. You're a complete abomination.,1
480,RT “Akkkkkshually scientists now say climate change causes *fewer* hurricanes”,1
482,RT Oxford Street earlier today Extinction Rebellion are now blocking Trafalgar Sq ,1
484,"I feel more, it's a part of bigger plan when this “emergency” ends, what will be the next one? Smallpox as promised by Gates or end of the world by climate clique?",1
488,"saw a sign in the caf. today that was like ""refuse the bag, save the earth!"" referring to the plastic bags they give us w/ the silverware we need to eat the food & that carries all the extra stuff they give us... ah yes. me refusing 1 (one) plastic bag will reverse climate change",1
489,“Long covid” 😂😂😂😂 or “climate change” you just know they're gonna say that,1
490,Yep and global warming made it snow 39 inches in Tahoe yesterday. ,1
491,I go the totally other way on this ,0
492,Moas extinction when ,0
493,Climate change is so fucked man.,1
495,"We never even had windows , we used to take it in turns standing by the whole on the wall to block the wind No global warming back then they were proper winters But we were happy",1
496,like this whole assignment where we have to write about our life 15 years from now is supposed to be about our career but like how am i supposed to write about something that might not even happen bc of climate change,1
486,Tories drill for worthless fossil fuels that they tell us are dried up and of no use to Scotland. Mmm ,0
232,"but also, even in our horribly inefficient fossil fuel fetishist system run by oil barons, using fossil fuels at the very least gives something using fossil fuels for grifto gives absolutely nothing. it's an absolutely frivolous waste of energy for the sake of wasting it",1
464,"Everyone realizes this is their plan for Climate Change too, right? ",1
590,"Last month, world leaders committed to slashing methane emissions. But one Texas town's experience shows how difficult it can be to stop the production of the potent greenhouse gas  even when it's putting children's health at risk. ",1
348,"London  The Insanity Continues  Check out this completely staged scene...A Man allegedly blown over by ""Hurricane Winds""...Cue Stage 2, The Climate Emergency ",1
286,Who's stepping up to fight for environmental justice and tackle the climate crisis? Give them a shoutout in the comments belowthey deserve it!  ,1
140,"No, not in favor of renewable. This is the plan to reduce America to a dependant nation. The money made by the Elites at the expense of the people is obscene. Remember when Gore said we would be under water from Global Warming then changed to Climate Change. Real scam on America. ",1
123,"If climate change is such a threat, why is Obama buying a Hawaiian oceanside mansion?",1
472,want to know exactly how capitalism is the sole reason climate change will bury us all? here's a thread. ,1
241,"Not true, Check for yourself. No one credible actually says there's a human-caused climate crisis. https://t.co/rFPbo7YMBu If there were, climate action's tiny effect on temp wouldn't help enough to notice. https://t.co/YPJWDwzzpm Surprising verifiable climate facts: ",1
173,The deniers freedom of speech has been a tissue of lies from dawn to dusk that has delayed and thwarted climate action for decades and pushed us into a nightmare world of an ever warming planet Will Musk now give deniers a free run on Twitter to send out their attack dogs,1
535,"I can't escape the feeling, they generally seem to be older or upper middle class, they surely know everyday working people cannot solve climate change by skipping the school run??",1
683,There is no climate emergency. We're lucky to have people like on the frontlines calling out the insanity of climate hysterics. Stop scaring the kids. ,1
673,The president looks intelligent zombie from resident evil extinction ,0
225,"RT It becameGlobal Warming after the Impending Ice Age bullshit form my youth didn't materialize. Then, when shit didn't get warmer as they predicted, it became Climate Change. Because weather is a funny thing. It changes. These people are fkn insane. And they lie.",1
305,My latest roundup of interesting climate science and policy articles ,1
482,"Last night, the IPCC released its most recent report on the impacts of the climate crisis. Australia is a country on the front lines of climate change - this is now clearer than ever before. This thread is a summary of key findings for our beautiful country  #auspol",1
409,"RT (Warning, graphic) Five people are dead from storm caused by climate change. - / 2022 ",1
574,"7.When Thompson's health began to fail in 1978, her family decided to publicize her struggles to help with medical bills. The response they received stunned the family. The more than $15,000 raised helped in her final days. Thompson died at age 80 in 1983. ",0
652,"Catch me in 10 mins on I'll be delving into science policy in the age of Covid and climate change, risk confusion, what the ""shut it all down"" crowd gets wrong, and those awful comments that David Suzuki made the other day. #cdnpoli #bcpoli ",1
466,"War, floods, climate changebut no, this is the lead story on the app. Which becomes more like New Idea every day. ",1
250,"If you're a celebrity or an influencer at this point and you're NOT ever talking about climate crisis, I'm sorry it's getting ridiculous, do your job, WE ALL DO NOT HAVE TIME",1
48,"""This is how we stop climate breakdown. But it won't happen on its own. Asking politely for the ruling class to act is not going to cut it. It will require an extraordinary struggle against those who benefit so prodigiously from the status quo."" ",1
531,#Extinction holidays are big business 7000 to kill an elephant 1000 to kill a giraffe 85% want it banned #BanTrophyHunting NOW @BorisJohnson! Support @CBTHunting ,0
686,"RT You know why I loathe conservatives- They say no to vaccines. They say no to climate change. They say no to a secured future for their own children and grandchildren, never mind yours. That's the epitome of selfishness and narcissism.",1
58,"Today, in a full page ad in the organized by joined 24 other leading businesses across the economy calling on the federal government to ACT NOW on the climate crisis. We have the solutionsand no time to waste. ",1
55,"This is something I am very worried about. Climate change is causing more frequent disasters and disease outbreaks. In response, the rich and powerful will continue to normalize higher and higher rates of death and suffering. We must speak up now. ",1
94," you probably also think that COVID was an accident, that the elections were legit, that global warming is real and there is systemic racism in this country",1
292,Is it bad that I don't actually give a dam how many people die of COVID strains like delta and omicron? The world's overpopulated and all they ever do is go on about the housing crisis and climate change on the news,1
659,"Climate crisis is like James Bond movie and time is running out, warns Boris ",1
191,Imagine how this will look to future generations? Bragging about how much oil is produced despite an obvious climate emergency. Ab and bc ndp would be just the same. Even Obama bragged about drilling for oil. Leaders have failed future generations. ,1
445,"Bill Gates' philanthropic foundation has empowered many humanitarian causes, but because of Bill's contempt for the topic of climate change his influence may prove toxic overall. The problem is not that some billionaires are bad, it's that billionaires have too much power.",1
121,"AND THAT IS WHY THE YOUTH ARE #ANTINATALISM. We didn't choose this miserable life and we will not be forced into handing this waste bucket to offsprings who might die before the age of 18 either to malnutrition, SIDS or CLIMATE CHANGE. ",1
427,"Uninspired 20th-century gas-guzzling carbon emissions-spewing yestercar style that's utterly in denial of the climate emergency, you mean. Come on, Kia. Wake up. ",1
541,RT Re-upping my theory that Extinction Rebellion is a Big Oil plot to indelibly associate climate action with the worst fucking people on the planet. ,1
533,I was just thinking - this WAR is another FIGHT against a different kind of CLIMATE change.,0
206,Capitalism is fuelling the climate crisis. Capitalism can't be reformed to be environmentally friendly. It is like a cancer that exists only to devour its host. ,1
275,ZELENSKY PUSHES CLIMATE CHANGE IN THE MIDDLE OF HIS PSYOP WAR! PROPAGANDA (29TH MAR) ,1
365,Plain and simple: displacement is one of the most devastating human consequences of the climate crisis We cannot wait for tomorrow to act,1
361,Hydrogen: one way  can decrease its dependency on fossil fuels. This week an agreement was signed to build a 500 MW plant in the North Sea - the 1st on this scale globally. The hydrogen will be produced at sea (wind farm) & brought to land via an existing former gas pipeline. ,1
126,It's because they cannot find jobs in Brazil and other countries in South America. It's from climate change.,1
32,Aren't most Europeans green - concerned about climate change? Where are they and why are they not willing to make necessary sacrifices to stick to their available sustainable energy? Reduce dependence on Russian oil/natural gas and help Ukraine?,1
474,"Finally, an Olympic event suited to the ongoing climate crisis ",1
605,Long overdue to lower the voting age to 16. It's young lives we're destroying with criminal climate change policy. Give them a say in their own future.,1
30,Thousands of dead starfish wash ashore on Pembrokeshire coast after stormy weather ,0
