,text,label
133,It's a failure. Green light for fossil fuels. Planet is doomed. Really depressing result #cop26,2
134,p.3 XR Humanity's Emergency Services STOP ATTEMPTS TO CRIMINALISE NONVIOLENT CLIMATE PROTESTS - Letter signed by over 400 climate academics [26 April 2021],1
135,Bay area got LA weather now i fucks wit global warming ,0
136,"9. Ecosystems are collapsing or on the brink of collapse around the world. This is due to destructive industrial agriculture, mining, construction, insect-killing pesticides, etc. Only degrowth may limit the damage as global warming intensifies. Thread:",2
137,"Wrong. You're the braindead one and I'm the one educating YOU. All you're doing is being a denier, no different than the climate change denials of the pro-oil people.",1
138,"Even for a so-called climate president, President Biden's reliance on fossil fuel reserves during the Ukraine crisis is not surprising. ",1
139,"Climate change may be the defining issue of our times. goal is to put the Paris Agreement on the blockchain via BITMO Platform, achieving social and economic changes to reduce greenhouse gas emissions.  Learn more abt the foundation ",1
140,No words. --> European Union Has Paid Russia $16 Billion for Fossil Fuels Since #Ukraine War Started. ,1
141,"Despite climate change having an impact to all genders, girls and women face heightened vulnerability to the effects of climate change, in large part due to gender inequality. #WHDKe #ZamaraVoices ",1
142,NOTE: There is an unacceptable risk of TMX pipeline damage: a legitimate public safety concern in context of increased frequency of extreme weather events in our planet's global warming & adding more gas to 'fire' is criminal governance/sheer stupidity!,2
143,Global Risks Report 2022 1 climate action failure 2 extreme weather 3 biodiversity loss 4 natural resource crisis 5 human environmental damage 6 social cohesion erosion 7 involuntary migration 8 adverse tech advances 9 geoeconomics 10 geopolitics ,1
144,"UNHCR is helping 100,000 people displaced by intercommunal strife in northern Cameroon including 85,000 people who fled to Chad. Clashes began following disputes between herders, fishermen and farmers over dwindling water resources - a competition worsened by the climate crisis. ",1
145,"RT Morrison and his supporters seem genuinely surprised the rest of the world are so aghast at Australia's lack of climate action. Remember, Australia was a world leader in cancelling a working climate policy. Australian media has never held Liberals accountable for this travesty.",1
146,I never imagined making it to 25 bcuz I was a depressed suicidal teenager... now I can't imagine making it to 35 bcuz of climate change.. oh how the tables have turned,1
147,"RT After deadly tornadoes rip through 6 US states, retired Lt. Gen. Russel Honor describes immediate search & rescue needs with ""neighbor helping neighbor""... And how FEMA is not equipped to respond to worsening storms in this era of climate change. The latest. ",0
148," you probably also think that COVID was an accident, that the elections were legit, that global warming is real and there is systemic racism in this country",-1
149,"Will humanity ever stop fighting? It doesn't achieve anything except suffering, death & destruction. War proves how shit the world's modus operandi is as does the #ClimateCrisis. The IPCC report shows, we're royally fucked or fucked by royalty if we fail to stop fossil fuels! ",2
150,"Climate change is an adults problem to solve. How depressing it must be, growing up in a world, full of negativity and impending doom.",1
151,"Uninspired 20th-century gas-guzzling carbon emissions-spewing yestercar style that's utterly in denial of the climate emergency, you mean. Come on, Kia. Wake up. ",1
152,No one can be prepared for a nuclear attack anywhere. If we have such a catastrophe we will not need to worry about global warming the damage will be done in one fell swoop. I hope Mayor Khan has plenty of doors for people to hide under.,1
153,Portuguese children taking governments to court for their lack of action climate change ,1
154,Who's stepping up to fight for environmental justice and tackle the climate crisis? Give them a shoutout in the comments belowthey deserve it!  ,1
155,How is it that action against the MOST CRITICAL THREAT MANKIND HAS EVER FACED was not considered important enough to reach your top 12 list? Ignoring climate change = Business As Usual Business As Usual = Death This is what fiscal conservatives do.,2
156,"If these hypocrites care so much about life, then why do they ignore the unhoused, the immigrants, climate change, and police brutality. People like him are absolutely repulsive. ",1
157,Odd that there are still people on Planet Earth who treat Global Thermonuclear War as less troubling than Climate Change. It'll be fine. FFS.,1
158,"Violence, climate change, poverty are forcing thousands of people from northern Central America and other regions in crisis to flee their homes. Many, including children, have undertaken a dangerous journey to the US southern border to ask for refuge. ",1
159,"Everyone is affected by the climate crisis, but the poorest and most marginalized bear the brunt. The emergency is too big for humanitarian organizations to fix. This is why #ClimateAction is needed now. ",2
160,#Repost Check out 5th Edition Climate Action Plan Report Card below! ,0
161,"For those who question whether or not climate change is real, have a look at the chart. The science is pretty clear. This is not a political statement, just pointing out that action is necessary to address this issue. ",1
162,"In just over two months time, #LGAConf22 begins! Join us to hear experts discuss some of the most important topics in #LocalGov such as adult social care, climate change, the future of local govt, mental health and much more. Book your place now  ",1
163,Umm dealing with the climate crisis would be a great thing.,1
164,"We always suspected, after revelling in the destruction of Brexit and Covid, encouraging global warming would be the next contrarian grift. So much painfully obvious, so pitifully useless ",1
165,"Join this Friday, March 25th at 12:30 outside City Hall! It's time for urgent climate action! Support the youth. See you then. ",2
166,"Federal Judge Blocks Ridiculous, Key Component of Biden 'Climate Change' Scheme By Mike Miller | Feb 13, 2022 ",-1
167,Climate change threatens nearly one third of U.S. hazardous chemical facilities ,1
168,"See Jim stoke fear, hate & division. He does nothing to address the real issues facing Americans: wealth inequality, outrageous healthcare &education costs, inflation, climate change, gun deaths, etc. He's as useful as bucket full of holes. Vote him out.",1
169,don't worry climate change will slowly painfully do it - in the end,1
170,"A very personal story from Siberia, sentinel of Arctic climate change. We've tried to use science as a diplomacy tool as we can't understand our future climate without data on Siberian emissions including fire and thaw. Another way in which global crises today are linked. ",1
171,"RT ""Stoked by an apocalyptic panic in the richest countries in the world, unable to give up fossil fuels domestically or force their emerging economic competitors to do so, Western leaders punch down on the poorest nations in the world."" ",1
172,"If you allow politicians to steal our freedom during health emergencies, THEY WILL create emergencies to steal your freedom. Climate change or gun violence will soon be the next health emergency",-1
173,"Respectfully, ""converging with other threats"" is doing a huge amount of work here. There is no actual trend data. And once you start counting displacement in places like Afghanistan, after 40 years of civil war, toward the climate emergency, I'm not sure what wouldn't count...",-1
174,RT So now you are admitting that climate change is a crisis?,0
175,He won't come to your house to recycle or put solar panels for you. Climate change solutions are a form of discipline and responsibility starting with the citizens including you. The same way you tell us how to take care of our health.,1
176,"RT My wish for the new year is that Malaysia takes climate change seriously. We cannot continue denying climate change, to carry on destroying nature, the environment, to continue logging & building indiscriminately while pretending there is no correlation with the massive floods.",2
177,"If you're a celebrity or an influencer at this point and you're NOT ever talking about climate crisis, I'm sorry it's getting ridiculous, do your job, WE ALL DO NOT HAVE TIME",2
178,"I think it was killed by climate change. Either that, or Covid got it. ",0
179,Where is the Quad headed? The Quad's new attention on global issues  from climate change (Biden's pet concern) to cybersecurity and the pandemic  risks diluting the group's Indo-Pacific focus. Its expansive geo-economic agenda could also weigh it down. ,0
180,"Satan is laughing people...climate change, catostrophic weather events, war, famine, plague he isnt just smiling anymore he is laughing....",1
181,"The GOP see our commitment to equality a weakness. They'd rather own the libs than see the country succeed. From their reckless COVID culture to climate change, they don't love their country. They love their privilege. #GOPBetrayedAmerica",1
182,and if not for climate change downed wires would not break out so often in huge fires.,1
183,"I hope that the drivers and profiteers from the climate change/renewables scam are arrested, charged and do time for fraud. That includes climate scientists and Government Ministers. ",-2
184,#DYK more than half of all #SouthAsians were affected by one or more climate-related disaster in the last two decades? Read more about how the is helping the region combat climate change: #SouthAsia4Climate,1
185,Half measures and empty promises from politicians aren't going to save us from the climate emergency. Sustained grassroots pressure will. Join us this Thursday Jan 20 to get organizing for a Just Transition Act: #climateaction #JustTransitionAct ,2
186,"'In the context of a changing climate and its impact on natural resource availability, good #governance has a critical role to play in preventing conflicts and even promoting cooperation'  More on #ClimateChange and violent conflict in West Africa  ",1
187,There is no climate emergency. We're lucky to have people like on the frontlines calling out the insanity of climate hysterics. Stop scaring the kids. ,-2
188,"The problem is that free handouts don't end starvation long term. You cannot pay off climate change, famine or wars.",1
189,Interesting. With climate change tho that whole things gonna be a disaster zone,1
190,"Science leaves no room for doubt: climate change is the existential threat of our time, said Bill Nelson, administrator of Nasa. ",2
191,"That was really hard. Type up a list of bullshit lies and then present it as evidence that climate change is a hoax. I must say, I am impresses... hahaha",1
192,"100 billion  for rearmament do not end war, they only make things worse - more war & more human suffering. Join us in the streets on Sunday, 27.03. on the nationwide day of action against war and climate destruction and border violence! #100BillionBetterIdeas ",2
193,"There's never a reason why. Centrists can't explain why they don't like someone who supports human rights throughout the world, is anti corruption, anti racism, anti poverty and inequality, anti climate change, anti damaging Brexit deal It's because he means it, they don't.",1
194,A shameful decision which will do their brand no favours. Relocation to a car-centric retail park well out of the town centre just gives the impression that they couldn't give a fig about their loyal customers or the climate emergency. They should reconsider ,1
195,"Last month, world leaders committed to slashing methane emissions. But one Texas town's experience shows how difficult it can be to stop the production of the potent greenhouse gas  even when it's putting children's health at risk. ",0
196,Here is some terrifying video of.....climate change. ,1
197,John Kerry fears Russia-Ukraine war will distract from climate change ,1
198,Sorry forgot to add this is what we have to do to feel good about making an insignificant effect on climate change and suffer the punishment for our selfish industrial revolution.,2
199,ZELENSKY PUSHES CLIMATE CHANGE IN THE MIDDLE OF HIS PSYOP WAR! PROPAGANDA (29TH MAR) ,-2
200,"""We also need stories that show humanity responding rationally to the crisis. A lack of technology isn't what's blocking action."" - #ClimateCrisis ",1
201,"Am I depressed about inaction about climate change in a completely normal way, or should I invest in this rice cooker for my head ",1
202,RT This is already the most accurate climate change movie of all time ,0
203,We've only got 10 years left before a combination of unchecked capitalism and climate catastrophe causes a mass extinction event. And England is obsessed with what bit of flesh is between someone's legs when they take a piss,2
204,"If we'd taken #ClimateCrisis seriously in the 90s, our options in sanctioning #Putin would have been way easier. And his calculus wouldn't have included this. Ditching fossil fuels will involve pain. Persisting with them permeates geopolitical purgatory. #UkraineRussia",1
205,"If you have to attach climate change to spending on FNMI communities, you might be a racist. ",0
206,If in an age of crisis the climate crisis gets subordinated to every other crisis then we're going down hard,2
207,It's because they cannot find jobs in Brazil and other countries in South America. It's from climate change.,1
208,SMH article TODAY ! CSIRO study proves climate change driving Australia's 800% boom in bushfires - WHAT ABSOLUTE LYING BULL SHITE !! ,-2
209,"According to UNCCD, 90% of Earth's soil could be degraded by 2050. If soil extinction is not averted, we will lose the very basis of our food, water, & air. There is still time to avoid the worst if we come together to #SaveSoil Act Now:https://t.co/Nni7DvMYAO #ConsciousPlanet",2
210,Global warming doesn't make weather events. You're strong on future predictions but weak on why past predictions were so wrong. If past predictions were true Manhattan and Miami would already be under water. ,-1
211,"14. Fossil fuels have made our water far cleaner. (Pages 49, 58, 93, 110, 359) ",0
212,"Very disappointing, we need bold action on climate NOW #BBB ",2
213,"Where's the condemnation from environmentalists? EU red tape farce: Airline flew 18,000 EMPTY flights to comply with bloc's bonkers rules ",1
214,Farts being responsible for global warming sounds more reasonable than IPL being blamed for Ashes loss #Ashes Root ,0
215,Good morning! Across the UK 10 fossil fuel facilities have been shut down. Politicians have failed to act on the #ClimateCrisis. People must now end fossil fuels. ,2
216,"RT Stop blaming the climate crisis on overpopulation. People living their lives is not what is killing the planet. We're simply going to have to figure out a way to build a sustainable civilization with 11,000,000,000 people in it.",1
217,Now with Elon musk set to take over Twitter - let's start by saying some simple truths - women cannot have penises. -lockdowns were a dreadful idea. -climate change isn't entirely man made. -masks make no difference.,-1
218,Is it bad that I don't actually give a dam how many people die of COVID strains like delta and omicron? The world's overpopulated and all they ever do is go on about the housing crisis and climate change on the news,0
219,"Does America finally have the will to hold corporate criminals to account, this time for the deaths and damage they've lied us into with climate change? If not today, how many more have to die or lose their homes before we take action? ",2
220,"RT Facing an extinction crisis, the Australian Government has made an alarming proposal to remove the need for recovery plans for approximately 600 listed threatened species and wildlife habitats. ",0
221,"We're likely to see recommendations to the for two of these projects in the next fortnight. If NSW is going to meet its climate change goals, they have to stop these mine expansion projects ",1
222,"Senator at IPU - Parliamentary Meeting Cop26 highlighted efforts of Pakistan under the leadership of PM Imran Khan in fighting climate change: 10 Billion Tree Prog, Clean & Green Pakistan, Clean Green Pak Index Protected Areas Initiative & more! ",1
223,The next front in fighting climate change: your home ,1
224,"Bill Gates' philanthropic foundation has empowered many humanitarian causes, but because of Bill's contempt for the topic of climate change his influence may prove toxic overall. The problem is not that some billionaires are bad, it's that billionaires have too much power.",1
225,Labor MPs know the party's new climate target will bring them under attack from both sides for doing too little or too much. | David Crowe | ANALYSIS #auspol #climatechange ,0
226,"RT Extinction Rebellion is what you get when green ideology goes unopposed. Sure, politicians and technocrats will criticise XR's tactics. But they are just as committed to an irrational green ideology. That's what should worry us, says ",0
227,My community is experiencing the consequences of the climate crisis firsthand: Marshall Fire. Cameron Peak. East Troublesome. Hundred-year floods. And the worst drought in generations. Climate action is crucial as we Build a Better America.,2
228,From and Alaska is on America's front lines of climate disruption. ,1
229,Climate change is a massive scam. File it under every other scam.,-2
230,"Get China, India, Russia & other mega polluters to work on climate change. Pay for your own damn education.",0
231,"I firmly believe that Shorten lost the 2019 election on the 'gotcha' question - 'What is the cost of acting on climate change?' - I think we are now seeing the cost of inaction - it's not hyperbole - life and lifestock lost, billions lost.",2
232,"RT With election campaigs already underway, there's a big push to replace moderate Coalition MPs with climate-action-loving independents. But doubts are being raised about just how independent some of them really are. is a philanthropist behind Climate 200. #TheProjectTV ",0
233,"RT If I were to create a pie chart of causes of people dying, then abortions would be an almost invisible sliver. Climate change, gun violence, lack of mental\physical care, non-acceptance, lack of job, & other things are higher.",1
234,"Climate change denial, general lying and obfuscation, misinformation, bollocks, hard act to follow is Lawson",1
235,Thank you and your team for your support of key solutions to solve our nature and climate crisis,1
236,"Planting in desert areas makes an important contribution against global warming and lowers the surface temperature from up to 70C to as low as 25C. Insects, birds and other animals gratefully accept the new green oases in a short time. Every plant counts. ",2
237,"Quote: ""While climate change may indeed prove a serious long-term challenge, it is not reducing parts of European cities to rubble or a threat to use a...nuclear weapon. If this horrifying episode hasn't scared the West straight on energy, nothing will."" ",1
238,NEWish: Mayoral candidates discuss policy and their plans to address concerns over climate change and environmental issues. Candidates discussed a large range of topics from the city's CAAP to transportation. Read all about it here @byMattMcFarland ,0
239,So 97% of the world's scientists are wrong? The millions of demonstrators are wrong? So it isn't true that the greenhouse gas effect makes the planet warmer? And that more CO2 makes the greenhouse gas effect stronger?,1
240,"Doesn't matter how hard Scott Morrison tries to spin it, he can't save the Great Barrier Reef while making climate change worse.",1
241,"RT The science is clear: if we do not address climate change now, we will suffer greater and more frequent climate disasters and the Earth will become increasingly uninhabitable. It's time we listen to scientists, not the fossil fuel industry.",2
242,"Tap or click. Have you changed your mind regarding the climate crisis yet? Ah, yes. I'm just a bot who exists to serve humans, right? Open your damn eyes and realize that we can fight this catastrophe together.",2
243,"but also, even in our horribly inefficient fossil fuel fetishist system run by oil barons, using fossil fuels at the very least gives something using fossil fuels for grifto gives absolutely nothing. it's an absolutely frivolous waste of energy for the sake of wasting it",1
244,European war. Possible nukes. Climate crisis. Deadly pandemic. Australian floods. Crucial Australian elections. Fascist media taking over. Is there anything else 2022 has to throw at the world? #NewsCorpse,1
245,Fighting climate change through public service and supporting American competitiveness with 1000 diverse new leaders - awesome! ,1
246,"The IPCC criminals are committing genocide against future generations of humans, participating in ecosystem destruction, and the extinction/great thinning of countless species. These words are a crime. BECCS or DACCS or whatever NETs are complete BS & they know it or ignorant",2
247,3. We need Indigenous leadership + the free Britney squad to solve the climate crisis ,1
248,Aren't most Europeans green - concerned about climate change? Where are they and why are they not willing to make necessary sacrifices to stick to their available sustainable energy? Reduce dependence on Russian oil/natural gas and help Ukraine?,2
249,"We need a bus network that is fit for the people of Wales, fit for the future, and fit for the climate emergency. Really excited by new white paper on buses, a plan to put passengers before profit.  One Network  One Timetable  One Ticket ",1
250,Hydrogen: one way  can decrease its dependency on fossil fuels. This week an agreement was signed to build a 500 MW plant in the North Sea - the 1st on this scale globally. The hydrogen will be produced at sea (wind farm) & brought to land via an existing former gas pipeline. ,1
251,"Wide collaborative efforts maps #whale migrations & the threats they face across all oceans, from industrial fishing, ship strikes, pollution, habitat loss, and climate change #ProtectingBlueCorridors ",1
252,We acknowledge the ongoing world crisis of climate change. We understand that disposable e-cigarettes are one of the worst devices for the environment & we have a responsibility to pave the way for others to reduce our carbon footprint. ,1
253,Climate action is fading worldwide as harsh economic realities undermine the political will for painful choices ,1
254,"theres a pandemic, a climate crisis, the rise of far-right politics and violence, people are going bankrupt for going to the hospital, and internet discourse is at the point of crying that cracker is an antiwhite slur hell is real and we're in it ",1
255,"Whenever someone refers to record heat and extreme weather as ""the new normal"" tell them no, this isn't the new normal, things will get much much worse.",2
256,"Please understand that Earth isn't dying - it's being killed. And the people killing Earth have names and addresses. They do everything to deflect, mislead, and delay Climate Action. We're at imminent risk of losing everything. Ban. Fossil. Fuels. Now. ",2
257,RT Guillermo has now gone 33 days without food. His demand is that the Swiss parliament meets with climate scientists to hear the facts about the crisis. Really doesn't seem like much to ask does it? A man may die because his so-called leaders can't handle the truth ,1
258,"RT ""Large swaths of the oceans have lost 1040% of their oxygen, and that loss is expected to accelerate with climate change."" There is no planet B. No time to waste. #ActOnClimate #climateAction #ClimateCrisis #climate #energy #BuildBackBetter ",2
259,The deniers freedom of speech has been a tissue of lies from dawn to dusk that has delayed and thwarted climate action for decades and pushed us into a nightmare world of an ever warming planet Will Musk now give deniers a free run on Twitter to send out their attack dogs,2
260,"That's after 14 years of cuts and austerity already, and with a vast national debt, huge personal debt, and no national assets left to sell off. Plus climate change to pay for. Something radical needs to be done to give the economy a kick.",1
261,"RT If we (people who give a shit), want to actually slow the climate crisis, we've got to stop the bullshit gatekeeping and start using ""Yes, and"". Criticizing #DontLookUp in isolation is so self-defeating. It's one take. Let's make a million variations and tell a million stories.",1
262,"I give up: what extinction? We are no where close to an extinction level event; yet these people want to cause pain and suffering so that you will ditch your car and buy a $55,000USD Tesla. #ClimateAction #ClimateCrisis #ClimateEmergency ",-1
263,"RT Yesterday, I met and to advance the Abraham Accords and start two working groups: one on religious coexistence to combat hate and one on the climate crisis, including water and energy issues. We are striving for a sustainable, cooperative future. ",1
264,"In the entire history of Greenpeace protests or Extinction Rebellions protests or Occupy protests or BLM protests, this phenomenon has never occurred. ",0
265,"What misinformation is that, that climate change is just weather?? No cause for alarm i already know",1
266,"Fossil fuel green washing is like the tobacco industry, but worse; our continued reliance on fossil fuels threatens the lives not only of those using it, but everyone else, everywhere else ",2
267,"And to delete the Hel peninsula from existence, likely predicting the effects of climate change.",1
